Empresa,Area,Ubicacion,Descripcion
Canaire inversiones,Agricultura / Pesca / Ganaderia,"Tonacatepeque, San Salvador",Se dedica a venta compra renta de bienes y raices
Grupo Mallo S.A. de C.V.,Agricultura / Pesca / Ganaderia,"San Salvador, San Salvador","Somos una empresa comprometida con el desarrollo agropecuario de El Salvador desde el ano 1992. Contamos con una linea completa de medicina veterinaria, destinadas a satisfacer las necesidades del sector avicola, porcino, ganadero, equino y animales de compania. Distribuimos una amplia variedad de accesorios veterinarios, accesorios para mascotas, accesorios para inseminacion artificial en cerdos y equipos para la tecnificacion y automatizacion de instalaciones porcinas entre otros. Creemos en el trabajo en equipo y la importancia que tiene para nuestra compania el Recurso Humano, por esto nos preocupamos por el bienestar de nuestros empleados contribuyendo con su desarrollo profesional y humano."
Virmax Mesoamerica,Agricultura / Pesca / Ganaderia,"Metapan, Santa Ana",Empresa exportadora de cafe especial.
APACHE S.A. DE C.V.,Agricultura / Pesca / Ganaderia,"San Salvador, San Salvador","Fue fundada en 1973, Dedicada al cultivo de cafe, que cubre ya cinco generaciones Encargandonos de la siembra, el corte, tostado, empacado, la comercializacion de nuestro cafe y preparacion de cafe especiales."
PROBISEGE,Agricultura / Pesca / Ganaderia,"San Salvador, San Salvador",Proveer bienes al Estado
Motores y Maquinaria de El Salvador SA de CV,Agricultura / Pesca / Ganaderia,"Sonsonate, Sonsonate","Somos una empresa dedicada a la venta al por menor y mayor de equipos agroindustriales como: molino de nixtamal, picadoras de zacate, desgranadoras de maiz, motores electricos, diesel y gasolina, etc."
Cafe Tuxpal,Agricultura / Pesca / Ganaderia,"San Salvador, San Salvador","Somos una empresa con mas de 150 anos de trayectoria en la industrai del cafe. Somos una empresa verticalemtente integrada desde la semilla hasta la taza, con operaciones en fincas de cafe, beneficio de cafe, tostaduria de cafe (Cafe Tuxpal) y tiendas de cafe (Viva Espresso)."
Red Fox Las Mercedes S.A. de C.V.,Agricultura / Pesca / Ganaderia,"Santa Ana, Santa Ana",Red Fox Las Mercedes S.A. de C.V. es una empresa agricola que se dedica al cultivo y exportacion de plantas ornamentales.
Agroservicio El Campesino,Agricultura / Pesca / Ganaderia,"Metapan, Santa Ana",Empresa dedicada a la comercializacion de insumos agricolas y productos y concentrados para animales.
SUKARNE EL SALVADOR,Agricultura / Pesca / Ganaderia,"San Salvador, San Salvador","Venta de productos carnicos por mayor, contamos con planta de produccion en Mexico y Centro America, nos especializamos en la comercializacion de productos de la mas alta calidad."
Corporacion Tecnidiesel S. A. de C. V.,Agricultura / Pesca / Ganaderia,"San Salvador, San Salvador","Empresa dedicada , a la veta de maquinaria pesada , renta de tractores , servicio de mantenimientos correctivos y preventivos de maquinaria y plantas generadoras , laboratorio de inyeccion y reconstruccion de motores."
"Topacio, sociedad anonima de capital variable",Agricultura / Pesca / Ganaderia,"San Salvador, San Salvador","Ejercicio de agricultura, ganaderia y comercial. Impotar, exportar y distribuir todo tipo de materiales agricolas. Cultivo de toda clase de productos agricolas y su comercializacion. Comprar y vender toda clase de valores y participaciones, creditos, certificados o titulos."
INDUSTRIA CARNICA SALVADORENA S.A DE C.V,Agricultura / Pesca / Ganaderia,"Opico, La Libertad","Industrias de alimentos, encargada del procesamiento de carne de cerdo, a manera de posicionarse como el rastro #1 en el pais en materia de carne de cerdo."
"HAKUNA MATATA, S.A. DE C.V.",Agricultura / Pesca / Ganaderia,"San Julian, Sonsonate","Es una empresa innovadora en la agricultura tradicional del pais, somos pioneros en la implementacion de tecnologia en los cultivos y principalmente en el desarrollo de hidroponia a gran escala. Actualmente se produce lechugas (romana, escarola, y baby lechuga), guisquil, kale, chile jalapeno, ejote, hierbas aromaticas."
