Empresa,Area,Ubicacion,Descripcion
La Siembra,Agricultura / Pesca / Ganaderia,Tamaulipas,Empresa dedicada al sector agricola
Confiencial,Agricultura / Pesca / Ganaderia,Ciudad de Mexico DF,Empresa comercializadora de productos agricolas organicos.
"Nangaru, S.A. de C.V. (BravoAg)",Agricultura / Pesca / Ganaderia,Ciudad de Mexico DF,Empresa trasnacional de Agroquimicos.
Agrodesarrollos tecnicos y comerciales SA de CV,Agricultura / Pesca / Ganaderia,Sinaloa,"Somos una empresa dedicada a apoyar y desarrollar proyectos agricolas tecnicos y comerciales para importadores de productos mexicanos alrededor del mundo y proveer equipos para el control de la cadena de frio al ramo agricola, acuicola, ganadero, farmaceutico y otros."
Agrosistemas Bajio,Agricultura / Pesca / Ganaderia,Queretaro,"Asesoria y Proyectos en Invernaderos, Riego y Semillas"
"Agros Nacional, Sa. de CV.",Agricultura / Pesca / Ganaderia,Sinaloa,Empresa dedicada a la venta de insumos Agricolas.
Agronegocios RALE SA DE CV,Agricultura / Pesca / Ganaderia,Sinaloa,"AGRONEGOCIOS RALE SA DE CV Es una empresa mexicana dedicada a la comercializacion de fertilizantes, semillas, agroquimicos y todo tipo de insumos agricolas. Contamos con personal profesional comprometido y calificado en conocimientos y experiencia para ejercer sus labores con una maxima eficiencia."
"Vercro de Mexico, S.A. de C.V.",Agricultura / Pesca / Ganaderia,"Uruapan, Michoacan",Comercilaizadora de productos agropecuarios y aquellos destinados a la construccion y mantenimiento.
Agrocation s.a. de c.v.,Agricultura / Pesca / Ganaderia,"Tepic, Nayarit","Somos una empresa dedicada a la elaboracion, representacion y distribucion de productos agroquimicos convencionales, biologicos y organicos."
General de Agroservicios,Agricultura / Pesca / Ganaderia,"Nuevo Laredo, Tamaulipas","Piden dinero!!!!!!!!!!!!!!!!!!!!!!!!!!!!!!!!!!!!!!!!!!!!!!!!!!!!!!!!!!!!!!!!!!!!!!!!!!!!!!!!!!!!!!!!! Contamos con una gran variedad de productos y soluciones para todo tipo de cultivos Ofrecemos soluciones para el optimo control de plagas y enfermedades. Fertilizantes, foliares, herbicidas, fungicidas e insecticidas. Distribuimos productos de las mejores marcas comerciales en el mercado."
Agroquimica de Apatzingan,Agricultura / Pesca / Ganaderia,"Morelia, Michoacan","nos dedicamos a la venta de agroquimicos y el objetivo es dar un servicio al productor de calidad y al mejor precio, agroquimica de apatzingan es una empresa que nace en la ciudad de Apatzingan michoacan y al cabo de los anos se a posicionado en todo el estado como una de las empresas con mejores oportunidades."
Agricola del Valle del Mayo,Agricultura / Pesca / Ganaderia,"Navojoa, Sonora",Somos un semillero que nos dedicamos a la produccion de plantula de cualquier tipo de cultivo para su trasplante ya sea para cultivos en invernadero o en produccion a cielo abierto.
Agrotrop,Agricultura / Pesca / Ganaderia,Yucatan,Comercializadora de Granos en el Sureste
Agrovalles suc refugio,Agricultura / Pesca / Ganaderia,San Luis Potosi,"Venta de agroquimicos, fertilizantes y semillas. Asesoria tecnica especializada."
Inversiones Agricolas Llano Verde,Agricultura / Pesca / Ganaderia,"Ensenada, Baja California","Inversiones Agricolas Llano verde, empresa dedicada a la produccion y comercializacion de productoa agricolas"
Agronomos AC,Agricultura / Pesca / Ganaderia,Tamaulipas,Agronomia
"Agro Lerma Implementos, SA de CV",Agricultura / Pesca / Ganaderia,"Zamora, Michoacan","Distribuidor autorizado de la marca John Deere. Maquinaria agricola, tractores e implementos. La Filosofia esta basada en cuatro valores universales: Calidad, compromiso, Integridad e Innovacion. Nuestros productos y servicios contribuyen a satisfacer las necesidades basicas del genero humano: alimento, cobijo y transporte."
AgroFOPSA,Agricultura / Pesca / Ganaderia,"Lagos de Moreno, Jalisco",Empresa dedicada a la produccion de pollo en aparceria con Bachoco
Agro-Jardin de los Altos,Agricultura / Pesca / Ganaderia,"Zapotlanejo, Jalisco","Venta y Reparacion de Implementos para la Jardineria, Agricola y Forestal. (Motosierras-Desbrozadoras-Podadoras ,entre otros)"
Productos Braimar,Agricultura / Pesca / Ganaderia,"Villaflores, Chiapas",Empresa agricola dedidaca a la produccion y comercializacion de productos agricolas.
Agrifrutas S.P.R de R.L. de C.V,Agricultura / Pesca / Ganaderia,"Zamora, Michoacan","Empresa dedicada a la agricultura, en el ramo del cultivo y comercializacion de berries."
Agro UX,Agricultura / Pesca / Ganaderia,Ciudad de Mexico DF,Fabricacion y Comercializacion de Agroquimicos Organicos y Biologicos
Agroinsumos Monte,Agricultura / Pesca / Ganaderia,Chiapas,"Proveeduria de insumos agricolas, instalacion de invernaderos"
Agro Industrias 2000,Agricultura / Pesca / Ganaderia,Ciudad de Mexico DF,"Fundada en 1980. Empresa dedicada a la comercializacion de productos quimicos para la industria alimenticia humana, animal y la agricultura."
Agroquimicos,Agricultura / Pesca / Ganaderia,Coahuila,Comercializadora de Productos quimicos
AgroTecnaal,Agricultura / Pesca / Ganaderia,Jalisco,Venta de extrctos organico para el campo
Agro Sofom SAPI de CV Sofom ENR,Agricultura / Pesca / Ganaderia,"Guadalajara, Jalisco","AGRO SOFOM SAPI DE CV SOFOM ENR es un conjunto de 8 de los comerciantes mas importantes del mercado de abastos de Guadalajara que logran obtener recursos de programas agricolas federales para el apoyo del sector rural, agricola, ganadero e industrial para la adquisicion de bienes muebles. Trabajamos diariamente para ofrecerle un plan a su medida. Buscamos brindar un medio seguro que facilite el repunte empresarial y la satisfaccion personal de nuestros clientes, este es nuestro motivo y razon de existir. Contamos con recursos FIRA a tasa preferencial, esto le permitira incrementar sus beneficios reflejandose en sus utilidades. Algunos de nuestros productos son ; Arrendamiento puro, arrendamiento financiero, lease back, financiamiento a plazos,entre otros."
Industria de Alimentos,Agricultura / Pesca / Ganaderia,Michoacan,Industria dedicada a la Manufactura de Alimentos.
Agroinnova Centro Impulsor De Negocios S.P.R De R.L,Agricultura / Pesca / Ganaderia,Hidalgo,Los solicitantes deben contar con estudios profesionales concluidos preferentemente titulados. Prestar servicios a comunidades indigenas de la Huasteca Hidalguense (Yahualica). Experiencia en manejo de Maiz. Experiencia en capacitacion en paquetes tecnologicos de maiz de temporal. Eventual (6 meses). Horario 9:00  17:00 Sueldo a tratar. Preferente ser del estado de Hidalgo (region de la Huasteca Hidalguense).
Agriprom S.P.R. de R.L.,Agricultura / Pesca / Ganaderia,"Matamoros, Tamaulipas","Sociedad de Produccion Rural dedicada a la produccion, acopio y comercializacion de granos en la zona Noroeste de Tamaulipas."
Agroindustrias Gemso SA de CV,Agricultura / Pesca / Ganaderia,"Queretaro, Queretaro",Invernaderos de alta tecnologia
Massey Ferguson,Agricultura / Pesca / Ganaderia,Oaxaca,Compra y venta de maquinaria agricola.
Agroallende,Agricultura / Pesca / Ganaderia,"San Miguel de Allende, Guanajuato",Produccion y Comercializacion de verduras solo para exportacion y para el uso industrial
Agricola Paredes S.A. de C.V.,Agricultura / Pesca / Ganaderia,Sinaloa,"Agricola Paredes es una empresa familiar establecida en el Valle de Culiacan desde 1982, actualmente produce, empaca y exporta todos su productos a Estados Unidos y Canada el 80% de su produccion de hortalizas. Todos nuestros productos son producidos y empacados utilizando la mas alta tecnologia disponible, atraves de seleccionadoras electronicas para diferenciar tamanos y colores. Debido a la importancia de la inocuidad e integridad de los productos, nuestra empresa cuenta con las certificaciones necesarias para que el cliente tenga la certidumbre de que nuestros producto es sano e inocuo. Ademas buscando poder brindar la calidad y constancia de abastos a nuestros clientes, nos hemos ido adaptando a diferentes medios de produccion."
Asesoria en Medicina y Bioseguridad Veterinaria,Agricultura / Pesca / Ganaderia,Queretaro,AMEBIVE es una empresa con 5 anos de experiencia en consultoria y ventas en el sector pecuario. Principalmente en ganado Bovino. Disenamos programas de bioseguridad pecuaria
Ingenio San Francisco Ameca S.A de C.V,Agricultura / Pesca / Ganaderia,"Ameca, Jalisco","Politica de Calidad Para Beta San Miguel, calidad significa dar siempre a nuestros clientes los productos y el servicio que esperan, cubriendo sus necesidades de calidad e inocuidad buscando en todo momento superar sus expectativas. Todos estamos comprometidos con el cumplimiento de los objetivos de calidad y la mejora continua de los procesos, aumentando asi la preferencia de nuestros clientes."
Asociacion Mexicana de Engordadores de Ganado Bovino Ac.,Agricultura / Pesca / Ganaderia,Ciudad de Mexico DF,"La Asociacion Mexicana de Engordadores de Ganado Bovino, se fundo en el seno del CNA, con el fin de organizar a los productores mexicanos dedicados a la engorda de ganado bovino en corral, buscando la integracion de la cadena, actividad fundamental en el sector agro alimentario del pais."
Laboratorio de Constatacion Agroindustrial SA de CV,Agricultura / Pesca / Ganaderia,Ciudad de Mexico DF,LCA es una laboratorio dedicado a realizar analisis de muestras de giro agropecuario
Tecnomec Agricola S.A de C.v,Agricultura / Pesca / Ganaderia,Aguascalientes,"Empresa del sector Metal-Mecanico Orgullosamente Hidrocalida desde hace 24 anos,dedicada a la venta y produccion de Maquinaria Agricola e Industrial Fabricada bajo las mas Estrictas Normas de Calidad para Satisfacer a sus Clientes del Mercado Nacional e Internacional."
Rancho San Jose Del Llano,Agricultura / Pesca / Ganaderia,"Huimanguillo, Tabasco","Empaque, exportacion y comercializacion de frutas y verduras"
Deportes El coyote S de RL de CV,Agricultura / Pesca / Ganaderia,"Veracruz, Veracruz",Tienda deportiva
Avocados SA de CV,Agricultura / Pesca / Ganaderia,"Uruapan, Michoacan",Empresa de giro industrial
Pay Empleos,Agricultura / Pesca / Ganaderia,"Benito Juarez, Ciudad de Mexico DF",Asesoria en factor humano y reclutamiento y seleccion de personal
Baja Resources SA CV,Agricultura / Pesca / Ganaderia,Baja California Sur,"Somos una empresa localizada en Todos Santos Munic. de La Paz BCS. Nos dedicamos a la siembra y exportacion de mini vegetales tipo gourmet, asi como chiles, hierbas, flores y proximamente cultivos bajo invernadero e hidroponia."
Frutos de Huerta Real SPR de RL,Agricultura / Pesca / Ganaderia,Puebla,"Actividad: Siembra, Cultivo y cosecha de productos alimenticios en Invernaderos"
Productora de Flores,Agricultura / Pesca / Ganaderia,Puebla,Somos productores de flores
Zucrum Internacional S.A. de C.V.,Agricultura / Pesca / Ganaderia,"Culiacan, Sinaloa",Zucrum Internacional S.A. de C.V. es una empresa que se dedica al Envasado de Azucar.
AGROPARQUE DE YECAPIXTLA SAPI DE CV,Agricultura / Pesca / Ganaderia,"Cuautla, Morelos","EMPRESA DEDICADA A LA PRODUCCION EN INVERNADERO Y A CIELO ABIERTO DE AGUACATE, NOPAL, MAIZ, HIGO, EJOTE ENTRE OTRAS. ADEMAS DE ORIENTAR AL AGRUPAMIENTO DE LOS PRODUCTORES CON EL OBJETIVO DE INCREMENTAR EL INDICE DE PRODUCCION, REDUCIR COSTOS, MEJORA DE PROCESOS, Y DESARROLLAR NUEVOS CANALES DE DISTRIBUCION."
BIOLOGICS PRODUCTS,Agricultura / Pesca / Ganaderia,"Guadalajara, Jalisco","La solucion natural para el tratamiento ecologico de aguas residuales, malos olores, desechos organicos, mejoramiento de suelos agricolas, cuerpos de agua contaminados, drenajes, trampas de grasa, carcamos, fosas septicas, banos portatiles, lagunas de oxidacion, entre otros."
Siniestros,Agricultura / Pesca / Ganaderia,"Culiacan, Sinaloa","Empresa muy bien establecida en el sector de agricultura, solicita auxiliar contable con experiencia en Captura General de movimientos, Conciliaciones Bancarias, presentacion de Impuestos estatales y federales asi como presentacion de informativas etc."
Naranjas Tamez,Agricultura / Pesca / Ganaderia,"Allende, Nuevo Leon","Empresa comercializacion de Citricos, principalmente Naranjas, Toronjas y Mandarinas, principales clientes Walmart, Soriana. Se comercializa los productos en diferentes empaques y a granel."
VANILLA AND SPICES,Agricultura / Pesca / Ganaderia,"Gutierrez Zamora, Veracruz","ESPECIALISTAS EN EL LA PRODUCCION, BENEFICIADO DE VAINILLA, ELABORACION DE EXTRACTOS, LICORES. BENEFICIADO DE PIMIENTA, ELABORACION DE MERMELADAS, RECORRIDOS EN LAS PLANTACIONES."
CARNES FINAS SAN JUAN,Agricultura / Pesca / Ganaderia,"Monterrey, Nuevo Leon",EMPRESA %100 REGIOMONTANA.
CAYENNE EXPRESS SA DE CV,Agricultura / Pesca / Ganaderia,"Cajeme, Sonora","Actividad agricultura y empaque de citricos ( mandarina) del valle del yaqui, cuenta una plantilla laboral de mas de 100 trabajadores en el valle del yaqui."
Magdalena Covarrubias Sanchez,Agricultura / Pesca / Ganaderia,"Comala, Colima","Empresa dedicada a la produccion y venta de productos agricolas y ganaderos en la region de colima y su alrededores desde hace ma de 10 anos, cuanta con 10 empleados"
TEPEYAC,Agricultura / Pesca / Ganaderia,"Tepic, Nayarit","Es una empresa dedicada a la comercializadora de fertilizantes y agroquimicos de la marca Tepeyac, sus principales clientes son del sector primario, es una empresa lider en el mercado, con estabilidad financiera."
NORMA LORENA SERRANO RAMOS,Agricultura / Pesca / Ganaderia,"Tlajomulco de Zuniga, Jalisco","Terreno agricola adecuado para ganaderia, no cuenta con areas de riego pero puede tener multiples usos debido a la riqueza del suelo y la fertilidad de la region"
La Cumbre,Agricultura / Pesca / Ganaderia,"Tlajomulco de Zuniga, Jalisco","Agroacuicola Integral La Cumbre, S.C. de R.L. de C.V., es una Sociedad Cooperativa con personalidad juridica propia, conformada en el 2008 e integrada por familiares y personas de diferentes profesiones, que integran un equipo de trabajo comprometido con el desarrollo rural sustentable, con vision de largo alcance, involucrados con la Agricultura Organica como una forma diferente de apoyar la produccion de alimentos organicos."
Equipos Agropecuarios,Agricultura / Pesca / Ganaderia,"Monterrey, Nuevo Leon",Empresa dedicada al comercio de productos de character agropecuario y/o agroindustrial.
Jackson Inc.,Agricultura / Pesca / Ganaderia,---,Jackson Inc.Jackson Inc.Jackson Inc.Jackson Inc.Jackson Inc.Jackson Inc.Jackson Inc.Jackson Inc.Jackson Inc.Jackson Inc.Jackson Inc.Jackson Inc.Jackson Inc.Jackson Inc.Jackson Inc.Jackson Inc.Jackson Inc.Jackson Inc.Jackson Inc.Jackson Inc.Jackson Inc.Jackson Inc.Jackson Inc.Jackson Inc.Jackson Inc.
PAPAS DANY,Agricultura / Pesca / Ganaderia,"Puebla, Puebla","Empresa ubicada en el estado de Puebla, dedicada a la siembra, cosecha y venta de papa en diferentes estados de la Republica con mas de 20 anos de experiencia."
Avi-G,Agricultura / Pesca / Ganaderia,"Zapopan, Jalisco",Es un establecimiento agropecuario para la cria de aves de corral.
ORGBEN,Agricultura / Pesca / Ganaderia,"Cuautla, Morelos","Nos dedicamos a la produccion de plantas acuaticas de ornato para aquascaping y para estanqueria decorativa externa, asi como plantas de flores tropicales."
Olga Patricia Torres Ortiz,Agricultura / Pesca / Ganaderia,"Boca del Rio, Veracruz","Empresa lider en el mercado, dedicada a la engorda de ganado con mas de 20 anos en el mercado, contamos con mas de 100 trabajadores y especialistas en nuestro giro."
Rancho Calderon,Agricultura / Pesca / Ganaderia,"Guadalajara, Jalisco",Nuestra empresa es una compania dedicada a la produccion y venta de flores y plantas de ornato anuales y de temporada en Mexico. Contamos con 14 sucursales a nivel Nacional. Somos lider en la produccion de Nochebuena en diferentes variedades y presentaciones. Contacto Matriz en Guadalajara.
LACTOPECUARIA,Agricultura / Pesca / Ganaderia,"Cajeme, Sonora","EMPRESA FORMADA DESDE EL ANO 2005. NOS DEDICAMOS A LA PRODUCCION DE LECHE, ASI COMO AL GIRO AGRICOLA DENTRO DE LA REGION DEL YAQUI Y MAYO."
AGROBAEZA,Agricultura / Pesca / Ganaderia,"Dolores Hidalgo Cuna de la Independencia Nacional, Guanajuato","Rancho San Vicente es una empresa de plantacion de brocoli localizada en Rancho San Vicente, CLF1400000KVA 15 y MULTI 0000SEC 123, San Luis de la Paz-Dolores Hidalgo, GTO. CP. 37800. Es una organizacion dedicada a la produccion de brocoli."
xipehua,Agricultura / Pesca / Ganaderia,"Queretaro, Queretaro","SIEMPRA, COSECHA, VENDE FRUTA................................................................................................................................................................................................................................................................................................................................................................................................................................................."
NUSEED MEXICO SA DE CV,Agricultura / Pesca / Ganaderia,"Zapopan, Jalisco","Nuseed es una empresa con sede en Australia y actualmente comercializa semilla de sorgo, girasol y canola a mas de 30 paises alrededor del mundo. Las oficinas de Nuseed Mexico fueron instaladas en 1990 y dependen directamente de las oficinas de Chigago Illinois."
SATURNINO CAMPOY RAMOS,Agricultura / Pesca / Ganaderia,"Hermosillo, Sonora",CONSULTORIA EMPRESARIAL EN PROYECTOS COMERICALES E INDUSTRIALES DEDICADOS EN EL ENTORNO ECONOMICO DEL NOROESTE DE MEXICO Y ESTADOS VECINOS DEL TERRITORIO
DOG&VET,Agricultura / Pesca / Ganaderia,"Alvaro Obregon, Ciudad de Mexico DF","Clinica Veterinaria dedicada a las pequenas especies, tenemos todos los servicios para atender a los perros y gatos. Servicio de laboratorio clinico, quirofano, etc"
El navegante,Agricultura / Pesca / Ganaderia,"Iztapalapa, Ciudad de Mexico DF","Distribuidor de Pescados y Mariscos, area metropolitana, con mas de 16 anos de experiencia, siendo una empresa lider en el mercado, surtimos a hoteles y restaurantes."
Agro productos Gonzalez,Agricultura / Pesca / Ganaderia,"Parras, Coahuila","Empresa Nacional dedicada a la venta de agroquimicos y produccion de hortalizas, frutas y forrajes. Asesoria Tecnica y supervision en campo."
Ranch Depot S.A. de C.V.,Agricultura / Pesca / Ganaderia,"Tlajomulco de Zuniga, Jalisco","Venta de todo articulo para caballos, rancho, veterinaria, ropa, sombreros, remolques, articulos de higiene para los caballos, alimento para todo tipo de animales."
Desamex,Agricultura / Pesca / Ganaderia,"Puebla, Puebla",Desarrolladora agricola exportadora de granos organicos certificados.
ULTRACONGELADOS MEXICO SA DE CV,Agricultura / Pesca / Ganaderia,"Benito Juarez, Quintana Roo","COMPRA Y VENTA DE PRODUCTO FRESCO, SECO Y CONGELADO PRA LA VENTA A MAYOREO Y MENUDEO"
Ultra Riegos de la Laguna,Agricultura / Pesca / Ganaderia,"Torreon, Coahuila","Somos una empresa familiar enfocada en el sector agricola que busca a traves de disenos eficientes y con tecnologia de punta, el buen manejo y ahorro del agua para el riego de cultivos."
AGRICOLA AM MEX S DE RL DE CV,Agricultura / Pesca / Ganaderia,"Navojoa, Sonora","Somos una Empresa Productora , Comercializadora y Exportadora de productos agricolas en general producimos bajo estrictos convenios con nuestros aliados y proveedores para llevarle un producto de calidad y exportacion para el mundo ."
SERVICIOS INTEGRALES SANTA FE S.A. DE C.V.,Agricultura / Pesca / Ganaderia,"Torreon, Coahuila",Empresa dedicada a ofrecer servicios referentes a la crianza y desarrollo de ganado bovino. Ademas de cultivo y cosecha de semillas para alimento de ganado.
JADE TROPICAL S.A DE C.V.,Agricultura / Pesca / Ganaderia,"Mazatlan, Sinaloa","Empresa del giro alimenticio dedicado a la siembra y exportacion de chiles, somos una empresa que procuramos cumplir con lo mas estrictas normas y estandares de calidad en nuestro cultivos."
JAMTER PACIFIC & GULF,Agricultura / Pesca / Ganaderia,"Puebla, Puebla","SOMOS UNA EMPRESA QUE SE DEDICA A LA VENTA DE PESCADOS Y MARISCOS GOURMET AL MAYOREO, A COMERCIOS COMO RESTAURANTES, HOTELES, ETC. COMPROMETIDOS CON LA SATISFACCION DE NUESTROS CLIENTES BUSCAMOS SIEMPRE BRINDAR LA MEJOR CALIDAD DE NUESTROS PRODUCTOS."
SAN PEDRO FEED SALT AND MINERAL COMPANY SA DE CV,Agricultura / Pesca / Ganaderia,"Ecatepec de Morelos, Estado de Mexico","PRESTACION DE SERVICIOS A LA GANADERIA, ELABORACION DE ALIMENTOS Y SERVICIOS VETERINARIOS"
FONDO DE ASEGURAMIENTO AGRIQUE,Agricultura / Pesca / Ganaderia,"Pedro Escobedo, Queretaro",ASEGURADORA AGRICOLA
Agricola PS SA de CV,Agricultura / Pesca / Ganaderia,"Hermosillo, Sonora",
PALANTE VERACRUZ S DE RL DE CV,Agricultura / Pesca / Ganaderia,"Naranjos Amatlan, Veracruz","Empresa dedicada al acopio de ganado para ventas de exportacion y mercado nacional; somos una empresa lider en nuestro ramo. Nuestro principal objetivos son las ventas de ganado de exportacion hacia los Estados Unidos de America, siendo uno de los mayores exportadores a nivel nacional."
Productora de Pavos del Sureste,Agricultura / Pesca / Ganaderia,"Merida, Yucatan",EMPRESA DEDICADA A LA CRIANZA DE PAVOS
ALIMENTOS Y FARMACEUTICOS SA de CV,Agricultura / Pesca / Ganaderia,"Ahome, Sinaloa","Somos una empresa que se dedica a la venta de alimentos y minerales para todo tipo de ganado, asi como la venta de medicamentos y accesorios."
Industria ganadera del bajio,Agricultura / Pesca / Ganaderia,"Guadalajara, Jalisco",Cria y engorda de reses.
Endulza Mexico,Agricultura / Pesca / Ganaderia,"Villa Corona, Jalisco",Empresa dedicada al cultivo de la Stevia Organica
AGROCEN,Agricultura / Pesca / Ganaderia,"Irapuato, Guanajuato",Venta y fabricacion de maquinaria agricola.
Agrobas,Agricultura / Pesca / Ganaderia,"Irapuato, Guanajuato","Compra venta de Fertilizantes, Semillas, Agroquimicos y Alimentos Purina en 4 sucursales instaladas en los municipios de Irapuato, Abasolo, Penjamo y Salvatierra, con doce anos de existencia y distribuidora directa de varias marcas"
STAR MARINE,Agricultura / Pesca / Ganaderia,"Guaymas, Sonora","VENTA DE PRODUCTOS Y EQUIPOS DE PESCA, MOTORES MARINOS Y REFACCIONES, ASTILLEROS , TALLERES DE SERVICIO, CONTAMOS CON SUCURSALES EN VALLARTA(BUCERIAS Y LA CRUZ), MOCHIS SINALOA,GUAYMAS Y SAN CARLOS."
RASTRO MUNICIPAL,Agricultura / Pesca / Ganaderia,"Puebla, Puebla",MATANZA DE GANADO
"Ocalle, S.A. de C.V",Agricultura / Pesca / Ganaderia,"Ahome, Sinaloa","Somos una empresa con mas de 30 anos de experiencia en el cultivo de la papa en el Valle del Fuerte y varias regiones del pais, contando con personal altamente calificado y comprometido en cada una de las etapas del proceso de produccion."
DIAMOND V MEX S DE RL DE CV,Agricultura / Pesca / Ganaderia,"Corregidora, Queretaro","Empresa Internacional dedicada a la Nutricion y salud Animal, con base en Estados Unidos desde hace mas de 70 anos, con su filial en Queretaro, Mex. Dedicada a la importacion y comercializacion de metabolitos nutricionales para la produccion pecuaria, aves, cerdos, ganado lechero, engorda, equinos y mascotas ."
AFOSA TUXTEPEC,Agricultura / Pesca / Ganaderia,"San Juan Bautista Tuxtepec, Oaxaca","Distribuidor de maquinaria agricola, forestal y de jardineria, asi como sus consumibles y reparaciones tecnicas. Manejamos las marcas Husqvarna, Oregon, Cifarelli, Koshin, Gardena, Bahco, Jonsered y AFOSA."
Cultivo de Agave y Jima,Agricultura / Pesca / Ganaderia,"Zapotlan el Grande, Jalisco","EMPRESA DEDICADA AL GIRO AGRICOLA, CULTIVO DEL AGAVE COMO JIMA, ENFOCADA AL DESARROLLO DE SUS COLABORADORES E IMPLEMENTACION DE PROCESOS BUSCANDO LA INNOVACION."
San Jose,Agricultura / Pesca / Ganaderia,"Martinez de la Torre, Veracruz","Produccion, empaque y distribucion de citricos y diversos productos del campo. Oficinas en Veracruz, Mexico y Estados Unidos. En busqueda de ser lidieres en distribucion de calidad"
PINERA TROPICAL,Agricultura / Pesca / Ganaderia,"Isla, Veracruz","EMPRESA PRODUCTORA, EMPACADORA Y COMERCIALIZADORA DE PINAS; SE UBICA EN CIUDAD ISLA, VERACRUZ; TIENE SUS PLANTACIONES EN ESTA MISMA REGION; CUENTA CON CENTROS DE DISTRIBUCION EN LAS PRINCIPALES CENTRALES DE ABASTO DEL PAIS Y UN PUNTO EN ESTADOS UNIDOS."
Dariy Work,Agricultura / Pesca / Ganaderia,---,"Granja lechera con mas de 600 vacas en Bow Island, Alberta.En la gran industria lactea, donde millones de litros de leche de cientos de granjas se procesan cada semana, la trazabilidad de la leche es casi imposible. Aqui en Rock Ridge Dairy procesamos pequenas cantidades de leche y trabajamos en estrecha colaboracion con nuestros productores para que no solo conozcamos la ubicacion de la granja de donde proviene nuestra leche, sino tambien la gente detras de la leche que usamos para producir nuestros excelentes productos. De esa manera usted tambien puede estar seguro de que su leche proviene de una fuente de confianza centrada en su compromiso con la agricultura ecologica y el bienestar de sus animales. Para obtener mas informacion sobre nuestra propia granja y las de nuestros productores, visite nuestras paginas de perfil de productor para ver fotos de nuestras familias de granjeros y los animales que aman."
SICA GROUP,Agricultura / Pesca / Ganaderia,"San Ignacio Cerro Gordo, Jalisco",es una empresa fundada en 1982 que se dedica a la Comercializacion de agroquimicos y fertilizantes y asesoria tecnica a los productores del pais dando soluciones integrales a los agricultores
NETTREE Y ASOCIADOS S DE RL DE CV,Agricultura / Pesca / Ganaderia,"Aguascalientes, Aguascalientes","EMPRESA DEDICADA A LA PRODUCCION, DISTRIBUCION Y COMERCIALIZACION DE FRUTAS Y VERDURAS EN MERCADO DE EXPORTACION, LA EMPRESA CUENTA CON ALIANZAS ESTRATEGICAS EN SUDAMERICA, NORTE AMERICA Y EUROPA, ESTO HA PERMITIDO UN INCREMENTO EN LA OFERTA DE PRODUCTOS DERIVADO DE LOS DISTINTOS CICLOS AGRICOLAS EN LAS DIVERSAS REGIONES"
MATER SEEDS,Agricultura / Pesca / Ganaderia,"Puebla, Puebla","EMPRESA DEDICADA A LA GENERACION DE SEMILLAS MEJORADAS DE MAIZ (PROGRAMA PROPIO DE INVETIGACION), CON PRESENCIA EN TROPICOS BAJOS, VALLES ALTOS Y SUBTROPICO."
