Empresa,Area,Ubicacion,Descripcion
KIWA BCS ECUADOR CIA. LTDA,Agricultura / Pesca / Ganaderia,"Riobamba, Chimborazo","KIWA BCS ofrece servicios de inspeccion y certificacion de productos de acuerdo a estandares organicos, buenas practicas agricolas, comercio justo, entre otros."
maribelland 2,Agricultura / Pesca / Ganaderia,---,"Lorem Ipsum es simplemente el texto de relleno de las imprentas y archivos de texto. Lorem Ipsum ha sido el texto de relleno estandar de las industrias desde el ano 1500, cuando un impresor (N. del T. persona que se dedica a la imprenta) desconocido uso una galeria de textos y los mezclo de tal manera que logro hacer un libro de textos especimen. No solo sobrevivio 500 anos, sino que tambien ingreso como texto de relleno en documentos electronicos, quedando esencialmente igual al original. Fue popularizado en los 60s con la creacion de las hojas ""Letraset"", las cuales contenian pasajes de Lorem Ipsum, y mas recientemente con software de autoedicion, como por ejemplo Aldus PageMaker, el cual incluye versiones de Lorem Ipsum."
Organic Blooming S.C.C.,Agricultura / Pesca / Ganaderia,"Quito, Pichincha","Somos productores y exportadores de flores con certificacion organica. Tenemos una finca a 35 km al noroccidente de Quito, en la que sembramos nuestros productos desde el 2002."
La Delicia,Agricultura / Pesca / Ganaderia,"Ibarra, Imbabura",empresa que estan en el pais mas de 5 anos en la creacion de proyectos y manejo de recursos bioticos que se encuentran en el norte del Eccuador
Vitaminas y minerales CA,Agricultura / Pesca / Ganaderia,Pichincha,"Elaboracion de premezclas vitaminicas minerales, aditivos nutricionales, sales minerales y aditivos nutricionales para el sector pecuario en general. 20 anios en el mercado."
Kennet C.A.,Agricultura / Pesca / Ganaderia,"Quito, Pichincha",Somos una solida empresa con larga trayectoria en el mercado de reconocida marca. Producimos y comercializamos vegetales
Alespalma,Agricultura / Pesca / Ganaderia,"San Lorenzo, Esmeraldas",Espresa Palmicultora
Floricola Kavfot S.A.,Agricultura / Pesca / Ganaderia,Pichincha,Cultivos agricolas: Plantacion y comercializacion de flores
Ferasa,Agricultura / Pesca / Ganaderia,"Guayaquil, Guayas",Camaronera
Florecot S.A,Agricultura / Pesca / Ganaderia,"Cotacachi, Imbabura","Cultivo de flores, incluida la produccion de flores cortadas y capullos."
Danayma,Agricultura / Pesca / Ganaderia,"La Concordia, Esmeraldas",Cultivo y produccion de palma
Autisol s.a.,Agricultura / Pesca / Ganaderia,"Guayaquil, Guayas","Empresa Agricola - Ganadera, dedicada a la Importacion de quimicos para la tierra y sistemas de riego, y Exportacion de frutas."
Fertilizantes Bioma,Agricultura / Pesca / Ganaderia,"Guayaquil, Guayas",Produccion y Comercializacion de Fertilizantes Foliares
Expeconsa,Agricultura / Pesca / Ganaderia,"Guayaquil, Guayas",Cultivo de Cacao combinado con Platano
Agrosanalfonso S.A.,Agricultura / Pesca / Ganaderia,Pichincha,Empresa dedicada a la produccion y exportacion de rosas en su estado natural
Agromaps,Agricultura / Pesca / Ganaderia,"Quito, Pichincha","AGROMAPS, empresa lider en digitalizacion y medicion de predios Agricolas con tecnologia satelital."
Finca Los Bancos,Agricultura / Pesca / Ganaderia,"San Miguel De Los Bancos, Pichincha",Finca dedicada a realizar actividades de agricultura y ganaderia ubicada en el noroccidente de Pichincha.
A.G. Monteglan Cia Ltda,Agricultura / Pesca / Ganaderia,"Quininde, Esmeraldas",Empresa dedicada a la produccion de palma africana.Establecida hace 12 anos.Interesada en mejorar la productividad y rendimiento del cultivo.
Agrosotec,Agricultura / Pesca / Ganaderia,"Cayambe, Pichincha","Venta de maquinaria, equipos e insumos agropecuarios, Asesoramiento Tecnico, estudios de impacto ambiental, Etc."
Flores y Frutas Florifrut S.A.,Agricultura / Pesca / Ganaderia,Pichincha,"Empresa lider en el sector floricola, ubicada en Tabacundo, con mas de 18 anos de experiencia y con solida presencia en los mercados europeo, ruso y norteamericano."
Expoarom Cia. Ltda.,Agricultura / Pesca / Ganaderia,Pichincha,Cultivo y exportacion de Hortalizas
Grupo Calesa,Agricultura / Pesca / Ganaderia,Extranjero,"Grupo Calesa fue fundado en 1918 y es el grupo agroindustrial mas importante de Panama. Compuesto por ocho empresas cuyas actividades incluyen la produccion, procesamiento y comercializacion de importantes rubros alimenticios, como azucar, arroz y camaron. El grupo tambien se dedica a la ganaderia vacuna y porcina, a la produccion de alimentos para consumo animal, a la produccion de semillas certificadas de arroz, al igual que a la comercializacion de equipos, insumos, materias primas, lineas veterinarias y de agroquimicos, accesorios,etc.. El Grupo Calesa cuenta con mas de 1900 empleados permanentes, monto este que aumenta a 3000 al incluir los trabajadores de temporada. Es un grupo economico solido y con operaciones comerciales en Panama y otros paises del area."
Amazoncar Cia. LTDA.,Agricultura / Pesca / Ganaderia,"Quito, Pichincha",Empresa importadora y comercializadora de maquinaria agricola.
Corp. Internacional Chia S.A.,Agricultura / Pesca / Ganaderia,"Quito, Pichincha","Somos una Corporacion que se dedica a la exportacion de CHIA, tenemos entidades en: Argentina, Colombia, Bolivia. Nuestra empresa esta desarrollando empleo en diferentes areas por expasion."
Agrosanalfonso S.A.,Agricultura / Pesca / Ganaderia,Pichincha,Empresa dedicada a la produccion y exportacion de rosas en su estado natural
Finca Los Bancos,Agricultura / Pesca / Ganaderia,"San Miguel De Los Bancos, Pichincha",Finca dedicada a realizar actividades de agricultura y ganaderia ubicada en el noroccidente de Pichincha.
Flores y Frutas Florifrut S.A.,Agricultura / Pesca / Ganaderia,Pichincha,"Empresa lider en el sector floricola, ubicada en Tabacundo, con mas de 18 anos de experiencia y con solida presencia en los mercados europeo, ruso y norteamericano."
Expoarom Cia. Ltda.,Agricultura / Pesca / Ganaderia,Pichincha,Cultivo y exportacion de Hortalizas
Grupo Calesa,Agricultura / Pesca / Ganaderia,Extranjero,"Grupo Calesa fue fundado en 1918 y es el grupo agroindustrial mas importante de Panama. Compuesto por ocho empresas cuyas actividades incluyen la produccion, procesamiento y comercializacion de importantes rubros alimenticios, como azucar, arroz y camaron. El grupo tambien se dedica a la ganaderia vacuna y porcina, a la produccion de alimentos para consumo animal, a la produccion de semillas certificadas de arroz, al igual que a la comercializacion de equipos, insumos, materias primas, lineas veterinarias y de agroquimicos, accesorios,etc.. El Grupo Calesa cuenta con mas de 1900 empleados permanentes, monto este que aumenta a 3000 al incluir los trabajadores de temporada. Es un grupo economico solido y con operaciones comerciales en Panama y otros paises del area."
Amazoncar Cia. LTDA.,Agricultura / Pesca / Ganaderia,"Quito, Pichincha",Empresa importadora y comercializadora de maquinaria agricola.
Corp. Internacional Chia S.A.,Agricultura / Pesca / Ganaderia,"Quito, Pichincha","Somos una Corporacion que se dedica a la exportacion de CHIA, tenemos entidades en: Argentina, Colombia, Bolivia. Nuestra empresa esta desarrollando empleo en diferentes areas por expasion."
Guadaproducts,Agricultura / Pesca / Ganaderia,Pichincha,Guadaproducts es una empresa comercializadora de frutas y hortalizas. Se ubica en Checa y ya tiene mas de 10 anos en el mercado. Tiene sus pilares en otra empresa que cultiva diversos productos.
Floraroma S.A.,Agricultura / Pesca / Ganaderia,"Cayambe, Pichincha",La empresa Floraroma S.A. se dedica a la Produccion y Comercializacion de Rosas
Magap,Agricultura / Pesca / Ganaderia,"Tulcan, Carchi","Ministerio de Agricultura, Ganaderia, Acuacultura y Pesca"
Door to Door FLowers,Agricultura / Pesca / Ganaderia,"Quito, Pichincha",Door to Door Flowers es una empresa agroexportadora especializada en flores frescas cortadas.
Guano Rojo Punta Gruesa S.A.,Agricultura / Pesca / Ganaderia,"Guayaquil, Guayas",Importadora y comercializadora de fertilizante organico
Cernyt S.A.,Agricultura / Pesca / Ganaderia,"Guayaquil, Guayas",Empresa agricola dediaca a la siembra y cultivo de arroz
Mundo Verde,Agricultura / Pesca / Ganaderia,"Guayaquil, Guayas","MUNDO VERDE MUV CIA. LTDA es una organizacion 100% organica que presta servicios: Consultoria, asesoria y venta de insumos. Todo esto a nivel: Agricola, Acuicola Industrial, Naviera, Comercial, Domestica, y Seres Humanos."
Multicopec,Agricultura / Pesca / Ganaderia,Pichincha,"Empresa dedicada a la comercializacion de insumos veterinarios orientados en su mayoria al sector avicola, para todo el pais"
Mantejarsa,Agricultura / Pesca / Ganaderia,"Samborondon, Guayas",Empresa de diseno y construccion de jardines
Marabig S.A.,Agricultura / Pesca / Ganaderia,"Guayaquil, Guayas",Dedicados a la fabricacion de agroinsumos organicos
Ministerio del Ambiente,Agricultura / Pesca / Ganaderia,"Quito, Pichincha",Ministerio del Ambiente del Ecuador
Florisol Cia. Ltda.,Agricultura / Pesca / Ganaderia,"Quito, Pichincha","Empresa Floricola con mas de 30 anos de experiencia, ofrece un buen ambiente laboral y estabilidad"
Honey Rose,Agricultura / Pesca / Ganaderia,"Cayambe, Pichincha",Cultivar rosas de exportacion
Imetos Ecuador,Agricultura / Pesca / Ganaderia,"Quito, Pichincha",Nuevas tecnologias convierten la informacion meteorologica en una potente herramienta de gestion que permite recoger y almacenar los datos especificos y relevantes para el seguimiento de su cultivo que tienen que ver con: * Produccion integrada * Gestion de Riego * Monitoreo y prevencion de enfermedades * Monitoreo del balance diario del agua * Monitoreo del agua en el suelo y del riego * Monitoreo en Silo e invernaderos * Seguimiento del Bienestar animal.
Hilsea Investiments Limited,Agricultura / Pesca / Ganaderia,Pichincha,La Empresa se llama Hilsea Investments Limited es una de las empresa mas grande del pais que se ocupa en la Agricultura y especial mente ala floricultura.
Agicola Santa Carla,Agricultura / Pesca / Ganaderia,"Duran, Guayas",La empresa se dedica ha produccion de Banano y Cacao
"Avicola ""La Chiquita""",Agricultura / Pesca / Ganaderia,"Duran, Guayas","Representar al sector avicola nacional y asegurar su crecimiento, su competitividad, y sostenibilidad, mediante acompanamientos tecnologicos, sanitarios, de inocuidad, capacitacion e investigacion para fortalecer la seguridad alimentaria ecuatoriana y continuar ocupando una posicion institucional con un amplio reconocimiento, que influya en el bienestar del sector avicola ademas de la exploracion de mercados con el fin de ampliar la oferta de productos que satisfagan las necesidades y expectativas de nuestros clientes nacionales."
Provetagro,Agricultura / Pesca / Ganaderia,Pichincha,Comercializacion e Importacion de productos Veterinarios y Agropecuarios.
Laboratorio de insumos veterinarios Guayaquil,Agricultura / Pesca / Ganaderia,"Guayaquil, Guayas",Elaboracion y venta de insumos agricolas y veterinarios
Soprisa S.A.,Agricultura / Pesca / Ganaderia,Guayas,"SOPRISA S.A. es una Exportadora de Banano con 10 anos en el mercado Bananero, nos dedicamos a la exportacion de banano y otras musaceas, nuestro objetivo es tener un personal calificado, unido y de alto rendimiento que nos impulse a ser mejores cada dia para satisfacer los mercados internaciones y poder alcanzar nuestras metas."
Pina Inka E.I.R.Ltda,Agricultura / Pesca / Ganaderia,Extranjero,"Pina Inka E.I.R.Ltda. esta dedicada a la produccion de pina de calidad (Cayena Lisa, queremos incursionar en la produccion de la variedad Golden), nuestro objetivo satisfacer las necesidades de los consumidores con pina de calidad, estamos dedicados a la produccion de pina en fresco hace 5 anos. los campos de produccion estan ubicados en la selva de la Region Cusco."
Loveroses,Agricultura / Pesca / Ganaderia,Pichincha,Empresa Floricola
Agricola Lerjuez S.A.,Agricultura / Pesca / Ganaderia,"Guayaquil, Guayas",Nos dedicamos a la produccion de Banano
Tecno Roses S.A.,Agricultura / Pesca / Ganaderia,"Cayambe, Pichincha","Tecno Roses S.A. es una empresa dedicada a la produccion y exportacion de flores, con segmente de mercado ruso bien definido, su trayectoria es de 14 anos en el mercado internacional y cuenta con fincas ubicadas en Tabacundo, Cayambe, Quinche y proximamente en Calacali."
Agroalimentar Cia Ltda,Agricultura / Pesca / Ganaderia,"Quito, Pichincha",Empresa comercializadora de insumos para el sector agropecuario
Parque del Quinde,Agricultura / Pesca / Ganaderia,Pichincha,Parque Del Quinde : Ubicado en Nanegalito via Calacali la Independencia km 54.
Floricola La Rosaleda,Agricultura / Pesca / Ganaderia,Pichincha,Productora y exportadora de rosas cortadas
CORPORACION LANEC S.A.,Agricultura / Pesca / Ganaderia,"Duran, Guayas","Grupo Camaronero, Agricola e Industrial"
Sulagro S.A.,Agricultura / Pesca / Ganaderia,"Guayaquil, Guayas","Empresa Agricola, Bananas organicas."
Ec-bananas.com,Agricultura / Pesca / Ganaderia,"Quito, Pichincha","Somos especialistas en propagacion vegetal por medio de cultivo de tejidos, por germinacion de semilla y por enraizamiento de esquejes. Tambien ofrecemos los servicios de propagacion meristematica de sus cultivos. Complementamos esta actividad con el endurecimiento y aclimatacion del material meristematico y con la produccion de plantulas o pilones, plantas de pote para la jardineria, floricultura y la produccion agricola."
EcoAgro S.A.,Agricultura / Pesca / Ganaderia,"Montecristi, Manabi","EcoAgro S.A. es una empresa que se dedica a la produccion y venta de fertilizantes foliares - con enfasis en elementos menores - y reguladors fisologicos para todos los cultivos de la agricultura ecuatoriana. Nos proponemos liderar acompanamiento a los agricultores mediante asistencia tecnica, capacitacion y calidad de productos."
Expofruth,Agricultura / Pesca / Ganaderia,Pichincha,"La empresa se dedica a la comercializacion de frutas y tuberculos en la localidad de Santo Domingo de los Tsachilas, los cuales son vendidos localmente o exportados a otros paises. Ubicada en la Via Puerto Limon"
Granja Avicola El pORVENIR,Agricultura / Pesca / Ganaderia,Pichincha,Crianza de aves de corral (pollos)
Ecoflor,Agricultura / Pesca / Ganaderia,Pichincha,Empresa de compras para Ecuador de flor y Follaje
Corpecologico,Agricultura / Pesca / Ganaderia,"Quito, Pichincha",Somos una empresa que se dedica a la Agricultura Sustentable y Ecologia.
Incubandina,Agricultura / Pesca / Ganaderia,"Ambato, Tungurahua",Incubandina S.A. Es una empresa ubicada en la ciudad de Ambato con centros de produccion en las provincias de Cotopaxi y Los Rios esta inmersa en el esfuerzo avicola. Ofrece lineas genetica avicolas para los diferentes objetivos productivos de la industria.
Tropical Packing Ecuador S.A.Tropack,Agricultura / Pesca / Ganaderia,"Duran, Guayas","Empresa dedicada a la exportacion de Tilapia, Ser la mas eficiente empresa procesadora de productos de tilapia de America a traves de la vivencia diaria de nuestros valores, alcanzando los mas altos niveles en seguridad y calidad alimentaria, aprovechamiento de materia prima, servicio al cliente, y gestion de riesgos."
Punto Verde S.A.,Agricultura / Pesca / Ganaderia,"Guayaquil, Guayas","Nuestra Empresa Somos una empresa ubicada en Guayaquil - Ecuador, con 15 anos en el negocio de agroquimicos. Tenemos a disposicion cloruro de potasio, sulfato de potasio, nitrato de potasio, sulfato de magnesio Para venta directa desde fabrica igualmente todo tipo de pesticidas y fertilizantes foliares y edaficos para uso agricola, excelentes precios y entrega inmediata. Agricultura Sustentable - (Organica + quimica) Grupo Objetivo: - Empresas medianas de distribucion de agroquimicos, grupos agricolas (productores y asociaciones), Mercados organicos. Valor agregado: - Respaldo tecnico, comercial y publicitario."
Human,Agricultura / Pesca / Ganaderia,"Quito, Pichincha",Importante Empresa del sector Floricola reconocida en el mercado internacional por mas de 10 anos. Fincas en Tabacundo y Pedro Vicente Maldonado.
"Camaronera del Pacifico, Pacimar S.A.",Agricultura / Pesca / Ganaderia,"Guayaquil, Guayas","Nuestra empresa pertenence a un grupo economico camaronero dedicado a la produccion de camaron para exportacion, con granjas camaroneras ubicadas en la isla Puna y en la zona de la costa."
Plantaciones Malima Cia. Ltda.,Agricultura / Pesca / Ganaderia,"Paute, Azuay",Plantaciones Malima Cia. Ltda es una empresa que se dedica a la exportacion de flores.
ProGardens,Agricultura / Pesca / Ganaderia,Pichincha,"Diseno,planificacion, ejecucion y mantenimiento de areas verdes en general."
Procesadora y Exportadora de Camaron CamaronExport C. Ltda.,Agricultura / Pesca / Ganaderia,"Guayaquil, Guayas","Prestigiosa Empacadora y Exportadora de Camaron Camaron Export ofrece los Servicios de Compaking, pelado, Descabezado, etc. proceso de excelente calidad."
Productos Ecuapez,Agricultura / Pesca / Ganaderia,"Quito, Pichincha","Es una Empresa dedicada al procesamiento, empaque y distribucion de pescados y mariscos, con 30 anos en el mercado nacional. Contamos tambien con nuestro propio restaurante en el que se ofrece gran variedad de comida costena y gourmet."
Agro San Alfonso -Glamour-,Agricultura / Pesca / Ganaderia,"Quito, Pichincha",Somos una de las mas importantes empresas dedicada a la produccion y exportacion de las mejores variedades de Rosas.
Masuq s.a.,Agricultura / Pesca / Ganaderia,"Guayaquil, Guayas",Empresa dedicada a la exportacion de frutas al exterior
Sabrostar fruit Company S.a.,Agricultura / Pesca / Ganaderia,"Guayaquil, Guayas","Sabrostar fruit Company S.A! Es una empresa nueva en el mercado se dedica a exportar productos agricolas en especial banano,pina, o rito, y platano a todo el mundo"
ORODELTI S.A.,Agricultura / Pesca / Ganaderia,"Samborondon, Guayas",Empresas Siguenza Vintimilla es una empresa mediana dedicada a la produccion agricola e industrial con amplia trayectoria en el mercado nacional.
Sumiavicola Cia. Ltda.,Agricultura / Pesca / Ganaderia,"Quito, Pichincha",Importador y Distribuidor de productos veterinarios
South Pacific Seafood S.A. SOPASE,Agricultura / Pesca / Ganaderia,"Guayaquil, Guayas","South Pacific Seafood S.A. SOPASE, es una compania legalmente constituida en el Ecuador, se dedica principalmente al procesamiento, empacado, y venta de productos de la pesca."
Rozum,Agricultura / Pesca / Ganaderia,"Guayaquil, Guayas",Importadora y Distribuidora de productos veterinarios a nivel nacional
Servijunior S.A.,Agricultura / Pesca / Ganaderia,"Guayaquil, Guayas",Ventas al por mayor de productos de la pesca
Servicios Profesionales y Agroquimicos Serproagro S.A.,Agricultura / Pesca / Ganaderia,"Guayaquil, Guayas",Nos dedicamos a la venta al por mayor y menor de insumos agricolas; asi mismo brindamos asesorias para la mejora de su cultivo.
Unidad Nacional de Almacenamiento,Agricultura / Pesca / Ganaderia,"Guayaquil, Guayas","Somos una empresa publica ecuatoriana, que contribuye al efectivo funcionamiento del mercado agropecuario, a traves de actividades economicas de almacenamiento, administracion, comercializacion y distribucion; aportando a la soberania alimentaria, al cambio de la Matriz Productiva y al Buen Vivir del pais."
Tropicalagro S:A.,Agricultura / Pesca / Ganaderia,"Guayaquil, Guayas",Empresa dedicada ala produccion Agricola y exportacion de banano Organico con mas de 20 anos de trayectoria en el mercado Nacional e Internacional.
CENTRO AGRICOLA CANTONAL DE RUMINAHUI,Agricultura / Pesca / Ganaderia,"Ruminahui, Pichincha",CENTRO AGRICOLA CANTONAL DE RUMINAHUI
ECUADORIAN SHRIMP CIA TDA.,Agricultura / Pesca / Ganaderia,"Guayaquil, Guayas",EXPLOTACION DE CRIADEROS DE CAMARON
Agroservicios&Asociados S.A.,Agricultura / Pesca / Ganaderia,"Guayaquil, Guayas","Mejorar la competitividad y bienestar de nuestros productores en el area agropecuaria con procesos de generacion - agregacion de valor, brindando un servicio de transferencia de tecnologia integral."
Agrigenetic,Agricultura / Pesca / Ganaderia,"Mejia, Pichincha","Somos una empresa importadora y comercializadora de productos de material genetico e insumos de calidad para el sector ganadero, que satisface las necesidades del mercado ecuatoriano, en un marco rentable."
CARAVELA COFFEE,Agricultura / Pesca / Ganaderia,"Quito, Pichincha","Comercializacion de productos Agricolas, tambien se ofrece analisis de calidad de cafe, se compra cafe Ecuatoriano para aperturar el mercado internacional"
BRIGMANY,Agricultura / Pesca / Ganaderia,"Guayaquil, Guayas","Somos un grupo empresarial dedicado a la labor agricola, ganadera y bananera."
QUITO INORFLOWERS TRADE,Agricultura / Pesca / Ganaderia,"Latacunga, Cotopaxi","Somos una empresa Floricola dedicada a la Produccion y comercializacion de Rosas, con presencia en el mercado Europeo y Norteamericano, ofertando rosas con los mejores indices de calidad y amplia gama de colores."
Agroflora,Agricultura / Pesca / Ganaderia,"Quito, Pichincha","Somos una empresa que se dedica a la produccion y exportacion de rosas a todo el mundo, con mas de 30 anos en la industria floricola."
CORPOSUCUMBIOS,Agricultura / Pesca / Ganaderia,"Lago Agrio, Sucumbios","CORPOSUCUMBIOS entidad adscrita al GADPS proyectos productivos, dedicada al apoyo al sector productivo de la Provincia de Sucumbios .manejo de Planta de Balanceado"
Zapad Vostok,Agricultura / Pesca / Ganaderia,"Cayambe, Pichincha","Empresa Floricola, productora y exportadora de rosas, ubicada en Tabacundo"
Monsanto,Agricultura / Pesca / Ganaderia,"Guayaquil, Guayas","Monsanto es una empresa global, dedicada 100% a la agricultura y a desarrollar tecnologia en beneficio de miles y millones de agricultores alrededor del mundo. Nos mantenemos permanentemente atentos a sus necesidades para poder ofrecerles soluciones que les permitan incrementar la productividad y el rendimiento de sus cultivos."
ALIMENTOS SNOB,Agricultura / Pesca / Ganaderia,"Quito, Pichincha",Grupo Agro industrial fundado el 6 de noviembre de 1980 dedicado a la elaboracion de vegetales y frutas en conserva .
ALCOPALMA,Agricultura / Pesca / Ganaderia,"Santo Domingo, Santo Domingo de los Tsachilas",Empresa dedicada al cultivo y extraccion de aceite de palma.
DVS FRUTAS S.A,Agricultura / Pesca / Ganaderia,"Machala, El Oro","Somos un grupo empresarial de Chile con oficinas en la ciudad de Machala, Provincia de El Oro. Estamos dedicados a las Exportaciones de insumos y productos para la Agroindustria"
LABRANDO ECUADOR,Agricultura / Pesca / Ganaderia,"Ambato, Tungurahua","Empresa que se dedica a la importacion, venta y comercializacion de maquinaria agricola, repuestos, brinda servicio tecnico, mantenimiento y otros , somos parte del Grupo Alvarado que tienen mas de 50 anos de experiencia en el mercado con nuestra empresa principal Importadora alvarado que vende repuestos de todo tipo de autos somos distribuidores exclusivos de la marca Sonalika International de la India, nuestros principales productos son tractores de 110HP, 90 HP, 60HP, 26HP, ademas contamos con una amplia gama de repuestos, contamos con un taller movil para antender los requerimientos de nuestros clientes donde se encuentren ubicados los tractores."
Servicios Analiticos Agrolab-Comapany Ecuador S.A,Agricultura / Pesca / Ganaderia,"Guayaquil, Guayas",Representacion de laboratorio Holandes en el pais.
FOLIGRIN,Agricultura / Pesca / Ganaderia,"Quito, Pichincha","* Organizacion en expansion con una cultura de innovacion que revoluciona el negocio agroindustrial, enfocada el mejoramiento de la produccion y control de plagas de forma amigable con el medio ambiente."
CONTINENTAL ROSES TECNOFIL,Agricultura / Pesca / Ganaderia,"Mejia, Pichincha","CONTINENTAL ROSES CON 10 ANOS EN EL MERCADO EXPORTANDO FLORES, UBICADA EN LA CIUDAD DE MACHACHI CAMINO VIEJO KM 2 1/2 DESEA INCORPORAR PERSONAL CON EXPERIENCIA."
CARAVELA COFFEE,Agricultura / Pesca / Ganaderia,"Quito, Pichincha","Comercializacion de productos Agricolas, tambien se ofrece analisis de calidad de cafe, se compra cafe Ecuatoriano para aperturar el mercado internacional"
QUITO INORFLOWERS TRADE,Agricultura / Pesca / Ganaderia,"Latacunga, Cotopaxi","Somos una empresa Floricola dedicada a la Produccion y comercializacion de Rosas, con presencia en el mercado Europeo y Norteamericano, ofertando rosas con los mejores indices de calidad y amplia gama de colores."
LABRANDO ECUADOR,Agricultura / Pesca / Ganaderia,"Ambato, Tungurahua","Empresa que se dedica a la importacion, venta y comercializacion de maquinaria agricola, repuestos, brinda servicio tecnico, mantenimiento y otros , somos parte del Grupo Alvarado que tienen mas de 50 anos de experiencia en el mercado con nuestra empresa principal Importadora alvarado que vende repuestos de todo tipo de autos somos distribuidores exclusivos de la marca Sonalika International de la India, nuestros principales productos son tractores de 110HP, 90 HP, 60HP, 26HP, ademas contamos con una amplia gama de repuestos, contamos con un taller movil para antender los requerimientos de nuestros clientes donde se encuentren ubicados los tractores."
Servicios Analiticos Agrolab-Comapany Ecuador S.A,Agricultura / Pesca / Ganaderia,"Guayaquil, Guayas",Representacion de laboratorio Holandes en el pais.
FOLIGRIN,Agricultura / Pesca / Ganaderia,"Quito, Pichincha","* Organizacion en expansion con una cultura de innovacion que revoluciona el negocio agroindustrial, enfocada el mejoramiento de la produccion y control de plagas de forma amigable con el medio ambiente."
CONTINENTAL ROSES TECNOFIL,Agricultura / Pesca / Ganaderia,"Mejia, Pichincha","CONTINENTAL ROSES CON 10 ANOS EN EL MERCADO EXPORTANDO FLORES, UBICADA EN LA CIUDAD DE MACHACHI CAMINO VIEJO KM 2 1/2 DESEA INCORPORAR PERSONAL CON EXPERIENCIA."
