Empresa,Area,Ubicacion,Descripcion
Sukarne,Agricultura / Pesca / Ganaderia,"Culiacan, Sinaloa","Desde hace mas de 48 anos, Grupo VIZ / SuKarne ha sido un factor clave en la transformacion de la industria carnica en Mexico y en el mundo, al mantener los mas altos estandares de calidad y perseguir la continua innovacion de sus procesos."
Grupo Herdez,Agricultura / Pesca / Ganaderia,"Miguel Hidalgo, Ciudad de Mexico DF","Somos lideres en el sector de alimentos procesados y uno de los principales actores en la categoria de helados en Mexico, y en el segmento de comida mexicana en los Estados Unidos."
"Marindustrias, S.A. de C.V.",Agricultura / Pesca / Ganaderia,"Colima, Colima","En Grupomar somos lideres en las actividades de pesca, servicios portuarios, industrializacion y comercializacion de alimentos de consumo masivo, mediante personal calificado y comprometido con una organizacion integrada verticalmente, con procesos y productos innovadores que a traves de estandares de calidad y competitividad genera valor para sus accionistas, empleados, clientes y proveedores, contribuyendo al desarrollo de su entorno."
International Private Security,Agricultura / Pesca / Ganaderia,"Azcapotzalco, Ciudad de Mexico DF","Como organizacion iniciamos actividades en 1995, teniendo como meta ofrecer Servicios Profesionales en Seguridad Patrimonial. Despues de cinco anos de experiencia conformamos las bases para crecer en congruencia con el mercado Internacional."
Agroservicios Nacionales SAPI de CV,Agricultura / Pesca / Ganaderia,"Guadalajara, Jalisco","Somos una empresa orgullosamente mexicana con mas cuarenta anos de experiencia en el campo, especializada en la induccion, desarrollo y comercializacion de tecnologia que contribuye a la solucion de problemas y la mejora del desempeno agricola en Mexico."
AVIGRUPO,Agricultura / Pesca / Ganaderia,---,"Avigrupo, somos una de las empresas de mayor exito en el campo de la avicultura a nivel nacional, con mas de 48 anos en el mercado."
KEKEN,Agricultura / Pesca / Ganaderia,"Merida, Yucatan","Keken es una empresa mexicana dedicada a la produccion y comercializacion de carne de cerdo. Nuestras operaciones estan totalmente integradas, pues abarcan desde el proceso reproductivo del cerdo hasta su distribucion en punto de venta a consumidores finales, a traves de la cadena de tiendas Maxicarne y un exportador relevante, para el mercado asiatico."
Promocom del Mayo S.A. de C.V.,Agricultura / Pesca / Ganaderia,"Navojoa, Sonora",Alimentos KOWI es una empresa dedicada a procesar y comercializar carne de cerdo y sus derivados a nivel Nacional y de Exportacion.
AGEBSA SA DE CV,Agricultura / Pesca / Ganaderia,"Matamoros, Tamaulipas","Empresa dedicada a la venta de refacciones y el otorgamiento de servicios para el sector agricola de la region, ubicada en esta ciudad desde hace mas de 20 anos."
Pickle Corporation S.P.R. de R.L.,Agricultura / Pesca / Ganaderia,"Guadalajara, Jalisco","Empresa dedicada a la siembra, venta y exportacion de pepinos"
"BRENDCAR Soluciones en Informatica, S.A. de C.V.",Agricultura / Pesca / Ganaderia,"Benito Juarez, Ciudad de Mexico DF","Perfil Nuestra Mision Dotar de servicios y productos de calidad, de acuerdo a la plantilla que conforma la empresa, asi como de realizar estudios de mercado que nos permitan ofrecer a nuestros socios tecnologicos (clientes), la mejor solucion ya sea en el area de servicios o en la adquisicion de algunos de nuestros productos o integraciones. Nuestra Vision Brendcar busca que la vision de sus socios tecnologicos (clientes) sea similar a la suya. Construyendo con profesionalismo y respeto, una relacion a largo plazo de acuerdo a los servicios y soluciones otorgados a nuestros socios tecnologicos (clientes). Metas BRENDCAR Soluciones en Informatica S.A. de C.V., buscara contribuir con sus socios tecnologicos para cumplir los objetivos que se tiene trazados"
Carnes Certificadas de Sonora SA de CV,Agricultura / Pesca / Ganaderia,"Zapopan, Jalisco","Empresa Mexicana que nacio en 1972, Dedicada a la Compra venta y comercializacion de carnes rojas a nivel nacional, nos especializamos en cortes finos de la mas alta calidad."
Agricultores el Fuerte S.P.R. de R.L.,Agricultura / Pesca / Ganaderia,"Salamanca, Guanajuato","Empresa dedicada a producir, empacar, procesar y comercializar hortalizas."
"Taylor Farms de Mexico, S. de R.L. de C.V.",Agricultura / Pesca / Ganaderia,"Doctor Mora, Guanajuato","Somos una empresa americana, con sede en Salinas, California. En Taylor Farms, nos encargamos de desarrollar y proveer los productos mas frescos y saludables para la industria de alimentos de America del Norte y Mexico."
Forrajes y Granos Agropecuarios de Yucatan S.A. de C.V.,Agricultura / Pesca / Ganaderia,"Uman, Yucatan","Somos una empresa del sector agropecuario. Nuestro giro es la compra-venta y elaboracion de alimentos para todo tipo de ganado. Tambien manejamos un gran portafolio, de laboratorios reconocidos al nivel mundial, de medicamentos para ovinos, bovinos, porcinos, aves y razas pequenas."
DUCOR SA DE CV,Agricultura / Pesca / Ganaderia,"Zapopan, Jalisco","DUCOR es el resultado de la asociacion de DuPont, S.A. de C.V. y Grupo Corey, ambas empresas lideres en fabricacion y comercializacion de productos y servicios enfocados al sector agricola."
Csa Sc - Merpol,Agricultura / Pesca / Ganaderia,"Benito Juarez, Ciudad de Mexico DF","Produccion para venta a mayoreo y menudeo de pollo como tiendas de conveniencia Mexicana. Negocios en expansion dedicados a la venta de productos de consumo inmediato ubicados en las cercanias a zonas residenciales o ejecutivas, como ubicaciones cerca de tu domicilio. Asi mismo expendios de Pollo, manejo de abarrote y perecederos, incubadoras, granjas, Rastro. Para toda persona no debera tener desagrado al pollo ya que es nuestro giro."
Agrolab,Agricultura / Pesca / Ganaderia,"Pachuca de Soto, Hidalgo","Laboratorio de Seguridad Alimentaria que ofrece analisis en el sector de la Industria de Alimentos asi como parte del Grupo de Empresas Fabricantes de Fertilizantes, Minerales e Investigacion Agricola ."
Luzesa S.A de C.V,Agricultura / Pesca / Ganaderia,"Coyoacan, Ciudad de Mexico DF","Somos una empresa 100% mexicana, nuestras actividades de instalacion y mantenimiento a sistemas electromecanicos, limpieza de ductos, mantenimiento a equipos de aire acondicionado, bombeo contra incendio, subestaciones, sistemas de tierra fisica, pararayos y UPS, adecuaciones y asesoria de instalaciones en el sector privado, comercial e institucional; nos brinda la experiencia sustentada desde 1986 en servicio y calidad de primer nivel,  proporcionamos una alternativa con ventajas competitivas  en tiempo y costo para las diversas necesidades de distintos sectores."
Grupo Accion Acuicola,Agricultura / Pesca / Ganaderia,"Cajeme, Sonora",Accion Acuicola nace en 1999 con la primera area de la granja productora.Posteriormente en 2001 se empieza a construir la planta empacadora. A traves de los anos con un crecimiento sostenido ha logrado integrar las operaciones de produccion. Se cuentan con certificaciones nacionales e internacionales que respaldan al camaron de Accion Acuicola como un producto calidad de exportacion para los mercados de USA y Europa.
VILLASERRE,Agricultura / Pesca / Ganaderia,"Guanajuato, Guanajuato",INVERNADEROS Y CULTIVO DE HORTALIZAS
Aguilares S.P.R. DE R.L.,Agricultura / Pesca / Ganaderia,"Cortazar, Guanajuato","Somos una empresa 100% mexicana, con mas de 3 decadas de experiencia en la produccion, desarrollo, comercializacion y distribucion de productos vegetales, frescos y procesados de la mas alta calidad."
Jardin Aleman sa de cv,Agricultura / Pesca / Ganaderia,"Leon, Guanajuato",Ambiente de trabajo
Agropecuaria Sanfandila S.A. de C.V.,Agricultura / Pesca / Ganaderia,"Leon, Guanajuato","Empresa que produce, industrializa y comercializa alimentos de origen animal y vegetal de alta calidad; proporcionando bienestar y confianza a nuestros consumidores, proveedores, acccionistas y a la comunidad en general"
"Congeladora Solman, SA de CV",Agricultura / Pesca / Ganaderia,"Ahome, Sinaloa","Empresa dedicada a la maquila de pescados y mariscos desde el ano 2018, manejo de mercado nacional e internacional, sus productos son con el mas alto grado de calidad e inocuidad."
AGROPECUARIA MARLEE SA,Agricultura / Pesca / Ganaderia,"Aguascalientes, Aguascalientes","Empresa dedicada al cultivo e industrializacion de Arboles Frutales: Durazno, Uva, Higos, Granados."
Frigorifica Sonorense DJ S.A. de C.V.,Agricultura / Pesca / Ganaderia,"Hermosillo, Sonora",Nos especializamos en maquila de carne de Res y Cerdo.
PROTEINAS SALUDABLES POTOSINAS,Agricultura / Pesca / Ganaderia,"San Luis Potosi, San Luis Potosi",EMPRESA DEDICADA AL EMPACADO DE CARNE.
PROWELL,Agricultura / Pesca / Ganaderia,"Merida, Yucatan",
QUIMIA,Agricultura / Pesca / Ganaderia,"Ahome, Sinaloa","Grupo de empresas de diferentes giros, dentro de los cuales se incluye la produccion y venta de agroquimicos, venta de maquinaria, creditos, paqueteria, etc."
LATIMEX,Agricultura / Pesca / Ganaderia,"Rosario, Sinaloa","Empresa Agricola con mas de 20 anos de experiencia dedicada al cultivo, empaque y exportacion de Hortalizas Orientales y Fruta tanto en Mexico como a los Estados Unidos."
VECTORFOG DE MEXICO SA DE CV,Agricultura / Pesca / Ganaderia,"Puebla, Puebla",NOS DEDICAMOS A LA VENTA DE INSUMOS PARA EL CONTROL URBANO DE PLAGAS. ESTAMOS EN VARIOS ESTADOS DEL PAIS Y CONTAMOS CON ATRACTIVOS PLANES DE CRECIMIENTO PARA EL PERSONAL.
Agropecuaria Malichita,Agricultura / Pesca / Ganaderia,"Guaymas, Sonora","Agropecuaria Malichita es una empresa dedicada a la produccion de hortalizas. Esta empresa fue fundada en 1997 y a tenido un rapido crecimiento en su ambito. Entre los productos mas destacados de la empresa esta la sandia, el melon, la calabaza, el pimiento morron y pepino. Somos emprendedores y lideres en el valle de Guaymas y estamos buscando a la mejor gente."
Tabasco citrus pack,Agricultura / Pesca / Ganaderia,"Huimanguillo, Tabasco","Tabasco Citrus Pack es un grupo formado por 6 huertas productoras de limon persa lideres en la region, que se encuentran ubicadas en el municipio de Huimanguillo, contamos con mas de 12 anos de experiencia en exportacion a varios estados de la union americana, logrando obtener excelentes resultados."
SAS Empresarial,Agricultura / Pesca / Ganaderia,"Salamanca, Guanajuato",Empresa de servicio de apoyo a los negocios de giro Agricola la cual se encuentra en expansion y busca el mejor talento para integrarlo a nuestro equipo de trabajo
"Internacional Quimica de Cobre, S.A. de C.V.",Agricultura / Pesca / Ganaderia,"Benito Juarez, Ciudad de Mexico DF","Internacional Quimica de Cobre, es una empresa con 40 anos de experiencia en el mercado de Agroquimicos, lideres en la fabricacion de productos quimicos a base de Cobre, y bien posesionados en el mercado nacional de productos para la agricultura. Este desarrollo nos ha permitido incursionar Internacionalmente sobre todo en el mercado Europeo. Hoy participamos activamente en el mercado de productos Agroquimicos que cuentan con un excelente prestigio en el mercado."
Carnicos Luje,Agricultura / Pesca / Ganaderia,"Torreon, Coahuila","Empresa empacadora y venta de carne de res, pollo y puerco, abarrotes, lacteos, localmente conocida y con mas de 20 anos en el mercado lagunero, venta de mayoreo y menudeo."
Agromod,Agricultura / Pesca / Ganaderia,"Tapachula, Chiapas","Empresa dedicada a la siembra, cultivo, venta y exportacion de papaya; cuenta tambien con laboratorios de investigacion, embriogenesis y organogenesis:"
HORTIGEN,Agricultura / Pesca / Ganaderia,"Corregidora, Queretaro","Hortigen Produce se constituye en el mes de abril de 2011, desde su concepcion como idea de negocio la empresa establece la produccion sustentable de alimentos sanos y naturales; asi como el cuidado al medio ambiente como sus principios primordiales."
Grupo RCM Agente de Seguros y de Fianzas S.A. de C.V.,Agricultura / Pesca / Ganaderia,"Toluca, Estado de Mexico","GRUPO RCM AGENTE DE SEGUROS Y DE FIANZAS Es una empresa dedicada a la asesoria y adquisicion de seguros y de fianzas de todo tipo, trabajamos con las mejores companias del mercado buscando siempre las mejores condiciones para nuestros clientes solicito agentes, ofrezco atractivas comisiones y bonos de produccion"
"""Grupo Garay""",Agricultura / Pesca / Ganaderia,"Puebla, Puebla","GRUPO GARAY nace en Puebla hace 46 anos con la distribucion de Tractores Agricolas de la marca Ford, actualmente CASE, NEW HOLLAND. Creandose asi la primera division del grupo: Garay Campo, incluyendo posteriormente maquinaria Industrial y de construccion."
LA COLINA,Agricultura / Pesca / Ganaderia,"San Pedro Tlaquepaque, Jalisco","Contamos con mas de 30 anos de experiencia en el mercado de granos, semillas, cereales, chiles y especias."
Xtra Congelados Naturales S.A. de C.V. PLANTA LEON,Agricultura / Pesca / Ganaderia,"San Francisco del Rincon, Guanajuato","Empresa de alimentos vegetales congelados. Pertenecemos a un grupo importante de empresas de alimentos, conocido como Grupo Altex."
Agricola Los Cerritos,Agricultura / Pesca / Ganaderia,"Zapotlan el Grande, Jalisco",Ambiente de trabajo
EL NAVEGANTE,Agricultura / Pesca / Ganaderia,"Iztapalapa, Ciudad de Mexico DF","COMERCIALIZADORA DE PESCADO y MARISCO, LIDER DE LA DISTRIBUCION DE MAYOREO y MENUDEO , EL NAVEGANTE EMPRESA QUE PRESTA SERVICIO A RESTAURANTES, COMDEDORES INDUSTRAILES, BANQUETERAS y HOTELES DE GRAN PRESTIGIO"
ROA POWER EQUIPMENT,Agricultura / Pesca / Ganaderia,"Uriangato, Guanajuato",Empresa dedicada a la distribucion de articulos marca Stihl. Venta de Motosierras y Desbrozadoras. Servicio de reparacion y mantenimiento.
Aarfs A.C.,Agricultura / Pesca / Ganaderia,"Ahome, Sinaloa","Empresa agricola fundada del 25 de noviembre de 1932. Es un organismo agricola que para cumplir con sus mision de fomento y desarrollo de la agricultura y su integracion a las redes de valor, se ha mantenido a la vanguardia en un concepto de servicio integral en beneficio de sus productores agremiados, sustentando en valores, identidad gremial, prestigio, honestidad y capacidad administrativa."
Agricultura de precision,Agricultura / Pesca / Ganaderia,"Puebla, Puebla","Empresa de vanguardia en la agricultura tecnificada, busca Vendedor Comisionista, para atender el sureste, centro y norte del pais. Producto unico sin competencia, de la mas alta calidad y precio competitivo. Producto Tecnologico para quien quiera estar a la vanguardia. Vivir en PUebla, Celaya o Merida"
Wholesum Harvest Family Farms,Agricultura / Pesca / Ganaderia,"Culiacan, Sinaloa","Somos productores de hortalizas organicas , producimos tomate, pepino, calabaza y berenjena , somo productores de alta tecnologia , riego por hidroponia"
EMPRESA AGRICOLA,Agricultura / Pesca / Ganaderia,"Zamora, Michoacan","Productora agricola Mexicana lider en la elaboracion de berries en la region innovando y desarrollando productos con los mas altos estandares de calidad, creando valor marcando la diferencia."
Grupo Avicola Quinones,Agricultura / Pesca / Ganaderia,"Guadalajara, Jalisco","Grupo Avicola Quinones es una empresa que se dedica a la produccion y venta de carne de pollo y cerdo en pie. Como parte de nuestros procesos productivos, elaboramos alimentos balanceados con materias primas de la mas alta calidad. FILOSOFIA Trabajamos para conseguir nuestros objetivos, vemos por nuestra region y creemos en ello, seguimos cada uno de nuestros valores para cumplir como personas y como trabajadores de Grupo Avicola Quinones. Siempre buscamos aplicar los conocimientos y las tecnicas mas avanzadas y relevantes en la produccion de carne de pollo y de cerdo, asi como las mejores herramientas tecnologicas para incrementar la eficiencia de los procesos de produccion y comercializacion, a traves den mejora continua, insumos de la mas alta calidad y un seguimiento cuidadoso y a conciencia que garantizan solamente los mejores productos y el mejor rendimiento para nuestros inversionistas y colaboradores. VALORES HONESTIDAD Y ETICA hacia nuestros clientes, inversionistas, colaboradores y proveedores para, de esta forma, desarrollarnos en un ambiente en el que todos los procesos son transparentes e inspiran confianza. EMPATIA, ver siempre por el otro para sensibilizarnos y poder entregar productos que alcancen los estandares de calidad que deseamos para nosotros mismos. RESPONSABILIDAD SOCIAL, ver siempre por nuestra poblacion, desarrollando economicamente a nuestra region, cumpliendo cabalmente con todos los requerimientos que se nos demandan por ley y por ser lideres en nuestra industria. COMPROMISO, crecer para poder brindar productos de una calidad cada vez mayor a nuestros consumidores. EFECTIVIDAD, lograr que nuestros procesos se realicen conforme a lo planeado, en tiempo y forma para llegar a nuestra vision. TRABAJO EN EQUIPO, tener la camiseta bien puesta pensando en el bienestar general, compartiendo y aprendiendo de todos los miembros de nuestro equipo."
Grupo Yoreme,Agricultura / Pesca / Ganaderia,"Cajeme, Sonora","Grupo Yoreme: Es una empresa regional con mas de 30 anos de experiencia en la produccion de huevo, 16 anos de experiencia en la produccion de carne de puerco y 13 anos de experiencia en la produccion de carne de res. Empresa en constante desarrollo."
La fondita de Celestun,Agricultura / Pesca / Ganaderia,"Merida, Yucatan","RESTAURANTE DE MARISCOS que lleva operando mas de 8 anos, El restaurante tiene servicio para comer en el mismo y para llevar, horario de la empresa de lunes a domingo de 9 a 6 se descansa un dia"
AGRO BERRIES,Agricultura / Pesca / Ganaderia,"Tuxpan, Jalisco",EMPRESA AGRICOLA DEDICADA AL CULTIVO DE BERRIES
ganadera rogusa,Agricultura / Pesca / Ganaderia,"Durango, Durango",EMPRESA DEL GIRO AGROPECUARIO DEDICADA A LA PRODUCCION CRIA DE GANADO BOVINO DE LA RAZA BRANGUS DE REGISTRO ASI COMO A LA AREA AGRICOLA EN PRODUCCION DE GRANO DE MAIZ AMARILLO Y ENSILAJES ASI COMO A LA PRODUCCION DE CEBADA PARA LA INDUSTRIA CERVECERA
Porcicola del Carmen,Agricultura / Pesca / Ganaderia,"La Barca, Jalisco","Es una empresa porcicola, que se dedicada a la cria, alimentacion, cuidados y engorda de ganado porcino, es una empresa de ciclo completo para los cerdos."
"Agromoleculas, SAPI DE CV",Agricultura / Pesca / Ganaderia,"Ahome, Sinaloa","Somos una empresa dedicada a la comercializacion de agro quimicos y fertilizantes liquidos, ofreciendo ademas asesoria tecnica y profesional para el agricultor en apoyo al desarrollo y cuidado de sus cultivos."
Gonzavila S.A de C.V,Agricultura / Pesca / Ganaderia,"San Gregorio Atzompa, Puebla",Empresa dedicada a la venta y distribucion de alimentos balanceados en el ramo agropecuario.
Agricola El Puma,Agricultura / Pesca / Ganaderia,"Guadalajara, Jalisco","El Puma Agrosoluciones lleva mas de 25 anos aportando lo mejor de si para que el campo en nuestro pais sea cada vez mejor. Nuestra meta es facilitar la produccion de alimentos de calidad a traves de recomendar los mejores productos quimicos, organicos y biologicos para que en los hogares de Mexico y el extranjero se coma sano"
Alimentos Rogas S.A de C.V.,Agricultura / Pesca / Ganaderia,"Culiacan, Sinaloa",!Hola!
"Macu Frescos, SPR de RL de CV",Agricultura / Pesca / Ganaderia,"Leon, Guanajuato","Macu es una empresa localizada en la ciudad de Leon, Guanajuato que se dedica primordialmente a la produccion, proceso y exportacion de hortalizas frescas a diferentes mercados internacionales."
Chien Pets de Mexico,Agricultura / Pesca / Ganaderia,"Guadalajara, Jalisco","ChienPets dedicados a la salud animal,"
MG BERRIES,Agricultura / Pesca / Ganaderia,"Tala, Jalisco",Empresa agricola dedicada a la produccion de berries en el estado de jalisco municipio de Tala... Estamos buscando gente joven con talento y muchas ganas de crecimiento laboral y profesional.
Rancho La Guadalupe,Agricultura / Pesca / Ganaderia,"Coalcoman de Vazquez Pallares, Michoacan","Nos dedicamos al sector ganadero con amplio conocimiento en venta y compra de ganado, asi como la administracion del mismo, en busqueda de gente que busque crecer"
"ESMC Corporativo Mexico S,A. de C.V.",Agricultura / Pesca / Ganaderia,"Puebla, Puebla","Empresa que orece productos y Servicios para el Agro, Ganaderia y Pesca."
AGRICOLA JIRZA,Agricultura / Pesca / Ganaderia,"Ensenada, Baja California",SOMOS UNA EMPRESA AGRICOLA DEDICADA A LA SIEMBRA DE HORTALIZAS CON PRESENCIA EN LOS MERCADOS NACIONALES E INTERNACIONALES. CON VARIOS CENTROS DE TRABAJO A LO LARGO DE LA ANTIGUA RUTA DEL VINO EN BAJA CALIFORNIA
"INDUSTRIAS COREREPE, SA DE CV",Agricultura / Pesca / Ganaderia,"Ahome, Sinaloa","Empresa lider en el ramo, dedicada a:"
Exito Agrotecnologico,Agricultura / Pesca / Ganaderia,"Colon, Queretaro","Dedicada a la siembra, cultivo y cosecha de jitomate o tomate rojo.Servicios administrativos generales. Sociedad Anonima de Capital Variable ..................................... ..... ......."
Vegetales La Abeja,Agricultura / Pesca / Ganaderia,"Guadalajara, Jalisco","Vegetales La Abeja, es una empresa productora, procesadora y comercializadora de productos vegetales. Creada hace mas de 7 anos, es un empresa joven y en constante desarrollo que atiende clientes mayoristas como autoservicios, comedores industriales y restaurantes, hasta clientes al menudeo."
Capital Fruits,Agricultura / Pesca / Ganaderia,"Tala, Jalisco","En Capital Fruits nos especializamos en la comercializacion de fruta de la mejor calidad, gracias a nuestro compromiso y dedicacion, hemos creado grandes alianzas con nuestros clientes y proveedores dandoles siempre el mejor resultado."
"Abastecedora Agricenter, S.A. DE C.V.",Agricultura / Pesca / Ganaderia,"Aguascalientes, Aguascalientes","Comercializadora con presencia a nivel Nacional donde ofrecemos soluciones para todo tipo de cosechas. Contamos con productos de alta calidad y con las mejores marcas que actualmente se encuentran en el mercado. Tenemos una amplia gama de productos desde fertilizantes, agroquimicos y semillas y servicios que comprenden analisis de suelo, de agua y de planta; productos para invernadero, maquinaria y equipo y una linea urbana."
Marketing Agropecuario,Agricultura / Pesca / Ganaderia,"Cuernavaca, Morelos","Importador y comercializador de refacciones para la industria agropecuaria. Incubadoras, clasificadoras de huevo, termonebulizadores, equipo de ventilacion, Equipo de Medicion,"
CAMPO AGRICOLA ROCO SPR DE RL,Agricultura / Pesca / Ganaderia,"Jacona, Michoacan",SOMOS UNA EMPRESA DEDICADA AL CULTIVO Y EXPORTACION DE BERRIES Y HORTALIZAS ESTAMOS EN CONSTANTE CRECIMIENTO.
AGRO SAN FRANCISCO BERRIES,Agricultura / Pesca / Ganaderia,"Queretaro, Queretaro","Hace mas de 20 anos que en Agro San Francisco nos dedicamos a la venta de productos Agricolas. En estos anos no hemos parado de crecer y aprender hasta llegar a ofrecer la venta online a nuestros clientes, y exportaciones directas a USA."
productores huertas del pinabete spr de rl,Agricultura / Pesca / Ganaderia,"Zapopan, Jalisco","Somos una empres agricola dedicada a la cosecha de Arandano, solocitamos personal para labores agricolas, somos una empresa comprometida con el medio ambiente y el buen trato a nuesro capital."
Grupo PIASA,Agricultura / Pesca / Ganaderia,"Boca del Rio, Veracruz","Conformado por tres de los Ingenios mas modernos y productivos del pais; Ingenio Tres Valles, Ingenio Adolfo Lopez Mateos, e Ingenio Plan de San Luis, en los estados de Veracruz, Oaxaca y San Luis Potosi, respectivamente."
TODO PARA EL CAMPO,Agricultura / Pesca / Ganaderia,"Aguascalientes, Aguascalientes","EMPRESA DEDICADA A OFRECER LOS MEJORES SERVICIOS AL ALCANCE DE CUALQUIER PERSONA, LLEVANDO LA TECNOLOGIA AL CAMPO Y ASI PODER ALCANZAR LOS MAXIMOS POTENCIALES DE NUESTROS PRODUCTOS, PREVINIENDO GASTOS INNECESARIOS EN LOS CULTIVOS."
FRUBANA MEXICO,Agricultura / Pesca / Ganaderia,"Cuauhtemoc, Ciudad de Mexico DF",Somos una empresa de tecnologia que conecta al campo directamente con el
Grupo ARGO,Agricultura / Pesca / Ganaderia,"Quecholac, Puebla","Somos una empresa comercializadora de frutas y vegetales, actualmente surtimos cadenas de supermercados, hoteles y restaurantes. Proveemos productos a granel y Pre-elaborados."
Productores de papaya La Cristina S de PR de CV,Agricultura / Pesca / Ganaderia,"San Jacinto Amilpas, Oaxaca","Empresa responsable y con buen ambiente de trabajo para el empleado y instalaciones en buen estado.,.........................con mas de 15 anos en el sector comercial"
Green Life Exteriorismo,Agricultura / Pesca / Ganaderia,"Zapopan, Jalisco","Empresa dedicada al diseno y mantenimiento de jardines. Paredes Verdes naturales y artificiales, puesta de pasto natural y artificial. Instalacion y venta de todo tipo de macetas de barro y fibra de vidrio. Venta e instalacion de arboles y plantas varias."
Anjopadi,Agricultura / Pesca / Ganaderia,"Martinez de la Torre, Veracruz","somos una empresa dedicada a : producir, empacar, comercializar, exportar, diversos articulos del campo como son, limones, zanahoria, brocoli, cilantro, cebolla, lechuga, etc. constantemente requerimos de personal de confianza dedicado al apoyo de diversas areas como son en la produccion, la maquila, el empaque, y por supuesto en al administracion."
DEL CAMPO Y ASOCIADOS SA DE CV,Agricultura / Pesca / Ganaderia,"Culiacan, Sinaloa","Somos una empresa dedicada al cultivo y venta de tomate fresco, de la mejor calidad para el mercado global, la calidad de nuestros productos nos distingue."
Agromaster,Agricultura / Pesca / Ganaderia,"Ahome, Sinaloa","Empresa Agricola con mas de 30 anos en el mercado, comercializando productos vegetales en todo el pais. Contamos con la infraestructura y tecnologia de punta para ofrecer nuestros productos con la calidad y excelencia que se requiere."
Villaz,Agricultura / Pesca / Ganaderia,"Puebla, Puebla",Produccion organica de hortalizas en invernadero.
