Empresa,Area,Ubicacion,Descripcion
Ceva Salud Animal SA de CV,Agricultura / Pesca / Ganaderia,"Cuernavaca, Morelos","Perfil de la empresa Ceva Sante Animale se encuentra posicionada como una de las tres empresas Farmaceuticas Veterinarias con mayor crecimiento a nivel mundial durante los ultimos cinco anos. Esto nos ubica en el noveno lugar a nivel mundial dentro del segmento de Salud Animal; esta considerada como una empresa joven, ya que fue fundada en el ano 1999. Nuestra experiencia se centra en los campos de Biologicos y Farmaceuticos, ademas de contar con equipos especializados cuyo objetivo es satisfacer las demandas especificas de las aves de corral, rumiantes, cerdos y animales de compania. Nos esforzamos continuamente para encontrar mejores soluciones tanto para las enfermedades ya existentes como para las emergentes, que a su vez mejoran la salud animal y la productividad. Nuestra atencion va mas alla del bienestar de los animales. Hoy en dia, un 75% de las enfermedades infecciosas emergentes humanas, son de origen animal. Ceva esta involucrada en la lucha contra la propagacion de enfermedades infecciosas que pueden transmitirse de los animales a los seres humanos, enfermedades conocidas como zoonosis, que incluyen la gripe aviar, la brucelosis y la fiebre-Q. Ceva es partidaria de contribuir a la asistencia social, asi como en programas de apoyo alrededor del mundo. Nuestro trabajo abarca desde la investigacion, el desarrollo, la produccion y el suministro de productos de salud animal a los propietarios de ganado con mayores necesidades en el mundo, de los cuales nuestro SOS (Stamp Out Sleeping sickness) en Uganda es un buen ejemplo, o el donativo en el Reino Unido a Asociaciones Caninas de DAP Collar (Dog Appeasing Pheromone) , con el objeto de hacer la vida de animales de compania menos estresante. Ceva combina rentabilidad con el crecimiento a largo plazo. Estamos presentes en 37 paises, con 7 oficinas representativas de ventas, 9 centros de investigacion y desarrollo, 12 fabricas y 2.275 colaboradores en todo el mundo. Nuestras actividades operacionales se centran en la investigacion, desarrollo, produccion, comercializacion y correcta administracion de los productos."
Serasin S.A de C.V.,Agricultura / Pesca / Ganaderia,Sinaloa,"Empresa dedicada a la comercializacion de granos y insumos agricolas, tales como agroquimicos fertilizantes y semillas."
Servicios y Suministros Industriales,Agricultura / Pesca / Ganaderia,"Reynosa, Tamaulipas",Nuestra compania esta dedicada a dar servicio en el control de plagas tanto en los hogares como en la industria y comercio en general.Nuestra compania esta dedicada a dar servicio en el control de plagas tanto en los hogares como en la industria y comercio en general.Contamos con nuestros permisos autorizados y equipos adecuados para fumigar. Asi como el Certificado de fumigacion por evento. Nuestra experiencia en el mercado manejando marcas de prestigio a nivel nacional e internacional nos respalda como una empresa de confianza.
BC Seafood S de RL,Agricultura / Pesca / Ganaderia,"Tijuana, Baja California","Somos una empresa establecida en Tijuana, con oficinas en el puerto de Ensenada, que procesa y exporta pescados y mariscos frescos, congelados y vivos. Los productos son exportados a Asia, para ser entregados a los distribuidores de Alimentos de Servicio, restaurantes, distribuidores mayoristas y minoristas, cadenas de restaurantes, hoteles y de supermercados."
Azul Agricultura y Servicios S.A de C.V.,Agricultura / Pesca / Ganaderia,"Zapopan, Jalisco",Cultivo y cosecha de Agave
Clinica Veterinaria Luum,Agricultura / Pesca / Ganaderia,Quintana Roo,Clinica Veterinaria con servicio de albergue para especias caninas.
Chiles Selectos del bajio sa de cv,Agricultura / Pesca / Ganaderia,Guanajuato,CHILES SELECTOS DEL BAJIO SA DE CV Somos una empresa dedicada a la seleccion de chiles de temporada de la mejor calidad en el mercado.
Comite Estatal S.P.O. A.C.,Agricultura / Pesca / Ganaderia,"Cuernavaca, Morelos","Empresa dedicada al Sector Ornamental, Desarrollo de Proyectos, Organizacion de Eventos Nacionales e Internacionales. Lider en el Sector Ornamental"
Comite Estatal de Sanidad Vegetal de Tabasco,Agricultura / Pesca / Ganaderia,Tabasco,"Los Organismos Auxiliares de Sanidad Vegetal (OASV) son organizaciones de productores agricolas o forestales que coadyuvan con la secretaria en el desarrollo de las campanas fitosanitarias, programas de inocuidad agroalimentaria, otros servicios fitosanitarios y sistemas de calidad que esta implante en todo o parte del territorio nacional. Costitucion El 21 de agosto de 1996 se constituyo el Comite Estatal de Sanidad Vegetal de Tabasco (CESVETAB), para trabajar en conjunto con el Gobierno del Estado (SEDAFOP) y la Secretaria de Agricultura, Ganaderia, Desarrollo Rural, Pesca y Alimentacion (SAGARPA), juntos para establecer campanas y programas de prevencion, control y combate de plagas y enfermedades mas comunes que afectan los cultivos de los productores de la entidad, y asi conservar y preservar la calidad de los productos que lo distinguen. Mision Proporcionar servicios Fitosanitarios de acuerdo a la legislacion aplicable vigente, con la finalidad que nuestros clientes obtengan productos agricolas sanos e inocuos de alta calidad, que satisfagan sus necesidades. Vision Ser organismo de excelencia con reconocimiento nacional e internacional basado en un sistema de gestion de la calidad que satisfaga totalmente a nuestros clientes. Base Legal Los OASV estan previstos en la Ley Federal de Sanidad Vegetal, en su articulo 7, 14, 33 y 47; en el Reglamento de la Ley de Sanidad Fitopecuaria de los Estados Unidos Mexicanos en Materia de Sanidad Vegetal, articulos 23, 24, 25, 26, 27 28, 29, 30, 31, 32, 33, 34, 35, 36, 37, 38, 9, 40 Y 47; en el Reglamento Interior de los Organismos Auxiliares y disposiciones emitidas por la Secretaria. JLSV Y CESVETAB Dichos OASV se clasifican en dos figuras que son Junta Local de Sanidad Vegetal y Comite Estatal de Sanidad Vegetal. Las Juntas Locales de Sanidad Vegetal son las que preparan las campanas fitosanitarias y son coordinadas por los Comites Estatales de Sanidad Vegetal (CESV), sin demerito de la Coordinacion de la Secretaria, a traves de la Delegacion de la SAGARPA y el Distrito de Desarrollo Rural respectivo."
Servicios de Jardineria y Transportes SA de CV,Agricultura / Pesca / Ganaderia,Aguascalientes,"Nos dedicamos a la venta de pasto en rollo, y a los acarreos de agua potable."
Comite Estatal para el Fomento y Proteccion Pecuaria de Q Roo,Agricultura / Pesca / Ganaderia,Quintana Roo,"El Comite Estatal para el Fomento y Proteccion Pecuaria de Quintana Roo, surge con la inquietud de llevar un mejor servicio a los productores pecuarios y tener un mejor status en la Salud Animal del Estado."
Magdalena Berry Farms,Agricultura / Pesca / Ganaderia,Baja California,Empresa Agricola exportadora
Procesadora carnica de puebla,Agricultura / Pesca / Ganaderia,Puebla,
Cooperativa de Consumo Ganaderos S.C.L,Agricultura / Pesca / Ganaderia,Tabasco,Empresa dedicada a la compra-venta de productos agroveterinarios.
"Centro de Capital Intelectual y Competitvidad, S.A. de C.V.",Agricultura / Pesca / Ganaderia,Ciudad de Mexico DF,"Nuestra empresa tiene 6 anos de experiencia en programas de Competitividad en todas las areas como son Agricultura, Ganaderia, Pesca, Agropecuaria, Carreteras, Farmaceutica, Turismo"
Union Ganadera Regional de Aguascalientes,Agricultura / Pesca / Ganaderia,Aguascalientes,---
Union Ganadera Regional Ganadera,Agricultura / Pesca / Ganaderia,"Palenque, Chiapas",---
WestfaliaSurge Mexicana S.A. de C.V.,Agricultura / Pesca / Ganaderia,"Aguascalientes, Aguascalientes","Venta de equipos de ordeno para vacas, cabras y ovejas, detergentes para la limpieza de la ubre y el establo."
Yarche International SA de CV,Agricultura / Pesca / Ganaderia,"Zapopan, Jalisco","Estamos confiados permanentemente a la compra de productores locales cuyas frutas y verduras cumplen nuestros estandares de alta calidad. Particularmente los que cultivan organico y libre de pesticidas, asi mismo estamos dedicados a la asesoria para una agricultura respetuosa del medio ambiente."
Italian Textil,Agricultura / Pesca / Ganaderia,Yucatan,Empresa dedicada a la comercializacion de productos agricolas y refacciones textiles.
Grupo Nova sa de cv,Agricultura / Pesca / Ganaderia,"Puebla, Puebla",Empresa dedicada a la investigacion de laboratorio.
Znova Agroindustrias,Agricultura / Pesca / Ganaderia,Yucatan,Empresa dedicada a agricultura
Food & Drinks Co.,Agricultura / Pesca / Ganaderia,"Veracruz, Veracruz","We are a global company that is in expansion, we transform and prepare food, fruit and natural drinks conserving the best process and vitamins of the nature and sell them in the principal markets in the world. Now we are interested in expand our business in the zone GULF OF MEXICO. If you are interested in getting a good job in a good company, we appreciate your high interest. You can contact us or send your resume to our English business representant and North american director at ***********@yahoo.co.uk VISION: The best, FOOD and DRINKS for everybody Today Right Now and Enjoy building the BEST Human World of Tomorrow. El ingreso minimo es el equivalente a 1000 EURO, horas extra pagadas sin romper lo establecido en la ley mexicana LFT Articulo 66. Podra tambien prolongarse la jornada de trabajo por circunstancias extraordinarias, sin exceder nunca de tres horas diarias ni de tres veces en una semana. Aunque la compania establece no mas de 5 horas semanales en pues implica que algo sucede mal internamente. Necesario excelente manejo de PC. Organizacion en expansion en zona GOLFO, en 6 meses en estados del PACIFICO-MEXICO, 12 meses en Centro America, operando bajo otro nombre en las 7 economias o paises principales del planeta. Nosotros creemos en la gente que no tiene ataduras de razismo, sexismo o ideologico, no importa tu edad ni tu experiencia amplia o nula, Trabajo de planta, Fondo de Ahorro, contactanos con tu curricula al correo electronico de Mister Mickey Laphont, representante de FOOD and DRINKS Co. para MEXICO-GOLFO, el trabajo en equipo es el mas altamente valorado en la empresa, los valores armonicos universales llevados al mas alto nivel. Muestra tu individualidad al mundo, la vida es ahora, no manana, aunque el manana con nosotros sera mucho mejor. De antemano gracias por tu participacion e interes por la empresa, considera que puedes ser seleccionado durante el proximo mes y medio. Considera que recibiremos de diversos lugares las curriculas por lo que solicitamos que el titulo de tu mail comience con 3 letras de tu estado. VER-veracruz TAB-tabasco TAM-tamaulipas CAM-campeche YUC-yucatan ejemplo de titulo: ""TAB+palabra (ingeniero o licenciado u otro)"" Que tengas un buen dia y mucha suerte. Nota: la proxima semana se dan a conocer la direccion de las instalaciones en Campeche, Tabasco, Merida, Yucatan a preseleccionados."
Cocos Plus S.P de R.L,Agricultura / Pesca / Ganaderia,Michoacan,Comercializacion del fruto coco.
Comgen,Agricultura / Pesca / Ganaderia,Queretaro,"Somos una empresa dedicada a la importacion y comercializacion de productos para la reproduccion animal. Nos preocupamos por mejorar la genetica de las ganaderias de produccion lechera y carnica. Ofrecemos una gran seleccion de razas bovinas y caprinas, cuyas caracteristicas tecnicas y rendimientos de cria son capaces de responder a la problematica de los ganaderos de todo el mundo."
Comercializadora Rio Cuarto SA de CV,Agricultura / Pesca / Ganaderia,"Tlalpan, Ciudad de Mexico DF",Empresa con 12 anos de experiencia dedicada a la importacion de pescado congelado
Tahi Flores Exoticas,Agricultura / Pesca / Ganaderia,Morelos,"Plagio denunciado por ****@orquidea.com.mx //////////////// Tahi Flores Exoticas S.A. de C.V. es un invernadero de orquideas dedicado al cultivo y venta de plantas, contamos con 15 invernaderos con clima controlado y somos los mas grandes en Mexico en el cultivo de la orquidea phalaenopsis."
Comercial Rosas Zuniga S.A de C.V.,Agricultura / Pesca / Ganaderia,Sonora,"Comercial RZ es una empresa nueva, que se dedica a la comercializacion de camaron para exportacion y consumo nacional, nuestro trabajo principal es en camaron de bahia, nos dedicamos al proceso de camaron en fresco."
Rancho Agricola Cucu,Agricultura / Pesca / Ganaderia,Jalisco,"Rancho agricola 5000 hectareas, con cultivos protegidos y de campo abierto."
Union de Productores de Leche Calamanda S.A. de C.V.,Agricultura / Pesca / Ganaderia,Queretaro,Empresa de Explotacion Ganadera Lechera
Chiapas Granjas Organicas,Agricultura / Pesca / Ganaderia,"Monterrey, Nuevo Leon","Chiapas Granjas Organicas es una empresa mexicana socialmetne responsable. Nos dedicamos a la produccion y comercializacion de frutas y hortalizas de la mas alta calidad, asi como cafe organico; tanto en el mercado nacional como en el internacional. En Chiapas Granjas Organicas nos preocupamos por el consumidor, por el productor y por el medio ambiente."
Ciencias Tecnicas para el Desarrollo de Oaxaca,Agricultura / Pesca / Ganaderia,Oaxaca,"Somos una Agencia de Desarrollo Rural donde brindamos asesoria tecnica especializada a diferentes tipos de cultivos, dentro de los cuales destacan las hortalizas, maiz, cafe y cana, en comunidades de la sierra norte de Oaxaca."
"Citrus Game, S.A. de C.V.",Agricultura / Pesca / Ganaderia,"Hermosillo, Sonora","Compra y Venta de Naranjas, Empaque, para venta Local y Exportacion."
Comercializadora Internacional Arizona,Agricultura / Pesca / Ganaderia,Sinaloa,Comercializacion y acopio de frijol
Comite p/Desarrollo y Proteccion Pecuaria del Edo SLP AC,Agricultura / Pesca / Ganaderia,San Luis Potosi,"Participar con la Secretaria de Agricultura, Ganaderia, Desarrollo Rural, Pesca y Alimentacion a traves del Servicio de Sanidad, Inocuidad y Calidad Agroalimentaria y con el Gobierno del Estado de San Luis Potosi; en la formulacion, operacion y ejecucion de planes y programas de fomento pecuario, zoosanitario, cuarentenas y campanas para la prevencion, control y erradicacion de enfermedades y plagas de los animales, asi como el establecimiento, supervision y operacion de puntos de verificacion e inspeccion para el control de movilizacion de animales, productos y subproductos agropecuarios."
CAMPI Fidus,Agricultura / Pesca / Ganaderia,Ciudad de Mexico DF,"CAMPI, tomando su experiencia y liderazgo en alimentacion balanceada para el mercado pecuario, desarrollo su linea de alimento para Mascotas ofreciendote toda la seguridad de una nutricion completa con los mejores ingredientes para animales de compania. Formulado con carne, pollo y arroz que le ofrecen nutricion completa, huesos y musculos firmes, y heces con poco olor y consistencia firme. La linea Mascota de Campi, le ofrece la mejor opcion a un precio justo."
Carnes Finas San Juan de La Rioja S.A de C.V,Agricultura / Pesca / Ganaderia,"Monterrey, Nuevo Leon",Empresa lider en su ramo
Feedlothr,Agricultura / Pesca / Ganaderia,---,Recognized Beef Feedlot Company.
Fabrica de Puros Don REMO,Agricultura / Pesca / Ganaderia,Tabasco,Fabricacion y siembra de tabaco
Casa Mallo SA,Agricultura / Pesca / Ganaderia,Extranjero,"Empresa agricola en Guinea Ecuatorial, viveros de plantas tropicales, jardineria y mantenimientos, asi como cultivos de cacao, pina..etc"
Distribuidora de Carnes Camacho,Agricultura / Pesca / Ganaderia,Veracruz,"Empresa lider en el ramo con mas de 10 anos de experiencia. Nos dedicamos a la comercializacion de carne de Res y Puerco cubriendo con los estandares de calidad requeridos en el mercado, y satisfaciendo las necesidades de nuestros clientes."
Agro Equipos S.A. de C.V.,Agricultura / Pesca / Ganaderia,"Acacoyagua, Chiapas","Empresa Fundada en 1974 con el objetivo de impulsar el desarrollo del campo, siendo el proveedor de Maquinaria Agricola y de construccion con la finalidad de minimizar los tiempos y maximizar la produccion."
Productos Carnicos del Norte,Agricultura / Pesca / Ganaderia,"Saltillo, Coahuila",Empresa con 20 anos de experiencia en el rubro alimenticio de carnicos.
Empacadora Agricola Campomex SA de CV,Agricultura / Pesca / Ganaderia,"Irapuato, Guanajuato",Empresa dedicada a la exportacion de Vegetales Frescos;
Ganaderia Selecta S. A. de C.V.,Agricultura / Pesca / Ganaderia,"Puebla, Puebla","venta de carne de bufalo en cortes tipo americano, y productos lacteos con leche de bufala. Los bufalos son criados y sacrificados por nosotros dentro del estado de Puebla."
Calesa Agro Industrial Sa de Cv,Agricultura / Pesca / Ganaderia,Guanajuato,Somos una empresa tostadora y empacadora de cafe
Empresa Carnica TIF,Agricultura / Pesca / Ganaderia,"Guadalupe, Nuevo Leon","Empresa del Giro Carnico, con Certificacion TIF."
Nucleo Marketing SA de CV,Agricultura / Pesca / Ganaderia,"Azcapotzalco, Ciudad de Mexico DF",Asesoria y desarrollo de estrategias de negocio
"Fertilizantes y Servicios del Centro, SA de CV",Agricultura / Pesca / Ganaderia,"Irapuato, Guanajuato",Somos una empresa dedicada a la comercializacion de fertilizantes para el campo.
Negocios Sostenibles ABC Mexico,Agricultura / Pesca / Ganaderia,"San Cristobal de las Casas, Chiapas","Facilitar procesos de desarrollo sustentable, mediante herramientas participativas para la implementacion de buenas practicas sociales, economicas y ambientales en la agricultura."
Forrajes Naivi,Agricultura / Pesca / Ganaderia,"Santa Apolonia Teacalco, Tlaxcala","Solicito Cargador, Ayudante general, Oficina, Practicas profesionales, Pasante de contabilidad o Auxiliar contable. Con expectativas de menos de $2800.- al mes. De 9 am. a 6 pm. Mi familia se dedica a la venta de maiz, frijol, revoltura, fertilizantes y animales de granja. Tengo un despacho propio y soy titulada en Contaduria Publica, con Cedula Profesional, Maestria en Administracion, cuento con conocimientos y experiencia en Nomina, calculo de ISR, iMSS, Finiquitos, impuestos, declaraciones, tramites ante el SAT, IMSS, INFONAVIT, conciliaciones bancarias, manejo de SUA, NOI, COI, Tesoreria, trato con proveedores, etc."
"Agricola del Nainari, S.A. de C.V.",Agricultura / Pesca / Ganaderia,Sonora,"Empresa dedicada a la siembra, cosecha y empaque de Hortaliza"
Natura Proveedor Biologico,Agricultura / Pesca / Ganaderia,Estado de Mexico,Compra y venta de alimento vivo para animales exoticos
Nagrocorp,Agricultura / Pesca / Ganaderia,"Atlixco, Puebla","NAGROCORP es un Corporativo Mexicano con un sistema vertical que desarrolla toda la cadena productiva de la industria hidroponica, enfocado a la gestion de proyectos, la venta de tecnologia la produccion de hortalizas hidroponicas y su comercializacion Internacional."
Ingenieria Industrial,Agricultura / Pesca / Ganaderia,Estado de Mexico,Somos una empresa dedicada a la exportacion de productos agroquimicos.
Norel Inmo SA de CV,Agricultura / Pesca / Ganaderia,"El Marques, Queretaro",Venta de Aditivo Para Alimento Animal Nuestro Objetivo: Contribuir con nuestra sociedad mediante el desarrollo de aditivos que sean rentables para los clientes y nuestra empresa.
Summit Agro Mexico Servicios sa de cv,Agricultura / Pesca / Ganaderia,Ciudad de Mexico DF,Es una empresa Japonesa dedicada a la distribucion de productros agroquimicos // Fertilizantes
"Surtidora del Bajio, S.A. de C.V.",Agricultura / Pesca / Ganaderia,"Queretaro, Queretaro","Surtidora del Bajio, S.A. DE C.V. es una empresa mayorista e importadora de granos, semillas, fruta seca y especias en general, nace en 1989 en la ciudad de Queretaro, con el objetivo de abastecer la zona del Bajio."
Sifatec,Agricultura / Pesca / Ganaderia,Ciudad de Mexico DF,Produccion de productos agricolas
Servicios finacieros,Agricultura / Pesca / Ganaderia,Nuevo Leon,---
Union Ganadera Regional de San Luis Potosi,Agricultura / Pesca / Ganaderia,"San Luis Potosi, San Luis Potosi",---
"Poductores de Avestruces, Venado y Coonservas",Agricultura / Pesca / Ganaderia,Estado de Mexico,"Productores de Avestruces, Venado y Conservas de Verduras yFrutas Rancho San Andres"
Raesa Mexico SA de CV,Agricultura / Pesca / Ganaderia,"Queretaro, Queretaro",Empresa trasnacional lider en el ramo de riego agricola.
RJ Consultores,Agricultura / Pesca / Ganaderia,Puebla,Rancho dedicado a la agricultura y ganaderia
Hortalinda SC de RL de CV,Agricultura / Pesca / Ganaderia,"La Independencia, Chiapas","Somos productores y distribuidores de Jitomate saladette, cuyo objetivo es brindarle a nuestros clientes la mejor calidad, precio y frescura. Estamos ubicados en la independencia Chiapas."
Refacciones Agricolas Flores,Agricultura / Pesca / Ganaderia,"Salamanca, Guanajuato",Empresa dedicada a la venta de insumos para la agricultura.
Carni-K,Agricultura / Pesca / Ganaderia,"La Barca, Jalisco",Rastro Obrador de Cerdos con certificacion T.I.F.
Grupo la Pillarica S.A. de C.V.,Agricultura / Pesca / Ganaderia,Estado de Mexico,"Posible fraude denunciada ------------------------------------------------------------------------Empresa dedicada a la fabricacion de Alimentos Ganaderos y agricolas y su comercializacion en los canales de Detalle, Autoservicios, Mayoreo y Menudeo."
Cal S.A. de C.V.,Agricultura / Pesca / Ganaderia,"Guadalupe, Nuevo Leon","Empresa del Giro Alimenticio con certificacion TIF, planta procesadora de Res para consumo Regional y Exportacion"
Promotora de Palma del Soconusco,Agricultura / Pesca / Ganaderia,Chiapas,Somos una empresa agroindustrial dedicada a la compra y procesamiento del fruto de la palma africana.
"Agricola Maas, S.A. DE C.V.",Agricultura / Pesca / Ganaderia,"Penjamo, Guanajuato",Somos una Empresa que se dedica a la produccion y comercializacion de productos de hidroponia.
Driscoll's,Agricultura / Pesca / Ganaderia,"Jocotepec, Jalisco","Empresa trasnacional de origen americano, dedicada a la produccion y comercializacion de bayas (fresa, frambuesa, zarzamora, arandonos, etc.) con base en Jocotepec, Jalisco, y presencia en Cd. Guzman, Michoacan y Baja California a nivel nacional; y en paises como Espana, Portugal, Australia, Chile y Holanda."
Grupo Empresarial,Agricultura / Pesca / Ganaderia,"Tehuacan, Puebla",Importante Grupo Empresarial
"Pavos Viridiana, SA CV",Agricultura / Pesca / Ganaderia,Yucatan,"Pavos Frescos, Congelados, Ahumados y en Pie"
Implementos Agricolas s.a de c.v,Agricultura / Pesca / Ganaderia,"Celaya, Guanajuato",Venta Implementos Agricolas y Gnaderos
Proveedora de Insumos Agropecuarios del Norte S.A. de C.V.,Agricultura / Pesca / Ganaderia,"Chihuahua, Chihuahua",Empresa dedicada a la distribucion de fertilizantes y agroquimicos en el estado de Chihuahua y la zona Lagunera.
Avicola del Noroeste,Agricultura / Pesca / Ganaderia,"Cajeme, Sonora",Giro Avicola
"Productos Pesqueros de Topolobampo, S.A.de C.V.",Agricultura / Pesca / Ganaderia,Sinaloa,"Productos Pesqueros de Topolobampo, S.A. de C.V. tiene como objetivo continuar con su crecimiento y planes para consolidarse en el mercado. La empresa ubicada en Topolobampo, Sinaloa desde 2009 comenzo la construccion y desarrollo de un laboratorio de produccion de crias de Tilapia. Actualmente dedicada tambien a la engorda a escala comercial de Tilapia en agua de mar, para continuar con la construccion y puesta en marcha de su planta de procesamiento de Tilapia."
Procesadora de Empaques Ganadera de Sonora,Agricultura / Pesca / Ganaderia,"Hermosillo, Sonora",Rastro bovino y frigorificos.
Reclutamiento S. A. DE C. V.,Agricultura / Pesca / Ganaderia,Ciudad de Mexico DF,Empresa dedicada en el Reclutamiento y seleccion. Puestos en el Distrito Federal.
Pesca Azteca,Agricultura / Pesca / Ganaderia,Sinaloa,Empresa Lider en latinoamerica dedicada a la Pesca de Atun
Rancho Rincon del Paraiso,Agricultura / Pesca / Ganaderia,Guanajuato,"Rancho Rincon del Paraiso; es una empresa del giro agricola, principalmente se dedica a la produccion de leche"
Pa'Lante Veracruz S. de R.L. de C.V.,Agricultura / Pesca / Ganaderia,"Chinampa de Gorostiza, Veracruz","Empresa dedicada al acopio de ganado para ventas de exportacion y mercado nacional; somos una empresa lider en nuestro ramo. Nuestro principal objetivos son las ventas de ganado de exportacion hacia los Estados Unidos de America, siendo uno de los mayores exportadores a nivel nacional."
Norson,Agricultura / Pesca / Ganaderia,"Hermosillo, Sonora","Somos una empresa integrada verticalmente a fin de controlar cada fase del proceso de produccion para ofrecer a nuestros clientes productos con un sabor unico y calidad superior. En Norson tenemos bajo control la crianza de los cerdos, la produccion de su alimento, el transporte, industrializacion, almacenaje, comercializacion y la distribucion nacional e internacional, asegurando de esta forma el abasto oportuno y la calidad de la materia prima. Formamos parte de una alianza estrategica con SMITHFIELD FOODS La empresa comercializadora de carne de cerdo mas grande del mundo. Esta alianza nos permite tener mayor flexibilidad en nuestros procesos para satisfacer las necesitadas especificas de nuestros clientes; y adquirir constantemente conocimiento y asesoria en las actualizaciones del mercado."
Mainland Farms,Agricultura / Pesca / Ganaderia,"Zamora, Michoacan","Empresa dedicada a la produccion y comercializacion de Berries (fresa, arandanos, zarzamora) Mision Trabajar duro dia a dia para lograr la conexion mas eficiente entre el campo y el consumidor final, estableciendo una relacion ganar  ganar con nuestros socios estrategicos (agricultores y distribuidores) a traves de la responsabilidad social, inocuidad, trabajo en equipo, crecimiento continuo y calidad. Vision Ser reconocida como la empresa #1 de produccion y exportacion de berries en Mexico con los mejores estandares de inocuidad y calidad en el mercado."
Isaias,Agricultura / Pesca / Ganaderia,Nuevo Leon,Agencia de Publicidad
