Empresa,Area,Ubicacion,Descripcion
"Coseci Agro, S.C.",Agricultura / Pesca / Ganaderia,"Celaya, Guanajuato",Consultoria especializada en la gestion de Programas de Inocuidad Alimentaria.
Nutrivet,Agricultura / Pesca / Ganaderia,"Aguascalientes, Aguascalientes","NUTRIVET, es una empresa dedicada a la venta y distribucion de alimentos, medicamentos y productos veterinarios para animales de compania. En la actualidad atendemos las necesidades de las mas de 180 clinicas y farmacias veterinarias de los estados de Aguascalientes y Zacatecas, asi como a los criadores de mascotas y particulares mediante una eficiente red de distribucion comprometida con el bienestar y la Salud Animal."
Nupropec,Agricultura / Pesca / Ganaderia,"La Paz, Estado de Mexico",Empresa dedicada a la venta de nucleos y complementos para la alimentacion del ganado.
Nutrientes Organicos y Minerales SA de CV,Agricultura / Pesca / Ganaderia,"Acatic, Jalisco",NOMSA es una empresa dedicada a la formulacion de Nutrientes Organicos y minerales.
"Nutrikowi Alimentos, S. A. DE C. V.",Agricultura / Pesca / Ganaderia,"Navojoa, Sonora",Planta elaboradora de alimento balanceado para cerdos.
Comercializadora Espi SA de CV,Agricultura / Pesca / Ganaderia,Sinaloa,"Somos una Empresa agricola, nos dedicamos a la produccion de productos agricolas, compra y venta de productos agricolas, etc."
Servicios Agropecuarios y Evaluacion de la Conformidad,Agricultura / Pesca / Ganaderia,Puebla,---
GANFER Sociedad Agricola,Agricultura / Pesca / Ganaderia,"Imuris, Sonora","GANFER SOCIEDAD AGRICOLA, es una empresa dedidcada ala Siembra, cultivo de hortaliza en invernadero hidroponico asi como a la exportacion del mismo."
Flornatec,Agricultura / Pesca / Ganaderia,Puebla,"FLORNATEC FLORNATEC es una empresa que tiene como Mision Producir plantas ornamentales de calidad estableciendo una relacion cercana con el cliente orientandolo sobre las caracteristicas de nuestros productos. NUESTRA VISION, Lograr un posicionamiento en el mercado global como los mejores productores de plantas ornamentales con constante innovacion tecnologica."
Cheminova Agro de Mexico,Agricultura / Pesca / Ganaderia,Ciudad de Mexico DF,"Empresa Trasnacional dedicada a la sintesis, formulacion y comercializacion de Agroquimicos."
Fermi,Agricultura / Pesca / Ganaderia,Sinaloa,"Empresa dedicda a la comercilaizacion e implementacion de soluciones agricolas en 2 grandes areas: 1)Soluciones agricolas: proyectos de riegos, agricultura protegida y elaboracion de proyectos en general asi como la comercializacion de sus componentes. 2) Soluciones energeticas: energias alternativas en situaciones geograficas con caracteristicas especiales."
"Fertilizantes GL, SA de CV",Agricultura / Pesca / Ganaderia,"Hermosillo, Sonora","FERTILIZANTES GL, S.A. DE C.V. es una empresa Mexicana de tecnologia avanzada en lo que se refiere a fertilizantes liquidos, ademas de fabricar otros productos especificos para el campo y la industria, FERTILIZANTES GL, S.A. DE C.V. se caracteriza por su gran control de calidad en la manufactura de sus diversos productos y por la importancia que le da a las opiniones de sus clientes. FERTILIZANTES GL, S.A. DE C.V. cuenta con un departamento de Investigacion y Desarrollo que trabaja constantemente para ofrecer mejores productos, mas funcionales y ecologicos. Que no danen la microflora o microfauna y que son totalmente biodegradables. De igual manera busca proporcionar a sus clientes una solucion efectiva a cada problema o situacion que se les presenta, es por eso que lanzo al mercado su servicio de ""Formulaciones Especiales"", en el que ofrece al cliente el producto hecho a su medida. En complemento a este servicio en el ano 2005 decide personalizar aun mas sus servicios mediante la ""Maquila de Fertilizantes"". Finalmente FERTILIZANTES GL, S.A. DE C.V. apoya a Mexico y al sector agricola mediante el programa GRATUITO de ""Capacitacion para el Campo Mexicano"", el cual consiste en asesorias y capacitaciones sobre diversos temas que complementan las actividades agricolas, reforzando a este sector en temas tecnicos tales como nutricion, fertilizacion, inocuidad alimentaria. Asi mismo refuerzan e instruyen temas como administracion, mercadotecnia, planes de negocio y mercados, exportacion, comercializacion y logistica. FERTILIZANTES GL, S.A. DE C.V. funge tambien como enlace para acercar a los productores mexicanos a los recursos necesarios para hacer crecer su negocio. Actualmente estrecha el vinculo entre una de las empresas automotrices mas exitosas de Mexico: NISSAN VAMSA PATRIA, y los negocios agricolas de toda la Republica Mexicana. FERTILIZANTES GL, S.A. DE C.V. Calle Papalote No.5 Int.2, entre Carretera a Bahia Kino Km9.5 y prolongacion Concord Colonia La Manga. Hermosillo, Sonora, Mexico. CP. 83220 (frente al aeropuerto)"
Fomento Economico Y Comercial Agroalimentario s.a de c.v.,Agricultura / Pesca / Ganaderia,"Valle de Chalco Solidaridad, Estado de Mexico","FEYCA se dedica a la industria alimenticia,en el ramo de la masa y la tortilla,su objetivo ser competitivo y consolidarnos como una de las mejores marcas nacionales y brindar productos de calidad,siguiendo nuestro lema lo mejor del campo a su mesa"
Faramal SPR de RL,Agricultura / Pesca / Ganaderia,"Irapuato, Guanajuato",
Facetus,Agricultura / Pesca / Ganaderia,"Acambay de Ruiz Castaneda, Estado de Mexico","Agencia de Publicidad dedicada a llevar todo tipo de servicios y productos, Tenemos servicio de Edecanes, GIO's, Promotores, Animadores, Demoedecanes, Demostradoras, Volateros, y productos como Banners, Playeras, Disenos, y Estudios de Mercado y Geomarketing"
Union del Lecheros del Centro del Pais,Agricultura / Pesca / Ganaderia,"Celaya, Guanajuato",Venta y produccion de la lacteos tenemos 10 anos en el ramo de leche fresca de productos lacteos
Intrakam S. A. de C. V.,Agricultura / Pesca / Ganaderia,"Saltillo, Coahuila",
Clinica Veterinaria Jardines,Agricultura / Pesca / Ganaderia,"Aguascalientes, Aguascalientes","Clinica Veterinaria Jardines es una empresa cuya mision es entregar a nuestros clientes (propietarios de mascotas) productos y servicios de la mas alta calidad encaminados a proucrar el bienestrar integral de sus mascotas, con una justa relacion valor - precio. Construir relaciones reciprocas solidas y duraderas con nuestros proveedores y colaboradores."
Union Ganadera Regional,Agricultura / Pesca / Ganaderia,San Luis Potosi,---
"Union de Productores Agropecuarios Empresa Integradora, S.A de C",Agricultura / Pesca / Ganaderia,"Isla, Veracruz",---
Union Mexicana de Fabricantes y Formuladores de Agroquimicos,Agricultura / Pesca / Ganaderia,Ciudad de Mexico,---
Zell Chemie Internacional,Agricultura / Pesca / Ganaderia,Extranjero,"Empresa agropecuaria dedicada a la formulacion, distribucion y exportacion de plaguicidas quimicos agricolas (herbicidas, insecticidas, fungicidas). Actualmente, estamos realizacion de tramites de registro de plaguicidas en Mexico para su posterior distribucion en el pais."
Zimmer Constructores S.A. de C.V.,Agricultura / Pesca / Ganaderia,Guanajuato,
Empacadora y Procesadora de Monterrey S.A. de C.V.,Agricultura / Pesca / Ganaderia,"Guadalupe, Nuevo Leon",Empacadora y Procesadora de Monterrey S.A. de C.V.
"Operadora de Servicios AG, S de RL de CV",Agricultura / Pesca / Ganaderia,"Aguascalientes, Aguascalientes","Empresa dedicada al suministro de personal para el area de Agricultura,Ganaderia y Avicola con tres anos en el mercado."
Industria Cafetalera Nacional,Agricultura / Pesca / Ganaderia,"Cuernavaca, Morelos","Nuestra industria cafetalera tiene mas de 8 anos en el mercado, contando con mas de 200 hectareas de cafetales y exportando en las mejores condiciones a mercados asiaticos, europeos y mexicanos."
Corporacion Agrotecnologica Mexicana S. de P.R. de R.L,Agricultura / Pesca / Ganaderia,Michoacan,"Empresa dedicada a la elaboracion, distribucion y venta de productos Organicos para uso Agricola."
Agricola Casablanca,Agricultura / Pesca / Ganaderia,Michoacan,"Dedicada al cultivo de fresa, zarzamora, frambuesa, arandano, papa, maiz etc"
Comercializadora Agricola de Nayarit SA de CV,Agricultura / Pesca / Ganaderia,Nayarit,"Comercializadora Agricola de Nayarit, SA de CV, se fundo en el 2001. Somos una empresa distribuidora de la marca John Deere, nos dedicamos a la compra venta de maquinaria y equipo agricola, nos distinguimos por ser una empresa comprometoda con el cliente."
Invernaderos de brocoli S. A. DE C. V.,Agricultura / Pesca / Ganaderia,Guanajuato,Empresa dedicada al cultivo de brocoli en cielo abierto de exportacion.
Calidad Veterinaria,Agricultura / Pesca / Ganaderia,Estado de Mexico,"Solicito Medico veterinaria Recien titulado o pasante experiencia no necesaria, con disponibilidad de tiempo sexo indistinto que viva serca de la zona, onesto y con buena presentacion edad de 22 a 33 anos solteros condisponibilidad de tiempo sueldo segun aptitudes y se trata a la entrevista."
Proveedora de Carnicos,Agricultura / Pesca / Ganaderia,Ciudad de Mexico DF,"Somos una empresa productora de carne de cerdo contamos con 114 granjas en la republica, nuestra zona de distribucion se concentra en Mexico, dando atencion en Autoservicios( wal-mart) Restaurantes, etc."
Carnica Latino America S.A. de C.V.,Agricultura / Pesca / Ganaderia,Estado de Mexico,"Produccion, Transformacion y venta de carne de borregos y cerdos"
Comecializadora de Granos,Agricultura / Pesca / Ganaderia,"Tepeaca, Puebla",Tienda Comercializadora de Granos y Semillas con Venta al Mayoreo y al Menudeo
"Coseci Agro, S.C.",Agricultura / Pesca / Ganaderia,"Celaya, Guanajuato",Consultoria especializada en la gestion de Programas de Inocuidad Alimentaria.
Nutrivet,Agricultura / Pesca / Ganaderia,"Aguascalientes, Aguascalientes","NUTRIVET, es una empresa dedicada a la venta y distribucion de alimentos, medicamentos y productos veterinarios para animales de compania. En la actualidad atendemos las necesidades de las mas de 180 clinicas y farmacias veterinarias de los estados de Aguascalientes y Zacatecas, asi como a los criadores de mascotas y particulares mediante una eficiente red de distribucion comprometida con el bienestar y la Salud Animal."
Nupropec,Agricultura / Pesca / Ganaderia,"La Paz, Estado de Mexico",
Nutrientes Organicos y Minerales SA de CV,Agricultura / Pesca / Ganaderia,"Acatic, Jalisco",NOMSA es una empresa dedicada a la formulacion de Nutrientes Organicos y minerales.
"Nutrikowi Alimentos, S. A. DE C. V.",Agricultura / Pesca / Ganaderia,"Navojoa, Sonora",Planta elaboradora de alimento balanceado para cerdos.
Comercializadora Espi SA de CV,Agricultura / Pesca / Ganaderia,Sinaloa,"Somos una Empresa agricola, nos dedicamos a la produccion de productos agricolas, compra y venta de productos agricolas, etc."
Na Luum S.C.P.,Agricultura / Pesca / Ganaderia,"Tzucacab, Yucatan",Na luum es una empresa que se encarga de la producir alimentos organicos desde hace 6 anos.
Nata Santa Maria S.A. de C.V.,Agricultura / Pesca / Ganaderia,"Tizayuca, Hidalgo",
Naturales Campo Real S. DE R.L. DE C. V.,Agricultura / Pesca / Ganaderia,Puebla,"Empresa dedicada a la produccion de hortalizas, elaboradas con las mas estrictas normas de inocuidad y seguridad agricola en invernadero hermetizado."
Natku S.A.P.I. de C.V.,Agricultura / Pesca / Ganaderia,"Azcapotzalco, Ciudad de Mexico DF",
"Nivelaciones de Occidente ,S.C.",Agricultura / Pesca / Ganaderia,"La Barca, Jalisco",Nivelacion de tierras agricolas con rayo laser
Nordistribuciones Veterinarias S.A. de C.V.,Agricultura / Pesca / Ganaderia,"Mexicali, Baja California","Tenemos 15 anos asesorando y vendiendo productos agropecuarios. Actualmente somos representantes de la mayoria de laboratorios en Mexico. Nuestra participacion de mercado alcanza alrededor del 80% Nuestro objetivo, mantenernos en base a servicios de asesoria profesional."
Cultivos Energeticos Mexicanos,Agricultura / Pesca / Ganaderia,Ciudad de Mexico DF,Desarrollo de energia alternativa
Alimentos Especiales Tenerife,Agricultura / Pesca / Ganaderia,"Rafael Delgado, Veracruz","ALIMENTOS ESPECIALES TENERIFE es una empresa dedicada a la trasformacion de materias primas derivadas del campo, cana y sorgo, esta comprometida con el beneficio del pais, de la region y de su gente."
"Agroscience Biochemical, S.A de C.V.",Agricultura / Pesca / Ganaderia,Jalisco,"Agroscience es una empresa de investigacion y formulacion en el area de nutricion vegetal que consciente de estas necesidades, ha desarrollado productos con la maxima asimilacion y con excelentes respuesta. Maximizar los rendimientos y las ganancias de nuestros productores, proponiendo sobrepasar sus expectativas.  Consolidarnos como lideres en investigacion y desarrollo.  Crear productos con el mas alto estandar de calidad con un rendimiento superior al mercado.  Ofrecer productos, asesoria y servicios innovadores con la mejor relacion Valor  Calidad  Resultados."
Servicio Y Control Industrial sa de cv,Agricultura / Pesca / Ganaderia,"Venustiano Carranza, Ciudad de Mexico DF","Empresa dedicada al ramo electrico industrial tanto venta de producto como venta de servicios profesionales de electricidad y electronica industrial, asi como ahorro de energia y automatizacion."
Servicios Agropecuarios y Evaluacion de la Conformidad,Agricultura / Pesca / Ganaderia,Puebla,---
GANFER Sociedad Agricola,Agricultura / Pesca / Ganaderia,"Imuris, Sonora",
Flornatec,Agricultura / Pesca / Ganaderia,Puebla,
Cheminova Agro de Mexico,Agricultura / Pesca / Ganaderia,Ciudad de Mexico DF,"Empresa Trasnacional dedicada a la sintesis, formulacion y comercializacion de Agroquimicos."
Fermi,Agricultura / Pesca / Ganaderia,Sinaloa,"Empresa dedicda a la comercilaizacion e implementacion de soluciones agricolas en 2 grandes areas: 1)Soluciones agricolas: proyectos de riegos, agricultura protegida y elaboracion de proyectos en general asi como la comercializacion de sus componentes. 2) Soluciones energeticas: energias alternativas en situaciones geograficas con caracteristicas especiales."
"Fertilizantes GL, SA de CV",Agricultura / Pesca / Ganaderia,"Hermosillo, Sonora","FERTILIZANTES GL, S.A. DE C.V. es una empresa Mexicana de tecnologia avanzada en lo que se refiere a fertilizantes liquidos, ademas de fabricar otros productos especificos para el campo y la industria, FERTILIZANTES GL, S.A. DE C.V. se caracteriza por su gran control de calidad en la manufactura de sus diversos productos y por la importancia que le da a las opiniones de sus clientes. FERTILIZANTES GL, S.A. DE C.V. cuenta con un departamento de Investigacion y Desarrollo que trabaja constantemente para ofrecer mejores productos, mas funcionales y ecologicos. Que no danen la microflora o microfauna y que son totalmente biodegradables. De igual manera busca proporcionar a sus clientes una solucion efectiva a cada problema o situacion que se les presenta, es por eso que lanzo al mercado su servicio de ""Formulaciones Especiales"", en el que ofrece al cliente el producto hecho a su medida. En complemento a este servicio en el ano 2005 decide personalizar aun mas sus servicios mediante la ""Maquila de Fertilizantes"". Finalmente FERTILIZANTES GL, S.A. DE C.V. apoya a Mexico y al sector agricola mediante el programa GRATUITO de ""Capacitacion para el Campo Mexicano"", el cual consiste en asesorias y capacitaciones sobre diversos temas que complementan las actividades agricolas, reforzando a este sector en temas tecnicos tales como nutricion, fertilizacion, inocuidad alimentaria. Asi mismo refuerzan e instruyen temas como administracion, mercadotecnia, planes de negocio y mercados, exportacion, comercializacion y logistica. FERTILIZANTES GL, S.A. DE C.V. funge tambien como enlace para acercar a los productores mexicanos a los recursos necesarios para hacer crecer su negocio. Actualmente estrecha el vinculo entre una de las empresas automotrices mas exitosas de Mexico: NISSAN VAMSA PATRIA, y los negocios agricolas de toda la Republica Mexicana. FERTILIZANTES GL, S.A. DE C.V. Calle Papalote No.5 Int.2, entre Carretera a Bahia Kino Km9.5 y prolongacion Concord Colonia La Manga. Hermosillo, Sonora, Mexico. CP. 83220 (frente al aeropuerto)"
Fomento Economico Y Comercial Agroalimentario s.a de c.v.,Agricultura / Pesca / Ganaderia,"Valle de Chalco Solidaridad, Estado de Mexico","FEYCA se dedica a la industria alimenticia,en el ramo de la masa y la tortilla,su objetivo ser competitivo y consolidarnos como una de las mejores marcas nacionales y brindar productos de calidad,siguiendo nuestro lema lo mejor del campo a su mesa"
Faramal SPR de RL,Agricultura / Pesca / Ganaderia,"Irapuato, Guanajuato","Empresa del sector agropecuario dedicada a la siembra en invernaderos, cultivo y cosecha de Hortalizas y Granos (Cebolla, Ajo, Chile, Tomate, Lechuga, etc.)"
Facetus,Agricultura / Pesca / Ganaderia,"Acambay de Ruiz Castaneda, Estado de Mexico","Agencia de Publicidad dedicada a llevar todo tipo de servicios y productos, Tenemos servicio de Edecanes, GIO's, Promotores, Animadores, Demoedecanes, Demostradoras, Volateros, y productos como Banners, Playeras, Disenos, y Estudios de Mercado y Geomarketing"
Factor Humano,Agricultura / Pesca / Ganaderia,Estado de Mexico,
Fauna Solidaria de Mexico SA de CV,Agricultura / Pesca / Ganaderia,"Queretaro, Queretaro","Fauna Solidaria de Mexico es una empresa dedicada a la cria de animales,actualmente cuenta con un criadero de perros ubicado en Amealco, Queretaro. Tenemos grandes espectativas de crecimiento, con nueveas especies y en otros lugares de la republica."
Productos Especiales Saludables S.A. DE C.V,Agricultura / Pesca / Ganaderia,San Luis Potosi,"Es una empresa que se dedica a la comercializacion del Nopal, Su objetivo es permanecer a la vanguardia con el servicio a tiendas de autoservicio, Es una empresa familiar desde el 1998"
Lidesem,Agricultura / Pesca / Ganaderia,"Mazatlan, Sinaloa","Despacho dedicado a desarrollar, brindar consultoria y capacitacion a negocios"
Invernadero Los Zapata,Agricultura / Pesca / Ganaderia,Aguascalientes,
Nogal Care,Agricultura / Pesca / Ganaderia,"Saltillo, Coahuila",Empresa dedicada a proveer servicios integrales en el mantenimiento y conservacion de nogales.
Ducado de Guanajuato SPR de RL y CV,Agricultura / Pesca / Ganaderia,"Queretaro, Queretaro",Rancho Ganadero
Fundacion Desarrollo Integral Progresa A.c,Agricultura / Pesca / Ganaderia,"Puebla, Puebla",
Fundacion Mexicana para el Desarrollo Rural a. c.,Agricultura / Pesca / Ganaderia,Ciudad de Mexico DF,"Posible Fraude. =========== Mision: Promover el aumento de la productividad y el desarrollo humano de los campesinos y sus familias de manera integral, asi como el desarrollo de las comunidades rurales."
Comercial Agricola Tierra Fertil,Agricultura / Pesca / Ganaderia,Queretaro,
Fundacion Rigoberta Menchu,Agricultura / Pesca / Ganaderia,Ciudad de Mexico DF,"Institucion sin caracter de lucro avocada a la defensa de derechos hunanos, particularmente en poblacion indigena y a la implementacion de actividades primarias productivas."
"Tractores y Maquinaria de Atlacomulco, S.A. de C.V.",Agricultura / Pesca / Ganaderia,"Atlacomulco, Estado de Mexico","Ventas, Posventa, Administracion, Atencion a Cliente, etc."
Del Rio Products SPR de RL de CV,Agricultura / Pesca / Ganaderia,"Actopan, Veracruz","Empresa dedicada al cultivo y procesamiento en botana de malanga, enfocada a las ventas nacionales y la exportacion."
Leche Fatima,Agricultura / Pesca / Ganaderia,"Guaymas, Sonora",
Rastro Leavyc S.A. de C.V.,Agricultura / Pesca / Ganaderia,Jalisco,
Agrotec,Agricultura / Pesca / Ganaderia,Guanajuato,Elaboracion de Harina de Maiz
BlackGold,Agricultura / Pesca / Ganaderia,"Zapopan, Jalisco","En el ano 2011, un grupo de ganaderos exitosos y entusiastas da origen a ganaderias especializadas en carne Angus, con el fin de producir, desarrollar, engordar y comercializar productos carnicos de la mejor calidad 100% Angus, nace BLACK GOLD ANGUS. Nuestro compromiso es poder ofrecer al consumidor mas exigente un producto certificado con calidad genetica Angus 100% natural, sano y nutritivo, cumpliendo con todas las normas de calidad. Actualmente se ha convertido en una comercializadora de ALIMENTOS PREMIUM para acompanar todo lo referente a un buen corte y el asado."
Especias de Amacuzac SPR de RL,Agricultura / Pesca / Ganaderia,"Amacuzac, Morelos",
"Probioticos del Noroeste, SA de CV",Agricultura / Pesca / Ganaderia,"Culiacan, Sinaloa","Venta de productos para la agricultura como mejoradores de suelo, enraizadores, foliares, biofungicidas, insecticidas y bactericidas ecologicos y nutrientes entre otros con productos con registro para su uso en agricultura organica"
Preterra S.P.R. DE R.L.,Agricultura / Pesca / Ganaderia,Colima,En PRETERRA nos dedicamos a la elaboracion y distribucion de productos organicos para la agricultura
Pro Agro,Agricultura / Pesca / Ganaderia,"Celaya, Guanajuato","Empresa promotora y comercializadora de fertilizantes agricolas y agroquimicos, de reconocida marca, para el Bajio."
Porkarne de Saltillo,Agricultura / Pesca / Ganaderia,"Saltillo, Coahuila",
Productos Congelados del Mar de Cortez El Triton SC de RL de CV,Agricultura / Pesca / Ganaderia,"Puerto Penasco, Sonora","Procesamos pulpa de jaiba fresca y o pasteurizada, en diferentes partes del pais."
Procesadora de Subproductos Carnicos SA de CV,Agricultura / Pesca / Ganaderia,Puebla,"Empresa recicladora de subproductos carnicos en Puebla que elabora materia prima para alimentos balanceados hacia las mascotas, con mas 30 anos de experiencia."
Printel SA de CV,Agricultura / Pesca / Ganaderia,"Zumpahuacan, Estado de Mexico","Empresa de innovacion grafica, lider en servicios profesionales de impresion digital, especializada en senalizacion, punto de venta y la imagen corporativa de su empresa."
Promotora de Fertilizantes del Bajio,Agricultura / Pesca / Ganaderia,"Celaya, Guanajuato",Importante empresa en el Ramo de Fertilizantes
Procesados Aguaverde,Agricultura / Pesca / Ganaderia,Sinaloa,
Semillas PROSESO,Agricultura / Pesca / Ganaderia,"Colima, Colima",
Merlin Greenhouses S de RL de CV,Agricultura / Pesca / Ganaderia,Jalisco,
FMC Agroquimica de Mexico,Agricultura / Pesca / Ganaderia,"Zapopan, Jalisco","Desde nuestra fundacion nos hemos enfocado en ofrecer soluciones a nuestros clientes y usuarios, con decision, creatividad y excelencia en el servicio. Estas soluciones abarcan desde Insecticidas, Herbicidas, Fungicidas, Agroquimicos, Fertilizante, Nutricion Vegetal, Manejo cero residuos y Productos organicos. Con oficinas centrales en Guadalajara, Jalisco, Mexico y con atencion a todo el pais."
"Produccion Agricola Amigo, S.A. de C.V.",Agricultura / Pesca / Ganaderia,"Valle de Santiago, Guanajuato",Empacadora de Vegetales Frescos
Empresas y Servicios Organizados S.A de C.V,Agricultura / Pesca / Ganaderia,"Miguel Hidalgo, Ciudad de Mexico DF",
"Paqa, s.c. de r.l. de c.v",Agricultura / Pesca / Ganaderia,Sinaloa,Empresa formuladora y distribuidora de agroquimicos
Agropecuaria Papalote S.A de C.V.,Agricultura / Pesca / Ganaderia,Sonora,En una empresa que se fundo hace 10 anos dedicada al giro llantero y tiene como objetivo ser una de las empresas mas importantes en su ramo.
Phytorganic SA de CV,Agricultura / Pesca / Ganaderia,"Aguascalientes, Aguascalientes","Fabricacion y distribucion de productos organicos, para el campo."
Phi Servicios,Agricultura / Pesca / Ganaderia,Jalisco,Empresa Agroindustrial lider en su ramo
EDGAR RIVAS,Agricultura / Pesca / Ganaderia,"Abasolo, Coahuila",EMPRESA DEDICADA A LA ELABORACION DE ALIMETOS
Agropacifico,Agricultura / Pesca / Ganaderia,"Tecoman, Colima",Empresa de dedicada a la comercializacion de productos agricolas.
MOLINOS ARENAS TLAX-MEX,Agricultura / Pesca / Ganaderia,"San Pablo del Monte, Tlaxcala","Fabricacion de maquinara agropecuaria tal como molinos de nixtamal, picadora de forraje, desgranadora etc.. , somos una empresa responsable y comprometida para brindarle un buen servicio al consumidor"
UNION DE CAFETICULTORES DEL NORTE DE CHIAPAS SC,Agricultura / Pesca / Ganaderia,"San Cristobal de las Casas, Chiapas",EMPRESA QUE SE DEDICA A LA COMPRA Y COMERCIALIZACION DE CAFE EN EL ESTADO DE CHIAPAS.
Procesadora y comercializadora de granos y semillas del centro s.a. de c.v.,Agricultura / Pesca / Ganaderia,"Leon, Guanajuato",Proceso y comercializacion de granos semillas
Complejo Acuicola Tupez SC de RL de CV,Agricultura / Pesca / Ganaderia,"Alvarado, Veracruz",
Granos y Vegetales de Yucatan SPR de RL de CV,Agricultura / Pesca / Ganaderia,"Tekax, Yucatan",EMPRESA DEDICADA A LA AGRICULTURA DE TEMPORADA
Palmas de Candeleria,Agricultura / Pesca / Ganaderia,"Escarcega, Campeche",
corporativo bpo,Agricultura / Pesca / Ganaderia,"La Paz, Baja California Sur",Empresa acuacultura de camaron
GRUPO VIVER,Agricultura / Pesca / Ganaderia,"Culiacan, Sinaloa",
GAVOAVOCADO,Agricultura / Pesca / Ganaderia,"Periban, Michoacan",
Fincas Familia Rogers,Agricultura / Pesca / Ganaderia,"Tapachula, Chiapas",
Barries Paradise S.A.P.I.C.V.,Agricultura / Pesca / Ganaderia,"Guadalajara, Jalisco",Produccion y distribucion de Frutas y Verduras
"Vegxpress, S.A. de C.V.",Agricultura / Pesca / Ganaderia,"Monterrey, Nuevo Leon","Empresa dedicada al ramo de Hortalizas. Compramos, seleccionamos y empacamos chiles frescos y tomatillos para Exportacion y venta Nacional. Buscando calidad en servicios hacia nuestros clientes."
ACUICOLA CALIFUS,Agricultura / Pesca / Ganaderia,"Cajeme, Sonora",EMPRESA DEDICADA A LA ENGORDA Y COMERCIALIZACION DE CAMARON DE GRANJA
COMERCIALIZADORA ZENABI,Agricultura / Pesca / Ganaderia,"Guadalajara, Jalisco",
Integradora Horticola Ganser,Agricultura / Pesca / Ganaderia,"Cuauhtemoc, Colima",
PAPAS DIMAS,Agricultura / Pesca / Ganaderia,"San Luis Potosi, San Luis Potosi",EMPRESA COMERCIAL ( COMPRA VENTA DE PAPA)
Agricola Orqui S.A DE C.V,Agricultura / Pesca / Ganaderia,"Hermosillo, Sonora",EMPRESA AGRICOLA
