Empresa,Area,Ubicacion,Descripcion
Gondi SA,Agricultura / Pesca / Ganaderia,"Montecristi, Manabi","GONDI S.A. es una empresa Exportadora de Pesca Fresca,Atun y Sardinas de Ecuador. Las Instalaciones y oficinas de GONDI S.A., se localizan en la ciudad de Montecristi, provincia de Manabi, en el Km. 5  1/2  via Manta-Montecristi, Ecuador. La planta de procesamiento se encuentra estrategicamente localizado en el primer puerto pesquero de Ecuador a solo 10 minutos del aeropuerto Eloy Alfaro de la ciudad de Manta y a tres horas del aeropuerto Jose Joaquin de Olmedo de la ciudad de Guayaquil. Nuestros principales mercados son: ESTADOS UNIDOS, EUROPA Y JAPON."
Florana Farms S.A.,Agricultura / Pesca / Ganaderia,Pichincha,"Grupo floricola agroexportador, en constante proceso de expansion y desarrollo de nuevos mercados, especialemnte a nivel de Asia, Oriente y Europa."
Global Ends S.A,Agricultura / Pesca / Ganaderia,Guayas,"Fabricante Espanol de componentes para la industria conservera, con amplia presencia comercial en America Latina."
Lavetec Cia Ltda.,Agricultura / Pesca / Ganaderia,"Quito, Pichincha","Laboratorios Veterinarios del Ecuador empresa destinada a la produccion, distribucion, maquila de productos farmaceuticos y biologicos de uso veterinario."
Otisgraf S.A.,Agricultura / Pesca / Ganaderia,"Guayaquil, Guayas",Productora bananera
Reybanpac,Agricultura / Pesca / Ganaderia,"Guayaquil, Guayas",Corporacion Agroindustrial
Agricola Ganadera Valle Bucay,Agricultura / Pesca / Ganaderia,"Guayaquil, Guayas",Empresa Ganadera y productora
Nutrisalminsa,Agricultura / Pesca / Ganaderia,"Ambato, Tungurahua","Fabricamos y distribuimos a nivel nacional mezclas de minerales y vitaminas para animales de granja, importamos y distribuimos aditivos para balanceados, lacto reemplazantes para terneros y cerdos"
Nature Farming SA,Agricultura / Pesca / Ganaderia,"Guayaquil, Guayas",Empresa dedicada a la exportacion de frutas organicas
Merisistemas S.A.,Agricultura / Pesca / Ganaderia,Pichincha,Uno de los laboratorios lideres en el area de biotecnologia en reproduccion in vitro. Principalmente para el area bananera y floricola.
Corporacion Noboa,Agricultura / Pesca / Ganaderia,"Guayaquil, Guayas","Grupo Corporativo dedicado a la produccion y exportacion de Banano de primera calidad a puertos internacionales de Europa,Estados Unidos y America del Sur"
INDAGRO Cia. Ltda,Agricultura / Pesca / Ganaderia,"Cuenca, Azuay",Empresa dedicada a la elaboracion y comercializacion de productos agropecuarios.
Incubadora Anhalzer,Agricultura / Pesca / Ganaderia,Pichincha,Importante empresa avicola.
Distribuidora de Insumos y Semillas Insusemillas Cia. Ltda,Agricultura / Pesca / Ganaderia,Pichincha,"Insusemillas Cia. Ltda. es una empresa de capital ecuatoriano. Inicio sus operaciones en septiembre de 1997. Importa directamente fertilizantes Foliares de Espana, Semillas de Holanda y sustratos, para el sector agricola del Pais."
kirios Organic,Agricultura / Pesca / Ganaderia,"Guayaquil, Guayas","Nuestra empresa esta orientado a un sistema de produccion de alimentos, de manera sana respetando el ambiente y protegiendo la salud del ser humano. Por tal motivo producimos y distribimos ALFA7 Es un fertilizante biotransformador de la materia organiza. Biofertilizante para los cultivos. Potencializador del desarrollo vegetal. Mejoramiento de la calidad y peso del fruto. ALFA7 es compatible con todos los Agroquimicos: insecticidas, fungicidas, herbicidas y fertilizantes foliares, excepto con aquellos de pH acido."
Grupo Esmeralda Ecuador,Agricultura / Pesca / Ganaderia,Pichincha,"Estamos en la busqueda de Trabajadora Social con el siguiente perfil: Sexo:Femenino Edad: Hasta 45 anos Educacion: Licenciada en Trabajo Social Experiencia: Minima 1 anos en cargos similares realizando labores sociales, visitas domiciliarias, tramites en el IESS, levantando informes socioeconomicos, manejo de la cartelera. Competencias: manejo de conflictos, comunicacion asertiva, Funcion general: Es el responsable de identificar necesidades sociales que inciden en el proceso salud-enfermedad,ademas de identificar las redes familiares y sociales de los trabajadores."
Hacienda Rio Negro,Agricultura / Pesca / Ganaderia,El Oro,"Productor de banano para exportacion en la provincia de El Oro, Ecuador. Hacienda con 191 hectareas de banano. Contacto: Oficina: Calle Colon y Bolivar, frente al parque central, Parroquia Buenavista, Canton Pasaje, Provincia El Oro, Ecuador. Mayor informacion en: www.don-hes.com email: ********@don-hes.com o a los telefonos: 593.7.294.1059 y al telefono celular 095.339.629"
Terragarden,Agricultura / Pesca / Ganaderia,Pichincha,"Consultoria, fiscalizacion, proyecto de jardineria y paisajismo"
Huesca S.A.,Agricultura / Pesca / Ganaderia,"Guayaquil, Guayas","Importante empresa Productora Bananera, con mas de 20 anos de experiencia en el ramo, siendo un pilar fundamental para el desarrollo economico del sector. Contamos con certificacion Global GAP."
Propemar S.A.,Agricultura / Pesca / Ganaderia,"Manta, Manabi",Empresa procesadora de productos del mar. Pesca fresca
Fundacion Heifer Ecuador,Agricultura / Pesca / Ganaderia,"Quito, Pichincha","La Fundacion Heifer Ecuador es una organizacion no gubernamental de desarrollo rural basada en valores, vinculada a Heifer Project International, cuya mision es trabajar con las comunidades para poner fin al hambre, la pobreza y cuidar la tierra. La vision de Heifer Project International es un mundo de comunidades que conviven en paz y comparten equitativamente los recursos de un planeta saludable."
Phillips Seafoods Of Ecuador,Agricultura / Pesca / Ganaderia,Guayas,Exportadora de Mariscos
Denmar S.A.,Agricultura / Pesca / Ganaderia,"Quito, Pichincha",Somos una empresa floricola ubicada en Tabacundo.
Dagyca,Agricultura / Pesca / Ganaderia,"Guayaquil, Guayas","Compra, engorde, faenamiento y venta de carne en frigorifico propio. Lugar Provincia del Guayas Canton Playas. Recien se inicia el frigorifico"
Limbomar S.A.,Agricultura / Pesca / Ganaderia,"Duran, Guayas",Venta al por mayor y menor de productos del mar
Raduga Flowers,Agricultura / Pesca / Ganaderia,"Quito, Pichincha","Empresa floricola con mas de 10 anos en el mercado, que se encuentra en el sector de Tabacundo dedicada a la produccion de rosas para el mercado ruso."
Rosamont,Agricultura / Pesca / Ganaderia,"Quito, Pichincha",Produccion de flores
Biocentinela S.A.,Agricultura / Pesca / Ganaderia,"Guayaquil, Guayas","BioCentinela is a pioneer in the production and exportation of certified organic white shrimp (litopenaeus vannamei) obtaining the first certification for organic larvae production in the world. The company was founded in 1989, starting operations with a small hatchery that was strategically located in Punta Centinela. The shrimp farms were put into production in 1995. Both, the hatchery and farms began their activities as conventional production. The transition to organic started in 1999 and the process was completed in 2002. BioCentinela was created in 2003 by the merging of the hatchery, LARVITANA S.A., and the shrimp farms, ZANIN S.A. The company's headquarters are located in Guayaquil; the hatchery operates in San Pablo, two hours by car from Guayaquil; and the farms are located in Isla Puna, 3 hours by boat from Guayaquil. Vision ""To lead the commercialization of organic aquaculture products by promoting and developing our production system and partnering with small and medium farmers, regenerating and conserving the environment, promoting development and fair treatment for all those involved in our processes."" Mission ""BioCentinela's mission is to market premium-branded organic aquaculture products utilizing an environmentally-safe production process while engaging in new technology development and maintaining high standards of client service."""
Fruttimania,Agricultura / Pesca / Ganaderia,"Guayaquil, Guayas",Exportador de productor organicos.
Ecrusholding,Agricultura / Pesca / Ganaderia,"Quito, Pichincha",Comercializadora de flores compra y venta de flores internacionales
Elanco,Agricultura / Pesca / Ganaderia,"Quito, Pichincha",Elanco es una multinacional dedicada a la elaboracion y comercializacion de productos veterinarios a nivel mundial.
Exotic Land,Agricultura / Pesca / Ganaderia,"Quito, Pichincha",Produccion y exportacion
Florana Farms S.A.,Agricultura / Pesca / Ganaderia,Pichincha,"Grupo Agroindustrial en constante crecimiento, con solidos principios de orden, disciplina y productividad. Busca equipo humano de alto nivel profesional y con deseos de crecimiento."
Tropifrutas S.A.,Agricultura / Pesca / Ganaderia,"Quevedo, Los Rios","Empresa Agroindustrial lider en la elaboracion de pures, jugos y concentrados de frutas tropicales"
Tamboroses S.A,Agricultura / Pesca / Ganaderia,Cotopaxi,Importante empresa Floricola
Paniris s.a,Agricultura / Pesca / Ganaderia,Guayas,Exportadora de cacao.
Terrasana,Agricultura / Pesca / Ganaderia,"Quito, Pichincha",Empresa dedicada a la produccion de hortalizas de clima frio organicas y su comercializacion.
TECOPESCA - Tecnica y Comercio de la Pesca,Agricultura / Pesca / Ganaderia,"Jaramijo, Manabi","TECOPESCA se dedica a la actividad pesquera en las fases de procesamiento y comercializacion de productos del mar cumpliendo los requisitos del producto (seguridad, calidad, legalidad, y especificaciones del producto y elaboracion), requisitos legales, y otros aplicables a nuestra actividad, comprometida a minimizar la contaminacion del medio ambiente, desarrollando acciones preventivas destinadas a evitar el: Contrabando, Narcotrafico y Terrorismo, con la conviccion del mejoramiento continuo, buscando satisfacer mejor que los competidores, de manera permanente y plena, las necesidades y expectativas cambiantes de los clientes. Asumiendo el liderazgo en las industrias, obteniendo beneficios que satisfagan a los inversionistas, trabajadores y demas colaboradores."
Platinum Roses,Agricultura / Pesca / Ganaderia,"Quito, Pichincha",Plantacion de Rosas
Pronaca - Planta Pifo,Agricultura / Pesca / Ganaderia,"Cayambe, Pichincha","PRONACA es el resultado de anos de trabajo, creatividad y constancia. Como empresa procesadora y comercializadora de alimentos y frutas ha alcanzado el reconocimiento por la alta calidad de sus productos que provienen de los sectores: carnico, agroindustrial y acuacultura. Sus actividades tienen su soporte fundamental en las necesidades de sus consumidores y en el compromiso diario de sus colaboradores. La experiencia en el Ecuador, le ha permitido extender sus fronteras con actividades productivas y comerciales hacia Brasil, Colombia, Espana y Estados Unidos. Es una empresa comprometida con el mejoramiento de la calidad de vida de sus consumidores, clientes y colaboradores. Trabaja todos los dias en la elaboracion de productos confiables, ofrece miles de fuentes de trabajo digno y apoya al desarrollo de las zonas rurales del pais. PRONACA es una empresa ecuatoriana, que goza de confianza y aceptacion dentro y fuera del pais. Es una organizacion que contribuye a mejorar la productividad agricola e industrial del Ecuador"
Servigrup Cia. Ltda.,Agricultura / Pesca / Ganaderia,"Samborondon, Guayas","Empresa dedicada a la Pesca Industrial garantizando productos y servicios de excelente calidad, altos volumenes de produccion y el suministro constante de nuestros clientes ."
St. George Farms,Agricultura / Pesca / Ganaderia,"Quito, Pichincha",Obtencion - comercializacion de Huevos de Codorniz
HILSEA INVESTMENTS LIMITED,Agricultura / Pesca / Ganaderia,"Quito, Pichincha",EMPRESA LDIER FLORICULTOR CON 25 ANOS DE EXPERIENCIA EN EL MERCADO
maquilas Superiores LQ,Agricultura / Pesca / Ganaderia,"Guayaquil, Guayas",Exportadora de Frutas
Propemar,Agricultura / Pesca / Ganaderia,"Manta, Manabi",Comercializacion de Productos del mar
ALIMENTOS ESPECIALES PROCESADOS C.A. ALEPROCA,Agricultura / Pesca / Ganaderia,"Quito, Pichincha","LA EMPRESA SE DEDICA AL AGRICULTURA, TENEMOS AREAS COMO POSTCOSECHA, PLAKTA Y EL CAMPO."
VINSOTEL S.A.,Agricultura / Pesca / Ganaderia,"Santa Elena, Santa Elena","EMPRESA DEDICADA A LA COMERCIALIZACION DE INSUMOS ACUICOLAS, ESTAMOS UBICADOS EN LA PROVINCIA DE SANTA ELENA, EDIFICIO ACUACOMERCIO, DIAGONAL AL MUSEO AMANTES DE SUMPA."
COMPANIA DEL AGRO AGROCONTIL CIA LTDA,Agricultura / Pesca / Ganaderia,"Quito, Pichincha","AGROCONTIL CIA. LTDA, somos una empresa que se dedica a la obtencion de registros de libre venta de insumos agricolas (plaguicidas, fertilizantes y afines) en el Ministerio de Agricultura y Ganaderia MAG; tanto en el servicio de Aseguramiento de la calidad del Agro AGROCALIDAD y en la Direccion de Implementacion de Desarrollo Agropecuario DIPA., en el area de registros de fungicidas, insecticidas, nematicidas, herbicidas, fertilizantes, coadyuvantes, enmiendas, bioactivadores, abonos, reguladores de crecimiento, desinfectantes, hidratantes, dispersantes, etc."
Pacificozone S.A.,Agricultura / Pesca / Ganaderia,"Guayaquil, Guayas",Empresa que cuenta con mas de 10 anos en la venta de fertilizante y entre otros insumos agricolas para zona del Litoral y parte de Sierra Ecuatoriana.
RIPOLI S.A.,Agricultura / Pesca / Ganaderia,"Guayaquil, Guayas",EMPRESA DEDICADA A PRODUCCION DE CACAO Y ALQUILER DE MAQUINARIA AGRICOLA MINI-EXCAVADORA Y EXCAVADORA
LUCOA,Agricultura / Pesca / Ganaderia,"El Guabo, El Oro",INDUSTRIA AGRARIA
AVICOLA EL PLACER,Agricultura / Pesca / Ganaderia,"Ambato, Tungurahua",PRODUCCION DE POLLOS DE ENGORDE
Propalcol S.A.,Agricultura / Pesca / Ganaderia,"Guayaquil, Guayas",EMPRESA ENCARGADA DE AGRICULTURA
Inca's Treasure,Agricultura / Pesca / Ganaderia,"Quito, Pichincha",El mayor misterio del imperio de los Incas se encuentra perdido en los Andes - el escondite de su tesoro.
ROSALTEX S.A.,Agricultura / Pesca / Ganaderia,"Cayambe, Pichincha",DEDICADA A EL CULTIVO DE FLORES PARA EXPORTACION EN TABACUNDO ECUADOR
CORPORACION DE FLORICULTORES TABACUNDO,Agricultura / Pesca / Ganaderia,"Pedro Moncayo, Pichincha","EMPRESA VINCULADA AL SECTOR FLORICULTOR DEL CANTON PEDRO MONCAYO, QUE AGREMIOA A VARIAS FLORICOLAS DE TABACUNDO Y CUYA FINALIDAD ES LA DE OFRECER SERVICIOS VARIADOS A SUS SOCIOS"
KOINE S.A.,Agricultura / Pesca / Ganaderia,"Simon Bolivar, Guayas",Somos una empresa dedicada a la produccion y cultivo de Banano. Comercializacion al por mayor y menor de banano. Cuenta con una nomina de 50 trabajadores.
OKROSES S.A.,Agricultura / Pesca / Ganaderia,"Quito, Pichincha","La compania OK ROSES S.A. esta ubicada en Poalo, Cotopaxi - Ecuador a una hora al sur de Quito. Estamos cerca al volcan Cotopaxi, pero en una zona segura, de refugio. Nuestra plantacion esta a 3000 m sobre el nivel del mar. La empresa fue fundada en el ano 2008, pero estamos en el negocio floricola desde 1990."
DITOMAEXPORT S.A.,Agricultura / Pesca / Ganaderia,"Guayaquil, Guayas","Empresa de exportacion de cualquier bien o servicio enviado a otra parte del mundo, con propositos comerciales; es el trafico legitimo de productos nacionales de un pais para su uso o consumo en el extranjero"
TRABOAR,Agricultura / Pesca / Ganaderia,"Machala, El Oro","PRODUCTORA Y EXPORTADORA DE BANANO ORGANICO, TRABOAR S.A. BARRIO 1ER DE ABRIL ONCEAVA NORTE ENTRE ESTERO HUAYLA Y JUNIN, PRODUCTORA Y EXPORTADORA DE BANANO ORGANICO, TRABOAR S.A. BARRIO 1ER DE ABRIL ONCEAVA NORTE ENTRE ESTERO HUAYLA Y JUNIN"
PAREFER S.A.,Agricultura / Pesca / Ganaderia,"Guayaquil, Guayas","EMPRESA ECUATORIANA DE CAPITAL EXTRANJERO CON MAS DE 10 ANOS DE CREACION, COMERCIALIZADORA Y EXPORTADORA DE PRODUCTOS AGRICOLA CON RESIDENCIA EN LA CIUDAD DE GUAYAQUIL."
AGROSOLUTIONS CIA. LTDA.,Agricultura / Pesca / Ganaderia,"Quito, Pichincha",AGROSOLUTIONS CIA. LTDA. somos una empresa productora y exportadora de alimentos congelados. Estamos ubicados en la parroquia de Chavezpamba via San Jose de Minas a 1 h 30min de San Antonio o Calderon. Buscamos Ing. (s) Agronomos con y sin experiencia para cultivo de Frutilla y vegetales
Florana Farms S.A,Agricultura / Pesca / Ganaderia,"Pedro Moncayo, Pichincha","Somos una de las pocas granjas en Ecuador que toma el bienestar de sus clientes como una prioridad por eso nuestras rosas son 80% organicas. Actualmente, ofrecemos mas de 60 variedades super premium de rosas. Estamos constantemente buscando innovar y expandir sus productos para satisfacer las necesidades de nuestros clientes."
Martha Hernandez,Agricultura / Pesca / Ganaderia,"Quito, Pichincha","Empresa ecuatoriana productora de insumos populares utilizados ampliamente en diferentes sectores economicos, que desde hace 15 anos comercializa en forma directa."
LATINFLOR S.A.,Agricultura / Pesca / Ganaderia,"Quito, Pichincha","Empresa agricola productora de flores de verano para mercado local y exportaciones, ubicada en Guayllabamba sector de Chaquibamba con un promedio de 150 empleados"
Seconret,Agricultura / Pesca / Ganaderia,"Guayaquil, Guayas","Empresa productora agricola, dedicada a buscar la excelencia en las actividades que realiza."
MERCALIMSA S.A,Agricultura / Pesca / Ganaderia,"Guayaquil, Guayas","MERCALIMSA S.A. es la empresa formuladora quimica con mas de 15 anos de trayectoria, especializada en lineas de formulacion y produccion agricola e industrial, contamos con un amplio portafolio de materias primas y personal altamente calificado para el desarrollo de las necesidades que los diferentes mercados requieran."
CULTIVEN.COM,Agricultura / Pesca / Ganaderia,"Salinas, Santa Elena","Empresa dedicada a la investigacion, Desarrollo y mercadeo de semillas a nivel internacional, asesoria agricola a nivel industrial, importacion y venta de insumos agricolas, capacitacion y consultoria empresas dedicadas a la produccion agricola, representacion de multinacionales y generacion de registro, promocion y venta de productos biologico de uso agricola."
AGRIBLOOMS,Agricultura / Pesca / Ganaderia,"Quito, Pichincha","VENTA AL POR MENOR DE FERTILIZANTES, BALANCEADOS Y ABONOS EN ESTABLECIMIENTOS ESPECIALIZADOS. COMERCIALIZACION DEL PRODUCTO EN DIFERENTES PROVINCIAS DEL PAIS."
Globanacia,Agricultura / Pesca / Ganaderia,"Samborondon, Guayas",Globanacia tiene mas de 30 anos de experiencia en el cultivo y comercializacion de platanos. Tenemos nuestras propias plantaciones en Ecuador que nos da el control de toda la cadena de suministro desde Ecuador hasta el cliente final. Este acuerdo de abastecimiento directo garantiza una calidad constante y la continuidad del suministro durante todo el ano.
Pespesca,Agricultura / Pesca / Ganaderia,"Montecristi, Manabi",PESPESCA S.A.
Agropecuaria en el austro,Agricultura / Pesca / Ganaderia,"Cuenca, Azuay",comercializacion al por mayor de productos agroveterinarios
BIOEC SA,Agricultura / Pesca / Ganaderia,"Quito, Pichincha","Somos una empresa en desarrollos de productos agricolas y acuicultura en diferentes ciudades del pais. Estamos comenzando nuevos proyectos para realizar exportaciones, nuestro de ambiente de trabajo es muy amistoso y siempre en apoyo del bienestar de los trabajadores."
Bolco s.a.,Agricultura / Pesca / Ganaderia,"Guayaquil, Guayas",venta al por menor de articulos de ferreteria
FERRETERIA Y COMERCIO AGRICOLA NYC,Agricultura / Pesca / Ganaderia,"Ventanas, Los Rios",FERRETERIA
Epicore Ecuador S.A.,Agricultura / Pesca / Ganaderia,"Guayaquil, Guayas","Nuestra matriz e instalaciones de produccion estan ubicadas en Eastampton, Nueva Jersey, E.U. Disenamos, desarrollamos y fabricamos productos de biotecnologia y alimentos especializados innovadores y ambientalmente responsables."
Ecosphaira,Agricultura / Pesca / Ganaderia,"Quito, Pichincha",Empresa dedicada a la produccion de bioinsumos agricolas y biotecnologia
PILOT S.A.,Agricultura / Pesca / Ganaderia,"Guayaquil, Guayas","Pilot S.A. es una empresa dedicada a la produccion de productos naturales en armonia con el ambiente, generando tecnologia basada en la investigacion cientifica para permitir un buen balance entre los aspectos economico, social y ambiental. OKO BCS nos ha certificado como una empresa que cumple con los requerimientos de una compania que practica la produccion organica y sustentable."
Carne Versalle,Agricultura / Pesca / Ganaderia,"General Antonio Elizalde, Guayas",Empresa dedicada a los tipos de corte de carne para la satisfaccion de nuestros clientes
CONSULTORA 'S PYD,Agricultura / Pesca / Ganaderia,"Mejia, Pichincha","Somos una consultora que se necuentra en Desarrollo, nustra compania se encarga de dar soorte a las companias en cuanto al recurso humano que estas necesiten."
Laboratorio Biolab,Agricultura / Pesca / Ganaderia,"La Libertad, Santa Elena",Laboratorio Larvas Camaron
Hacienda Celia Maria,Agricultura / Pesca / Ganaderia,"Guayaquil, Guayas",Actividades de Cultivo de Banano Organico
ECUATORIAN FLOWER,Agricultura / Pesca / Ganaderia,"Pedro Moncayo, Pichincha",PRODUCTORA Y EXPORTADORA DE ROSAS
Hortijardines,Agricultura / Pesca / Ganaderia,"Cayambe, Pichincha",Hortijardines es una pequena floricola ubicada en Cayambe.
Inversiones Gati,Agricultura / Pesca / Ganaderia,"Quito, Pichincha",empresa dedicada a la produccion de alimentos
Soluciones Agricolas y forestales,Agricultura / Pesca / Ganaderia,"Guayaquil, Guayas",Actividades agricolas
Virmax Ecuador,Agricultura / Pesca / Ganaderia,"Quito, Pichincha",Exportadora de cafe
fertisa,Agricultura / Pesca / Ganaderia,"Guayaquil, Guayas",Empresa dedicada a la elaboracion y comercializacion de fertilizantes
Grupo Borja Ulloa,Agricultura / Pesca / Ganaderia,"Quito, Pichincha",Venta de palma africana
QUIMICA SAGAL EC,Agricultura / Pesca / Ganaderia,"Quito, Pichincha","Quimica Sagal Ecuador, es una empreza dedicada a la comercializacion de productos de la mas alta calidad para el sector Agricola e Industrial."
Inversiones Gati,Agricultura / Pesca / Ganaderia,"Quito, Pichincha",empresa dedicada a la produccion de alimentos
Carne Versalle,Agricultura / Pesca / Ganaderia,"General Antonio Elizalde, Guayas",Empresa dedicada a los tipos de corte de carne para la satisfaccion de nuestros clientes
TROPIPALMA S.A.,Agricultura / Pesca / Ganaderia,"San Lorenzo, Esmeraldas",Empresa Agricola. Produce Palma Africana
ASISERVY,Agricultura / Pesca / Ganaderia,"Jaramijo, Manabi",Empresa enlatadora de atun.
Yurimar } lepidium cia. Ltda,Agricultura / Pesca / Ganaderia,"Guamote, Chimborazo","Se necesits de ingeniero agronomo que viva en riobamba, alausi o guamote."
ASOCIACION DE PRODUCCION AGRICOLA MUNDO VERDE ASOPROMUVE,Agricultura / Pesca / Ganaderia,"Machala, El Oro","Hemos logrado muchos objetivos con la conformacion de la Asociacion de Produccion Agricola Mundo Verde (Asopromuve)"", afirma Marcia Minuche, presidenta de una de las nuevas organizaciones que recibio la personeria juridica de parte del Ministerio de Agricultura Ganaderia, Acuacultura y Pesca (MAGAP)."
CORPORACION GOMEZ,Agricultura / Pesca / Ganaderia,"Guayaquil, Guayas","La corporacion Gomez es una empresa dedicada a la plantacion del banano, con 20 anos como industria, se ha convertido en una de las empresas mas importantes del Ecuador en cuanto al rubro del banano se refiere. La organizacion se encarga de la plantacion y posterior exportacion del banano y concentra sus operaciones agropecuarias en la provincia de Los Rios, en especial, Vinces y sus alrededores."
AGRICOLA BEAN & CO LA MEJOR BEANMEJOR S.A,Agricultura / Pesca / Ganaderia,"Guayaquil, Guayas","Somos una Empresa del sector Agricola, con los mas altos estandares de produccion en el Ecuador, establecida en la provincia del Guayas en el sector de via a la costa"
BANAVAN,Agricultura / Pesca / Ganaderia,"Quevedo, Los Rios","Empresa Agricola lider en la produccion de Banano, Palma Aceitera, Maiz , Cacao y Jengibre. Mas de 20 anos en el mercado nos garantizan la confianza con nuestros clientes y proveedores."
Consultores Plantec,Agricultura / Pesca / Ganaderia,"Quito, Pichincha",Plantec nacio como pionero en el ano 1990. Fuimos los primeros en seleccion de variedades de rosas en Latinoamerica para cultivos en esta region y representamos a 5 obtentores de rosas.
GINAFRUIT S.A,Agricultura / Pesca / Ganaderia,"Machala, El Oro","Productora y exportadora de Banano, dedicada el comercio exterior en las zonas de El Oro y Los Rios, somos una de las exportadoras mas grandes del pais"
PROVITAMIN,Agricultura / Pesca / Ganaderia,"Quito, Pichincha",SOMOS UNA EMPRESA QUE BRINDA SOLUCIONES DE FABRICACION DE PREMEZCLAS PARA NUTRICION ANIMAL Y ADEMAS SERVICIOS INTEGRALES PARA PLANTAS DE BALANCEADOS Y GRANJAS
EDYPAC AGROINDUSTRIAL,Agricultura / Pesca / Ganaderia,"Guayaquil, Guayas","EMPRESA DEDICADA AL SERVICIOS DE ANALISIS DE LABORATORIOS ESPECIALIZADOS EN EL AREA DE PRODUCCION AGROINDUSTRIAL. TOMA DE MUESTRAS, INSPECCION DE AREA DE PRODUCCION, ASESORIA IN SITU"
Grupo Quirola,Agricultura / Pesca / Ganaderia,"Guayaquil, Guayas","Agroindustrial, acuicola y presentes en el mercado nacional ecuatoriano desde la epoca del boom bananero, cada dia mejorando e innovando los productos ofrecidos con el sello de garantia."
PESCAEQUIPOS S.A,Agricultura / Pesca / Ganaderia,"Guayaquil, Guayas","Pescaequipos S.A. desde 1982 nos encontramos inmersos en el sector pesquero ecuatoriano , la experiencia nos ha llevado a diversificarnos e innovar hasta convertirnos en lideres de los implementos para la pesca artesanal , industrial y comercial."
DIRECCION DISTRITAL 01D01 PARROQUIAS URBANAS MACHANGARA A BELLAVISTA Y PARROQUIAS RURALES NULTI A SAYAUSI- MAG,Agricultura / Pesca / Ganaderia,"Cuenca, Azuay","Es la institucion rectora del sector agropecuario, encargada de la articulacion de los servicios financieros y no financieros, facilitando el desarrollo de los mercados de servicios no financieros, a traves de la politica publica para la agricultura comercial y la agricultura familiar campesina priorizando los servicios de comercializacion, asociatividad e innovacion, para mejorar las condiciones de vida de la poblacion, garantizando la soberania alimentaria."
