Empresa,Area,Ubicacion,Descripcion
OQS Ecuador,Agricultura / Pesca / Ganaderia,"Quito, Pichincha","OQS Ecuador & Colombia es una empresa enfocada al aseguramiento de calidad de flores para los distintos mercados a nivel mundial. Desde sus inicios en 2010, somos representantes de calidad de prestigiosas empresas importadoras de flores de varios paises, quienes depositan su confianza por el alto analisis tecnico y experiencia profesional con que contamos y ademas reconocidos en el medio floricultor."
Agroflora,Agricultura / Pesca / Ganaderia,"Quito, Pichincha","Somos una empresa que se dedica a la produccion y exportacion de rosas a todo el mundo, con mas de 30 anos en la industria floricola."
CORPOSUCUMBIOS,Agricultura / Pesca / Ganaderia,"Lago Agrio, Sucumbios","CORPOSUCUMBIOS entidad adscrita al GADPS proyectos productivos, dedicada al apoyo al sector productivo de la Provincia de Sucumbios .manejo de Planta de Balanceado"
Edkard,Agricultura / Pesca / Ganaderia,"Machala, El Oro",La empresa Edkard se encuentra ubicada en el km 2.5 via a pasaje .
Queen Corporation S.A.,Agricultura / Pesca / Ganaderia,"Quito, Pichincha",Empresa Internacional dedicada a la comercializacion y exportacion de bienes agropecuarios y bienes de consumo masivo a nivel mundial.
Equinoccio Vegetal EQVEGETAL Cia. Ltda.,Agricultura / Pesca / Ganaderia,"Quito, Pichincha",Empresa dedicada al cultivo y a la produccion de vegetales varios. Se dedica tambien a la exportacion de vegetales a mercados internacionales como EEUU.
SERVICIOS Y REPRESENTACIONES MISELMA S.A.,Agricultura / Pesca / Ganaderia,"Pedro Moncayo, Pichincha","SERVICIOS Y REPRESENTACIONES MISELMA, es una empresa dedicada al cultivo y deshidratacion de diversas frutas y verduras, comercializando nuestros productos s nivel nacional e internacional."
Servicio Integral para la Industria Alimenticia SIPIA S.A.,Agricultura / Pesca / Ganaderia,"Quito, Pichincha","Empresa Industrial ubicada en el Sector de Puembo, en la provincia de Pichincha; dedicada a la venta al por mayor y menor de conservas y otros alimentos enlatados."
SQM ECUADOR S.A.,Agricultura / Pesca / Ganaderia,"Guayaquil, Guayas","PERTENECE AL GRUPO SQM S.A., EMPRESA PRODUCTORA MULTINACIONAL CHILENA, EN ECUADOR SE DEDICA A LA IMPORTACION Y DISTRIBUCION AL POR MAYOR DE FERTILIZANTES."
SMITH TRADING COMPANY EIRL EIRL,Agricultura / Pesca / Ganaderia,"Guayaquil, Guayas","Smith Trading Company es una empresa dedicada a la exportacion de productos del mar peruano de la mas alta calidad, para los mercados de Europa, Norte America y Asia. Nos especializamos en productos congelados, sin embargo le podemos ofrecer algunos productos deshidratados asi como tambien frescos; dependiendo de cual sea su destino."
AGROTORCA S.A.,Agricultura / Pesca / Ganaderia,"Santo Domingo, Santo Domingo de los Tsachilas","Agricultura Tropical Torres Castro somos una empresa dedicada al cultivo, manejo, venta y exportacion de pina MD2 con mas de 10 anos de experiencia en el campo agricola."
BAMBOO EXPORT S.A.,Agricultura / Pesca / Ganaderia,"Milagro, Guayas","BAMBOO EXPORT S.A. BAMPORT es una empresa Agroindustrial dedicada al cultivo de Cana de Azucar, Banano y Cacao, estamos comprometidos con el bienestar y calidad de vida de nuestros trabajadores, el desarrollo de la comunidad y la conservacion del medio ambiente"
Flumpork EC,Agricultura / Pesca / Ganaderia,"Montalvo, Los Rios","La empresa Flumpork EC Cia.Ltda se construye con el proposito de garantizar el desarrollo y comercializacion de cerdos de raza con un excelente cuidado veterinario, estandares de inocuidad y calidad en granja. Asi mismo cree en la vision del gobierno nacional y se alinea al cambio en la matriz productiva, realizando con este proyecto su aporte a la diversificacion dentro de una zona considerada netamente agro, generando desarrollo local al canton Montalvo y la Provincia de Los Rios."
Jorge Velastegui Santillan,Agricultura / Pesca / Ganaderia,"Esmeraldas, Esmeraldas",Compra y venta de mariscos y pesca blanca
Jorge Velastegui Santillan,Agricultura / Pesca / Ganaderia,"Esmeraldas, Esmeraldas",Compra y venta de mariscos y pesca blanca
Asociacion Rancheros del Norte,Agricultura / Pesca / Ganaderia,"Tulcan, Carchi",Es una Asociacion dedicada a la produccion y comercializacion de productos agropecuarios.
Flumpork EC,Agricultura / Pesca / Ganaderia,"Montalvo, Los Rios","La empresa Flumpork EC Cia.Ltda se construye con el proposito de garantizar el desarrollo y comercializacion de cerdos de raza con un excelente cuidado veterinario, estandares de inocuidad y calidad en granja. Asi mismo cree en la vision del gobierno nacional y se alinea al cambio en la matriz productiva, realizando con este proyecto su aporte a la diversificacion dentro de una zona considerada netamente agro, generando desarrollo local al canton Montalvo y la Provincia de Los Rios."
Empresa Camaronera,Agricultura / Pesca / Ganaderia,"Guayaquil, Guayas",Empacadora y exportadora de Camaron
FARMACELLS CIA LTDA,Agricultura / Pesca / Ganaderia,"Quito, Pichincha","VENTA, COMERCIALIZACION Y DISTRIBUCION DE PRODUCTOS VETERINARIOS, SEMEN BOVINO Y SOFTWARE PARA GANADERIAS"
GOLDENFOREST S.A.,Agricultura / Pesca / Ganaderia,"Quito, Pichincha","GOLDENFOREST S.A., es una firma privada calificada radicada en Ecuador que se especializa en el cultivo, explotacion y comercializacion de plantaciones forestales, debidamente regulada y con todas las certificaciones al dia emitidas por los organos de control de esta industria."
AGRICOLA HARVEST&LYN,Agricultura / Pesca / Ganaderia,"Ruminahui, Pichincha","ASESORAMIENTO EN CAMPO DE CULTIVOS DE CICLO CORTO, VENTA Y DISTRIBUCION DE PRODUCTOS AGRICOLAS AMIGABLES CON EL MEDIO AMBIENTE, CONSTRUCCION DE INVERNADEROS Y SISTEMAS DE RIEGO."
DELICAMARONERA SA,Agricultura / Pesca / Ganaderia,"Naranjal, Guayas","Empresa del Sector Camaronero, ubicada en Naranjal, parroquia Taura, sector Montanita. Junta a la Hacienda Fredy Lapenti. Inicio de Actividades diciembre 2017."
Zulac SA,Agricultura / Pesca / Ganaderia,"Ibarra, Imbabura","Industria lactea, especializada en quesos maduros de leche de vaca, presencia en el mercado por mas de 25 anos y proveedor de las principales cadenas de supermercados del pais."
FrescoEcuador,Agricultura / Pesca / Ganaderia,"Guayaquil, Guayas","Empresa Ecuatoriana dedicada a la venta al por mayor de toda clase de insumos agricolas (fertilizantes, herbicidas, enraizadores, insecticidas, hormonas, biologicos) para cultivos."
Valtimgna S.A.,Agricultura / Pesca / Ganaderia,"Guayaquil, Guayas",Empresa industrial domiciliada en el canton Guayas dedicada a la elaboracion y comercializacion al por mayor y menor de la Harina y Aceite de pescado
NATLUK S.A.,Agricultura / Pesca / Ganaderia,"Playas, Guayas",EMPACADORA Y EXPORTADORA DE PRODUCTOS DE MAR.
RASAMFISH S.A,Agricultura / Pesca / Ganaderia,"Manta, Manabi","EMPRESA DEDICADA A LA COMPRA Y VENTA DE PRODUCTOS DEL MAR, UBICADA EN EL KM 4 1/2 VIA MANTA MONTECRISTI, ENTRANDO POR EL ANTIGUO SECAP CIUDADELA LA PRADERA"
Amitec SA,Agricultura / Pesca / Ganaderia,"Guayaquil, Guayas","Empresa dedicada a la fabricacion de componentes estructurales y materiales prefabricados para obras de construccion o de ingenieria civil de hormigon: losetas, losas, baldosas, ladrillos, bloques, planchas, paneles, laminas, tableros, canos, tubos, postes, etcetera para la industria agricola, pesca o ganaderia."
Banaquilsa S.A.,Agricultura / Pesca / Ganaderia,"Guayaquil, Guayas","Nueva compania dedicada a la produccion y exportacion de Banano, con expectativas de expansion en el mercado Ecuatoriano y amplia experiencia en inversiones."
CUENTAS EN PARTICIPACION LANGOSTIORO- COODAESVIR,Agricultura / Pesca / Ganaderia,"Machala, El Oro",Somos una empresa Privada dedicada a la Explotacion de criaderos de camaron
AGRICOLA VICFAR SA,Agricultura / Pesca / Ganaderia,"Guayaquil, Guayas","PRODUCTORA AGRICOLA, ESPECIALIZADA EN EL CULTIVO DE BANANO, UBICADA EN QUEVEDO PROVINCIA DE LOS RIOS, CON OFICINAS DE ADMINISTRACION EN LA CIUDAD DE GUAYAQUIL."
Fitogreen Cia. Ltda.,Agricultura / Pesca / Ganaderia,"Camilo Ponce Enriquez, Guayas","Fitogreen Compania Limitada, se constituyo en el ano 2005, esta conformado su cuerpo directivo por tres socios, quienes acumulan una experiencia de mas de 25 anos en el mercado de los agroquimicos."
Camaronera Agromarina,Agricultura / Pesca / Ganaderia,"Guayaquil, Guayas",Somos una empresa camaronera con mas de 40 anos de Experiencia en Area de Produccion de Camaron.
EUROFISH S.A,Agricultura / Pesca / Ganaderia,"Manta, Manabi","Eurofish S.A., fue creada el 12 de julio de 1998 y comenzo su produccion de lomos congelados precocidos de atun en Septiembre de 1999."
EXPORTADORA DE BANANO AURUMAGRI S.A,Agricultura / Pesca / Ganaderia,"Guayaquil, Guayas","exportadora de banano estructuras comerciales y de produccion en Ecuador, con anos de experiencia en la, comercializacion y exportacion de platanos de alta calidad, cuyo objetivo y filosofia es entregar los mejores platanos al mercado mundia"
Camaronera Agromarina,Agricultura / Pesca / Ganaderia,"Guayaquil, Guayas",Somos una empresa camaronera con mas de 40 anos de Experiencia en Area de Produccion de Camaron.
Industrial Pesquera Junin(JUNSA),Agricultura / Pesca / Ganaderia,"Guayaquil, Guayas","Somos una empresa pesquera dedicada a la produccion, comercializacion y exportacion de harina de pescado. Nos constituimos legalmente desde el ano 1984, siendo nuestro domicilio principal Chanduy canton Santa Elena."
Ultranegos s.a.,Agricultura / Pesca / Ganaderia,"Guayaquil, Guayas",Empresa dedicada a la produccion agricola.
Glavonisa SCC,Agricultura / Pesca / Ganaderia,"Quito, Pichincha",Explotacion comercial de palma aceitera
Ecualand,Agricultura / Pesca / Ganaderia,Pichincha,Exportadora y productora de flores
Dupocsa,Agricultura / Pesca / Ganaderia,"Duran, Guayas","Somos una empresacon 30 anos de experiencia, dedicada a la satisfaccion de la necesidades de nuestros clientes, a traves de la produccion y comercializacion de productos y servicios de alta calidad para la agricultura, operando nuestros procesos productivos con seguridad laboral y responsabilidad al medio ambiente."
Sociedad Ecuatoriana de Biotecnologia,Agricultura / Pesca / Ganaderia,"Guayaquil, Guayas","La compania Sociedad Ecuatoriana de Biotecnologia (SEBIOCA C.A.) es una Biofabrica de produccion y comercializacion de plantas meristematicas de banano, maderables, ornamentales y otras especies vegetales"
Pescayo S.A,Agricultura / Pesca / Ganaderia,"Guayaquil, Guayas","Pescayo S.A. es una empresa eficiente y eficaz, que cuenta con un sistema de siembra y cosecha de camaron altamente controlado que nos permite tener niveles de productividad a nuestra maxima capacidad instalada. Los sistemas de distribucion y entrega en frio, hacia las empacadoras, hacen que nuestro producto se mantenga fresco y sano hasta llegar al lugar de acopio. El control sanitario y bilogico en el proceso de cria del camaron nos permiten tener una talla preferencial en los mercados nacionales."
Biosuper S. A.,Agricultura / Pesca / Ganaderia,"Guayaquil, Guayas",Actividades Explotacion de Criaderos de Camarones (Camaronera)
Banalcarsa,Agricultura / Pesca / Ganaderia,"Guayaquil, Guayas","Tenemos 10 anos en el mercado,producimos banano de exportacion y nos estamos ampliando a otras ramas de la agroproduccion con fines de exportacion.Somos una empresa joven en pleno crecimiento."
BioBox SA,Agricultura / Pesca / Ganaderia,"Ambato, Tungurahua","BIOBOX SA es un laboratorio que produce plantas IN VITRO ( meristematicas)de varias especies, entre estas esta el banano. El Laboratorio esta en la ciudad de Ambato y tambien tiene un vivero en Vinces de donde se distribuye la planta a los compradores"
Jorcorp S.A.,Agricultura / Pesca / Ganaderia,"Guayaquil, Guayas","Empresa dedicada a la exportacion de fruta al Cono Sur desde hace mas de 35 anos. El objetivo es mantener un mercado solido de colocacion de fruta; fortaleciendo las relaciones con los clientes, tanto internos como externos."
Foundcorp S.A.,Agricultura / Pesca / Ganaderia,Guayas,Foundcorp S.A. se dedica a la comercializacion y produccion de banano y venta de maquinaria como bombas y motores para el area agricola.
Alfa riego,Agricultura / Pesca / Ganaderia,"Guayaquil, Guayas","Nuestra empresa se dedica a actividades vinculadas al sector agropecuario, brindando servicios de asesoramiento agropecuario en general, capacitacion, ventas y ejecucion de obras como Diseno de Jardines, instalacion de Sistemas de riego para Fincas, Haciendas o residencial."
Grupo Vegaflor,Agricultura / Pesca / Ganaderia,Pichincha,El grupo Vegaflor es una Empresa Floricola que se dedica al cultivo y exportacion de flores frescas de exportacion.
Dinorder S.A.,Agricultura / Pesca / Ganaderia,"Guayaquil, Guayas","La Empresa es Productora, comercializadora y exportadora de Banano. Nuestro Objetivos es comprometernos en su seguridad y desarrollo personal y profesional del Equipo que se integra a laborar, tiene anos de su creacion por lo que goza de estabilidad en el Mercado Nacional e Internacional"
Pronaca,Agricultura / Pesca / Ganaderia,Pichincha,"Compania de Consumo Masivo, siendo la primera empleadora a nivel nacional,su filosofia es alimentar bien, generando desarrollo en el sector agropecuario de acuerdo a nuestros principios y valores."
Kemble Peru,Agricultura / Pesca / Ganaderia,Tungurahua,"Comercializadora de productos pesqueros a mercados como Europa, America, Asia."
Abiorg - Abono Biologico Organico,Agricultura / Pesca / Ganaderia,"Samborondon, Guayas","Empresa dedicada a la actividad agricola, importacion, exportacion, comercializacion. Fabricamos mezclas fisicas para todo tipo de suelos."
Andean Growers,Agricultura / Pesca / Ganaderia,Pichincha,Empresa agroexportadora de todo tipo de flores frescas estara iniciando operaciones en EcuadorR
Agribusiness Ecuador,Agricultura / Pesca / Ganaderia,"Quito, Pichincha","Agronegocios y Tecnologia AGRIBUSINESS ECUADOR CIA. LTDA., es fundada en julio del 2008 con el objetivo de generar y difundir informacion tecnica y comercial relevante en el ambito agropecuario, a traves de varios conceptos, tanto digitales, visuales e impresos, los cuales se constituyan en un aporte importantisimo a las actividades diarias de produccion de los empresarios agropecuarios."
Agrodi S.A.,Agricultura / Pesca / Ganaderia,"Guayaquil, Guayas",Somos una empresa de la Industria Avicola. Dedicada a la venta por mayor de aves de corral y de productos carnicos.
Agroberruz S.A.,Agricultura / Pesca / Ganaderia,"Guayaquil, Guayas","AgroAmerica es una corporacion familiar lider en productividad, rentabilidad y responsabilidad social, fundada en 1958. AgroAmerica, una de las empresas mas importantes en el area agroindustrial de Guatemala y el mundo, opera en Centroamerica, Panama y Ecuador y cuenta con mas de 8.000 empleados, quienes dia a dia aportan efectivamente al proceso de desarrollo socioeconomico de la region y el pais. Nuestras principales areas de negocio se centran en la produccion y exportacion de banano, con su respectivo servicio de transporte y logistica, en la comercializacion de pina y en la produccion y procesamiento de aceite de palma. Ademas manejamos un portafolio de inversiones en la region que incluye la alianza estrategica con empresas de entretenimiento y comida rapida. Mision Ser una empresa familiar de clase mundial en la agroindustria de la region, y aportar al proceso de desarrollo socioeconomico del pais y la region. Vision Desarrollar una compania agroindustrial, lider a nivel mundial, en calidad, rentabilidad y responsabilidad social."
Agro100cias,Agricultura / Pesca / Ganaderia,Pichincha,Agroquimicos
Cafecom S.A.,Agricultura / Pesca / Ganaderia,"Guayaquil, Guayas",Somos una empresa comercializadora de gafe de exportacion.
Estevia Peninsular S.A.,Agricultura / Pesca / Ganaderia,Guayas,Empresa dedicada a la produccion agricola
Camaronera San Jose C LTDA,Agricultura / Pesca / Ganaderia,El Oro,"Somos un grupo dedicado a la cria de camaron blanco (Litopenaeus vannamei) en cautiverio, trabajamos con un sistema de produccion semi-intensivo, tenemos una produccion de 2000 Lbs/Ha. con pesos promedios que oscilan entre 15 y 23 grs. Ubicada en Puerto grande, Provincia de El Oro, Cuenta con mas de 130 Hectareas en 8 Piscinas, este hectareaje nos permite producir mas de 400 mil libras anuales que finalmente se lo exporta hacia Europa y America del Norte."
Camaronera Deli s.a.,Agricultura / Pesca / Ganaderia,Guayas,Camaronera
Denmar S.A.,Agricultura / Pesca / Ganaderia,Pichincha,Importante Empresa del sector Floricola
Hojas Vivas S.A,Agricultura / Pesca / Ganaderia,"Quito, Pichincha","Empresa Floricola, con una trayectoria de 10 anos en el mercado de exportacion. Nuestro producto es una variedad especial de flores de Verano. Carecterizados, por buscar innovaciones, en certificaciones, parametros de calidad altamente confiables, ara garantizar la satisfaccion de nuestro cliente.Sin dejar de velar por el buen trato de nuestro recurso Humano."
Campotrack S.A.,Agricultura / Pesca / Ganaderia,"Guayaquil, Guayas","Campo-Track es una empresa especializada en precision de nutricion vegetal, brindando soluciones tecnico-cientificas mediante bioformulacion de nutrientes en base a los requerimientos especificos de cultivos tropicales. Innovacion y tecnologia en determinacion - programa de nutrientes en tiempo real. asesorias en Nutricion Agricola y post cosecha."
Cittadella S. A.,Agricultura / Pesca / Ganaderia,"Duran, Guayas",Somos una empresa que provee servicios de frigorifico industrial y venta de carnicos al por mayor y menor.
La Clementina,Agricultura / Pesca / Ganaderia,"Babahoyo, Los Rios",Empresa Agroindustrial dedicada a la produccion y exportacion de banano.
Ceres Farms,Agricultura / Pesca / Ganaderia,Pichincha,"Empresa Floricola con 20 anos de experiencia en produccion y ventas, con un alto nivel de calidad dentro del mercado internacional."
Corporacion Corpy S.A.,Agricultura / Pesca / Ganaderia,"Guayaquil, Guayas",Empresa dedicada al tratamiento de larvas en laboratorio.
Ganagricola,Agricultura / Pesca / Ganaderia,Tungurahua,"Produccion lactea, crianza de vaconas,cultivo de papa."
Gramilesa,Agricultura / Pesca / Ganaderia,"Duran, Guayas",Grupo camaronero / agricola / industrial / laboratorio de larvas
Point del Ecuador,Agricultura / Pesca / Ganaderia,"Ambato, Tungurahua",Empresa dedicada a la importacion y comercializacion de plaguicidas.
Agropiscis S.A,Agricultura / Pesca / Ganaderia,"Guayaquil, Guayas","Empresa Agricola de arroz, platano, cacao"
Finaves S.A,Agricultura / Pesca / Ganaderia,"Guayaquil, Guayas","Se dedica al procesamiento de pollo de engorde para comercializacion, ademas de ofrecer: Autoservicio con especialidad en carnes Pollo y todos sus cortes Res y cerdo en todas sus variedades Embutidos Amplio surtido en productos de primera necesidad"
Floricola en Lasso,Agricultura / Pesca / Ganaderia,"Latacunga, Cotopaxi","Empresa dedicada a la Produccion y Comercializacion de Rosas, desde hace mas de 15 anos."
Industrial Olivas Gaitan,Agricultura / Pesca / Ganaderia,Pichincha,Importante Industria en PRODUCCION DE LACTEOS con mas de 20 anos en el MERCADO DEL ECUADOR
Hacienda Santa Fe Cia. Ltda.,Agricultura / Pesca / Ganaderia,"Quito, Pichincha","Somos una empresa de produccion y exportacion de rosas y otras flores frescas cortadas, con operaciones desde 1993, con mercados en USA, Rusia y Europa, ubicada en Pifo. mail: ********@hstafe.com.ec"
L.P. Marcelo Pacheco,Agricultura / Pesca / Ganaderia,Pichincha,Empresa Avicola lider en el mercado
Larriva Duenas y Asociados,Agricultura / Pesca / Ganaderia,"Quito, Pichincha",LARRIVA & CO es una empresa que se dedica a dar Asesoria Regulatoria
Hacienda La Carmela,Agricultura / Pesca / Ganaderia,"Cuenca, Azuay","Hacienda Ganadera situada en San Fernando, Azuay. Se dedica a producir y vender leche que se comercializa en Guayaquil. Las oficinas estan situadas en la ciudad de Cuenca. Esta empresa viene produciendo y operando por alrededor de 40 anos."
WSS World Survey Services Ecuador S.A.,Agricultura / Pesca / Ganaderia,"Guayaquil, Guayas","World Survey Services S.A. es una empresa transnacional chilena con mas de 20 anos de experiencia en el mercado de las inspecciones, control de calidad, certificaciones, servicios de ingenieria, saneamiento y fumigaciones. Actualmente WSS cuenta con oficinas en los principales puertos de trafico internacional de Chile. Asimismo, tenemos cobertura internacional con oficinas propias en Peru, Ecuador, Venezuela, Mexico y Colombia, brazos operativos en Argentina y Brasil, y corresponsales en Mexico, USA, Panama, Vietnam, India, Pakistan, Malasia, Indonesia  y China, y demas agencias en los principales puertos del Mundo. Envia tu CV a ********@wss.ec"
CPA. Lupe Bermeo MacGregor,Agricultura / Pesca / Ganaderia,"Guayaquil, Guayas",Finca Camaronera y Cacao
Floricola La Rosaleda,Agricultura / Pesca / Ganaderia,Cotopaxi,"La Rosaleda S.A. es una compania que se dedica a la produccion y exportacion rosas cortadas de la mas alta calidad. Esta situada en la hermosa area de Cotopaxi en Ecuador, a 3.050 metros (10.000 pies) sobre el nivel del mar y cuenta con el clima ideal para la produccion de rosas de calidad premium."
Llaguno Cia Ltda,Agricultura / Pesca / Ganaderia,"Duran, Guayas",Especialidades Farmaco veterinarias Llaguno Cia Ltda. empresa dedicada a la comecializacion de productos veterinarias agricolas
Rotehu,Agricultura / Pesca / Ganaderia,"Quito, Pichincha","Comercializacion productos agricolas , productos de colmena, abonos organicos"
Ralco Nutritions,Agricultura / Pesca / Ganaderia,"Cuenca, Azuay","Nos dedicamos a la comercializacion de productos para agricultura, ganaderia, pesca, porcicultura, avicultura, acuacultura y mas"
Flormundo,Agricultura / Pesca / Ganaderia,Pichincha,Floricola dedicada a la produccion y exportacion de flores de alta calidad
Ecuaorganic,Agricultura / Pesca / Ganaderia,Pichincha,"Somos una empresa lider en la produccion de productos organicos, llevamos en el mercado nacional mas de 10 anos, tambien exportamos a mercados internacionales."
South Tropical,Agricultura / Pesca / Ganaderia,Los Rios,"Produccion, acuacultura, importacion distribucion."
Ecobis,Agricultura / Pesca / Ganaderia,"Guayaquil, Guayas",Empresa de consultoria Agricola con fundamentos en Agricultura de precision
Kaplant,Agricultura / Pesca / Ganaderia,"Guayaquil, Guayas",Empresa dedicada a la expotacion de camaron.
Tradefloral S.A.,Agricultura / Pesca / Ganaderia,"Guayaquil, Guayas","Tradefloral S.A. es una finca productora y exportadora de Flores Tropicales, Bouquets y Follajes Tropicales,"
Tratec SA.,Agricultura / Pesca / Ganaderia,"Samborondon, Guayas",Somos una empresa dedicada a la importacion y comercializacion de insumos agropecuarios
Pablo Carrion,Agricultura / Pesca / Ganaderia,"Milagro, Guayas","Solicito personal femenino con conocimientos contables, no es indispensable experiencia, solo copia acta de grado o bachiller, disponibilidad de viajar entre guayaquil y milagro, debera tratar con personal para llevar a cabo ,contratos trabajo, manejo de roles de pago, tramites iess, min. rel.laborales, pago proveedores y manejo archivos, disponibilidad de trabajo tiempo parcial o tiempo completo."
Phillips Seafood Of Ecuador,Agricultura / Pesca / Ganaderia,"Guayaquil, Guayas","Empresa Exportador de Marisco, con mas de 10 anos en el Mercado"
Phytotech S.A.,Agricultura / Pesca / Ganaderia,Pichincha,Laboratorio de Plantas Meristematicas de Banano
Servicios Provemundo,Agricultura / Pesca / Ganaderia,Pichincha,"Empresa dedicada a la produccion de Palma Africana, ubicada en la Provincia de Esmeraldas."
Productos San Cristobal,Agricultura / Pesca / Ganaderia,"Quito, Pichincha","Empresa constituida en el ano de 1995, contamos con una planta procesadora de productos del mar, en Galapagos y otra en Quito, disponemos de un barco pesquero de 30 metros de largo."
Flores del Valle Cia.Ltda.,Agricultura / Pesca / Ganaderia,"Cayambe, Pichincha","Valleflor empresa lider en el sector Floricola, decicada al cultivo de Flores de Verano; La vision de Valleflor es crear oportunidades de trabajo y crecimiento a nuestros colaboradores, para con ellos desarrollar ventajas competitivas que perduren en el tiempo y que generen valor a todos quienes hacemos Valleflor."
Solagro S.A Solagremsa,Agricultura / Pesca / Ganaderia,Pichincha,Prestijiosa empresa que se dedica a la importacion y comercializacion de agroquimicos.
Biobox,Agricultura / Pesca / Ganaderia,"Ambato, Tungurahua","Laboratorio de Biospeansion, con metas definidas claras de empuje liderazgo, compromiso donde bisca fortalecer sus bases pero sobretodo cuida el recurso humano que considera fundamental para general beneficios y poderse expandir exitosamente."
Agroreprain S.A.,Agricultura / Pesca / Ganaderia,"Quito, Pichincha","AGROREPRAIN, compania quimica y alimentaria. Entre otros productos elabora y desarrolla bactericidas y fungicidas organicos, preservantes florales, biocidas para la agricultura, biocidas para la acuacultura, preservantes para madera y bactericidas para el procesamiento industrial del papel. En la rama alimentaria ofrece ajo en pasta, fruta confitada y colorantes para panificacion."
Ecucarsa,Agricultura / Pesca / Ganaderia,"Guayaquil, Guayas",apicultura
PESQUERA DE GENNA FERNANDEZ,Agricultura / Pesca / Ganaderia,"Manta, Manabi",EMPRESA DEDICADA A LA PESCA MARITIMA Y CONTINENTAL DE PECES
FRIGOLANDIA,Agricultura / Pesca / Ganaderia,"Guayaquil, Guayas",Exportadora de productos del mar
Corporacion Nacional de Bosques y Reservas Privadas del Ecuador,Agricultura / Pesca / Ganaderia,"Quito, Pichincha",Empresa dedicada a la conservacion de los bosques y reservas privadas (medio ambiente )
Agroimexpro,Agricultura / Pesca / Ganaderia,"Cuenca, Azuay",Agroimexpro es una importadora y distribuidora directa de productos e insumos agricolas
